RER D : Paris Lyon-Juvisy 11,18 et 25 oct Des travaux de maintenance des installations modifient la circulation de certains trains sur la ligne D du RER, axe Paris Gare de Lyon - Corbeil Essonnes - Malesherbes et Paris Gare de Lyon - Juvisy - Melun, les samedis 11, 18 et 25 octobre 2014, de 06 heures à 20 heures.SNCF Transilien
Ligne J : Paris-Conflans-Mantes 11 et 12 octobre Des travaux en gare de Poissy modifient la circulation des trains sur l'axe Paris Saint Lazare / Mantes la Jolie via Conflans Sainte-Honorine dans les deux sens, le samedi 11 et le dimanche 12 octobre 2014, toute la journée. Un allongement du temps de parcours de 10 minutes environ est à prévoir. SNCF Transilien
TRAMWAY T5 : Trafic interrompu En raison d'un incident voyageur, le trafic est interrompu entre les arrêts GARGES-SARCELLES RER et LES CHOLETTES. 
Quincy-sous-Sénart - Tvx prolongés Route de Boussy Nous vous informons que_ les travaux sont prolongés_ Route de Boussy-saint- Antoine à Quincy-sous-Sénart jusqu'au dimanche 12 octobre. L'arrêt :  * "G. Bizet" est supprimé.  * Les arrêts les plus proches sont "Centre Commercial (ligne Express 91.01) et Gare".Merci de votre compréhension.
Ligne J: dessertes modifiées pour bus de nuit. Fête du Fromage à Meulan. Les bus de nuits de la ligne MANTES/LES MUREAUX/CONFLANS, ne marquent pas les arrêts suivants dans les 2 sens:- THUN-LE-PARADIS- MEULAN ARQUEBUSE- MEULAN HARDRICOURTla nuit du samedi 11 au dimanche 12 octobre 2014.La déviation mise en place pourra engendrer un retard allant jusqu?à 25 minutes.SNCF Transilien
Ligne L: suppressions axe Versailles Rive Droite Trains immobilisés en ateliers de maintenance sur la ligne L. Les trains suivants sont supprimés :Paris St-Lazare 15h14 - Versailles Rive Droite 15h42, mission VALE.Versailles Rive Droite 16h04 - Paris St-Lazare 16h32, mission PILS. SNCF Transilien
info trafic du 11/10/2014 : Le trafic est normal sur l'ensemble des réseaux Sénart Bus, Sénart Express et sur la ligne Tzen1. Bonne journée.
