Ligne L : trafic ralenti axe Cergy  jusqu'à 20h00 Incident affectant la signalisation à Maisons Laffitte, sur la ligne A du RER, impactant la ligne L.Un allongement du temps de parcours de 10 à 20 minutes est à prévoir sur l' axe :- Paris St-Lazare - Cergy Le HautUn retour à la normale est prévu vers 20h00.SNCF Transilien
Ligne H: suppressions des trains Paris-Sarcelles Difficultés de circulation dûes à un dysfonctionnement des télécoms, entre les gares de Sarcelles Saint-Brice et Montsoult Maffliers sur la ligne H.Une adaptation de la circulation des trains est nécessaire.Les trains SOGA (Paris Nord - Sarcelles Saint-Brice) et AOGA (Sarcelles Saint-Brice - Paris Nord) sont supprimés.Les trains LEVA (Paris -Luzarches) et PEDA (Paris - Persan Beaumont via Montsoult Maffliers) desservent toutes les gares du parcours.En conséquence, prévoir un allongement du temps de parcours de 10 à 15 minutes et des modifications ponctuelles de desserte sur les axes :- Paris Nord - Luzarches - Paris Nord - Persan Beaumont via Montsoult MaffliersLe service devrait rester perturbé jusqu'en fin de service .SNCF Transilien
Urbain de Rambouillet  A PARTIR DU 03 NOVEMBRE 2014 VOTRE RESEAU EVOLUE !-Création d'une nouvelle ligne D,-Prolongement de la ligne E- Arrêt "LORIN" supprimé. Se reporter aux arrêts "VIEIL ORME" ou " 3 SEIGNEURS" en face de Toyota,-Horaire valable toute l'année.Retrouvez l'info en cliquant à droite de l'écran sur _INFO RESEAU 03 NOV 2014_
Brie Comte Robert - Travaux  En raison de travaux rue des Tanneries, une déviation est mise en place _de 9h à 16h30._Vers Ambroise Paré et ZI Villemenon, les arrêts Place des Minimes,  Maison pour Tous et Petit Bicêtre sont reportés aux arrêts Place des Fêtes et Rendez Vous Chateau.Nous vous remercions de votre compréhension.
Bus TVO Ligne 9 - Sartrouville Tvx rue J.Nicolle - En raison de la création d'un raccordement sous trottoir sur la rue Jean Nicolle à Sartrouville,du jeudi 30 octobre 2014 au Vendredi 14 novembre 2014 (de 8h30 à 16h30) de légers retards sont à prévoir.Nous vous remercions de votre compréhension.
Déviation ligne 30  En raison de travaux de voirie, l'avenue de l'Etang est fermée de 08h00 à 17h00. L'arrêt "Victor Hugo" n'est pas desservi. Nous vous conseillons de vous reporter à l'arrêt "Orangerie".L'arrêt Guibert n'est pas desservi. Nous vous conseillons de vous reporter à l'arrêt "Guibert" de la ligne 426 sur l'avenue Duchesne.Nous vous remercions de votre compréhension.
 Limeil-Brévannes - Travaux Avenue  Nous vous informons qu'en raison des travaux Avenue Descartes à Limeil- Brévannes dans la nuit du jeudi 30 au vendredi 31 octobre de 21h00 à 6h00, une déviation est mise en place. Les arrêts :  * "Parc de Limeil" est reporté à l'arrêt pour la ligne J1 "E. Combes" J2 direction Boissy (Rue Georges Clémenceau) et pour la ligne J2 "E. Combes" J2 direction Villeneuve St Georges (Avenue Descartes).  * "H. Gagny" est reporté à l'arrêt provisoire pour la ligne J1 - Rue Eugene Varlin (avant le Rond-Point) et pour la ligne J2 - Avenue de Valenton (avant le Rond-Point).Merci de votre compréhension.
BUS TVO Ligne 9,8,4 et 2: défilé halloween Eraison du « défilé d'Halloween » à Argenteuil, Le jeudi 30 octobre 2014 de 18h00 à 19h00 vos lignes 2, 4, 8 et 9 sont déviées dans les 2 sens.Pour plus d'informations merci de consulter le site http://www.transdev-idf.com/horaire-ligne-9-r'bus_016.Nous vous remercions de votre compréhension
Ligne L : Noisy - St Germain interrompu Incident d'exploitation (panne de la liaison radio entre le conducteur du train et le poste de régulation des circulations) sur la ligne L, axe Noisy le Roi - Saint-Germain en Laye Grande Ceinture.Par mesure de sécurité, la circulation des trains est momentanément interrompue.SNCF Transilien
T3a: trafic ralenti (Pont du Garigliano - Porte de Vincennes) : En répercussion d'un malaise voyageur, le trafic est ralenti sur la ligne. Trafic normal sur les autres lignes de Tramway. 
LIGNE 4 : Trafic ralenti En raison de la présence d'un colis suspect, le trafic est ralenti sur la ligne. 
Aucun bus ligne 469   Nous vous rappelons que la ligne 469 ne circule pas les jours fériés. Ainsi, le samedi 1er novembre 2014 il n'y aura aucun bus de la ligne 469.Nous vous remercions de votre compréhension.
Ligne J : dessertes modifiées Ermont/Cormeilles Des incidents techniques sur des trains perturbent le trafic sur la ligne J.Les trains suivants sont supprimés sur les axes :*Paris Saint-Lazare - Cormeilles en Parisis :- Cormeilles en Parisis, départ : 18h39 - Paris Saint-Lazare, arrivée : 19h00 RER D : Paris - Orry la V ralenti jusqu'à 21h30 Panne d'un train en gare de Survilliers Fosse sur la ligne D du RER.Cet incident est terminé. Cependant un allongement du temps de parcours de 10 à 15 minutes est à prévoir dans le sens Paris - Orry la Ville jusqu'à 21h30.SNCF Transilien
LIGNE 8 - itinéraire limité - travaux En raison de travaux imprévus au niveau de la mairie de Verrieres le Buisson ce jeudi matin, la ligne 8 est perturbée. Le terminus se fera provisoirement à l'arrêt ABREUVOIR.L'arrêt ci-dessous ne sera pas desservi pendant toute la durée de laperturbation:  * VERRIERES LE BUISSON MAIRIE (report sur l'arrêt Abreuvoir).Retour à la normal prévu pour 12h.Nous vous tiendrons informé de l'évolution de la situationMerci de votre compréhension.
Ligne J : retards Mantes la Jolie via Poissy Incident affectant la signalisation à Vernouillet Verneuil sur la ligne J.Prévoir un allongement du temps de parcours de 10 à 15 minutes, dans les deux sens, sur l'axe :- Paris Saint-Lazare - Mantes la Jolie - via Poissy.Un retour à la normale est prévu pour 14h00.SNCF Transilien
PROLONGATION Arrêt 'Gare de Rueil RER' déplacé Suite à des imprévus au niveau de l'avancé des travaux d'aménagement de la gare de Rueil, l'arrêt "Gare de Rueil RER" est déplacé Avenue Albert 1er jusqu'au mois de Février 2015. Un passage souterrain situé à l'intérieur de "l'Arche du Patio" vous permet de relier le nouvel arrêt avec la gare.
Grisy-Suisnes - Travaux  En raison de travaux à Grisy Suisnes, une déviation est mise en place.Dans les deux sens, l'arrêt Maréchal Joffre est reporté aux arrêts provisoires situés sur la RD319.Vers Guignes, l'arrêt Village est reporté à l'arrêt Village vers Boissy saint Léger.Nous vous remercions de votre compréhension.
Manifestation publique le 2/11: bus RATP perturbés A noter le Dimanche 2 novembre, une manifestation sur la voie publique : De 8hoo à 14hoo, tournage de film avenue de l'Opéra fermée de la rue de la Paix jusqu'à la rue de l'Échelle.  Lignes de bus perturbées dans ces secteurs : 21, 27, 29, 68, 81 et 95. 
Ligne H : Pontoise - Creil du 13 oct au 13 déc. Horaires d'automne sur l'axe Pontoise - Creil du 13 octobre au 13 décembre 2014. SNCF Transilien.
Travaux Avenue de Verdun à Arpajon Nous informons notre aimable clientèle qu?en raison de travaux Avenue de Verdun et des interdictions de circuler sur la commune d?ARPAJON, les jeudi 30 Octobre 2014 etEt vendredi 31 Octobre 2014 inclus,Les arrêts HOPITAL, LONGUE MARE et LA VOIE CREUSE ne pourront pas être desservis dans les 2 sens de circulation. L?arrêt PORTE D?ETAMPES sera reporté à l?arrêt du même nom situé Rue A. Briand (arrêt Albatrans).
