RER D : Corbeil/Paris ralenti Axe concerné :Corbeil Essonnes/Evry Courcouronnes/ParisPrévoir 10 à 15 minutes supplémentaires de trajet, dans ce sens.Fin des ralentissements estimée à 09h30.Motif : panne d'un train à Viry Châtillon (incident terminé).SNCF Transilien
RER E : Haussmann/Villiers ralenti Axe(s) concerné(s) :Paris Haussmann Saint Lazare/Villiers sur Marne.Prévoir 10 à 15 minutes supplémentaires de trajet, dans les deux sens.Fin des ralentissements estimée à 15h00.Motif : incident affectant la voie à Villiers sur Marne.SNCF Transilien
RER D : Melun - Corbeil ralenti Axe(s) concerné(s) :Melun - Corbeil EssonnesReprise progressive du trafic entre Corbeil-Essonnes et Melun, dans les deux sens.Prévoir 10 à 30 minutes supplémentaires de trajet.Fin des ralentissements estimée à 21h00.Motif : panne d?un train à Boissise le Roi (incident terminé).SNCF Transilien
Ligne L : Paris / Cergy le Haut ralenti Axe concerné :Paris / Cergy le HautPrévoir jusqu'à 20 minutes supplémentaires de trajet, dans les deux sens.Fin des ralentissements estimée à 20h00.Motif : incident affectant la voie à Sartrouville (incident terminé) et entre Maisons Laffitte et Achères Ville.SNCF Transilien
RER A : Nation non desservi Axe(s) concerné(s) :Ensemble de la ligne.Nation non desservi, dans les deux sens.Motif : bagage abandonné à Nation.Arrêt à nouveau desservi à partir de 11h00.SNCF Transilien
RER A : Paris / Cergy le Haut / Poissy ralenti Axe concerné :Paris/Cergy le HautParis/PoissyPrévoir jusqu'à 15 minutes supplémentaires de trajet, dans les deux sensFin des ralentissements estimée à 20h30.Motif : incident affectant la voie à Sartrouville (incident terminé) et entre Maisons Laffitte et Achères Ville.SNCF Transilien
Ligne K :  suppression Mitry / Crépy en Valois Axe concerné : - Paris - Crépy en ValoisTrain supprimé : - Crépy en Valois, départ 14h20 - Mitry Claye, arrivée 14h53Ligne L : Paris - St Nom la Bretèche ralenti Axe(s) concerné(s) :- Paris / Saint-Nom la Bretèche Forêt de Marly- Paris - Versailles Rive DroitePrévoir 10 à 15 minutes supplémentaires de trajet, dans les deux sensFin des ralentissements estimée à 20h00.Motif : incident affectant la voie à Louveciennes (incident terminé).SNCF Transilien
PERTURBATIONS DU 15 JUIN AU 27 NOVEMBRE 2015  Ligne 30-09 : Nous informons notre aimable clientèle qu'en raison de travaux de voirie avenue Boule et avenue Claude Sommer sur la commune de Beauchamp du 15 juin au 27 novembre 2015, les arrêts "Marronniers", "Barrachin" et "Saint-Prix" ne seront pas desservis. Veuillez vous rendre à l'arrêt "Rond-Point de la Chasse" ou à l'arrêt provisoire situé à l'angle des avenues des Marronniers et Claude Sommer. Merci de votre compréhension. 
Ligne L : Paris/Cergy ralenti Axe(s) concerné(s) :Paris/Cergy le HautPrévoir 10 à 20 minutes supplémentaires de trajet, dans les deux sens.Fin des ralentissements estimée à 09h30.Motif : incident affectant la voie à Achères.SNCF Transilien
Ligne H : Trafic ralenti Axe(s) concerné(s) :Ensemble de la lignePrévoir 15 à 20 minutes supplémentaires de trajet, dans les deux sens.Fin des ralentissements estimée à 10h30.Motif : dysfonctionnement d?un passage à niveau à Taverny et feu aux abords des voies à Epinay Villetaneuse (incidents terminés).SNCF Transilien
RER A : trafic ralenti Axe(s) concerné(s) :Ensemble de la ligne.Prévoir 10 à 20 minutes supplémentaires de trajet, dans les deux sens.Fin des ralentissements estimée à 13h00.Motif : bagages abandonnés à La Défense et à Nation (incidents terminés).SNCF Transilien
RER C : trafic ralenti le 11 juin Axes concernés :Ensemble de la ligne.Prévoir un allongement du temps de trajet, dans les deux sens, entre 12h00 et 20h00.Un transport routier est mis en place entre Dourdan et Dourdan la Forêt, dans les deux sens de circulation, de 13h50 à 17h50.Motif : forts écarts de température nécessitant une surveillance spécifique des voies (risque de dilatation des rails). SNCF Transilien
Ligne J : Paris/Ermont-Conflans ralenti Axes concernés :Paris / Ermont EaubonneParis / Pontoise/GisorsParis / Mantes la Jolie via Conflans Fin d'OisePrévoir jusqu'à 45 minutes supplémentaires de trajet, dans les deux sens entre Paris Saint-Lazare et Ermont Eaubonne car un train sur 3 circule sur cet axe.Pour se rendre à Ermont Eaubonne, il est conseillé d'emprunter la ligne H à Paris Nord ou le RER C.Fin des ralentissements estimée à fin de service.Motif : incendie ayant endommagé des installations techniques à proximité de la gare de Bois-Colombes.SNCF Transilien
13 Juin: Manifestation - BUS RATP PERTURBES A partir de 11h30, rassemblement Place de la République puis défilé par les Bd Saint-Martin, Saint-Denis, Bonne Nouvelle, les rues Poissonnière, P.Carreaux, Montorgueil, E. Marcel, rue aux Ours, Beaubourg, rue du Renard, Archives, rue Haudriettes, rue du Temple, et place de la République où aura lieu la dislocation du cortège vers 19h30 environ. Lignes de Bus déviées dans ce secteur: 20, 29, 38, 39, 47, 48, 56, 65 et 75. 
DEVIATION PERTURBATION LIGNE 38.01-TRAVAUX RUE D'EAUBONNE Du mercredi 10 juin 2015 au jeudi 11 juin 2015Travaux rue d'Eaubonne à Margency.Direction Eaubonne :L'arrêt "Chalet" à Margency ne sera pas desservi.Nous vous conseillons de vous reporter à l'arrêt "Louis Armand".Direction Mairie de Montlignon :Itinéraire normal.Merci de votre compréhension.
Arrêts reportés Du mercredi 10 juin au vendredi 3 juillet 2015, suite à des travaux rue Curie à Saclay, les arrêts RD 446 HEC, Ampère Curie et Pasteur Curie ne pourront plus être desservis - consultez www.phebus.tm.fr pour plus de renseignements
Metro 9 Trafic ralenti : (Pont de Sèvres - Mairie de Montreuil) : En répercussion d'une panne de signalisation, le trafic est ralenti sur l'ensemble de la ligne. 
Métro 4 Trafic perturbé : (Porte de Clignancourt – Mairie de Montrouge) : En raison d'un voyageur sur les voies à Gare du Nord, le trafic est interrompu entre Barbès Rochechouart et Réaumeur Sébastopol. Reprise estimée vers 15h20. 
Ligne H : Paris - Valmondois ralenti Axe concerné :- Paris / Persan Beaumont via ValmondoisPrévoir 10 à 20 minutes supplémentaires de trajet dans les deux sens.Fin des ralentissements estimée à 20h00.Motif : actes de malveillance (jets de pierres à proximité de la gare d'Ermont Halte et tir de projectile vers Bessancourt) .SNCF Transilien
