RER C: Versailles Chantiers - Massy trafic ralenti Axes concernés :Versailles Chantiers - Paris via Massy Palaiseau (codes mission CIME et VICK)Prévoir 10 à 30 minutes supplémentaires de trajet, dans les deux sens.Fin des ralentissements estimée à 21h00.Motif: bagage abandonné à Versailles Chantiers (incident terminé).SNCF Transilien
Métro Ligne 2 : trafic ralenti En raison d'une intervention des équipes techniques, le trafic est ralenti sur la ligne. 
Ligne N : Paris - Dreux du 02 au 21 mars Des travaux de maintenance des voies modifient la circulation des trains de l'axe Paris Montparnasse - Dreux, les nuits du lundi 02 / mardi 03 au vendredi 06 / samedi 07 mars et les nuits du lundi 16 / mardi 17 au vendredi 20 / samedi 21 mars 2015 à partir de 22h55. Pendant les travaux, covoiturez avec , Transilien vous rembourse.SNCF Transilien
RER D : Villeneuve StG - Paris 02 au 06 mars Des travaux modifient la circulation des trains entre Villeneuve Saint-Georges et Paris Gare de Lyon, les soirées du lundi 2 au vendredi 6 mars 2015, à partir de 23h10.La gare du Vert de Maisons n'est pas desservie dans le sens Villeneuve Saint-Georges - Paris et des bus sont mis en place à partir de Créteil Pompadour pour Maisons Alfort ou Paris Lyon.Pendant les travaux, covoiturez avec iDVROOM, Transilien vous rembourse.
RER C : Invalides-Dourdan ralenti. Axe concerné :Paris/Dourdan la ForêtReprise progressive du trafic entre Brétigny et Dourdan la Forêt dans les deux sens.Prévoir 15 à 30 minutes supplémentaires de trajet.Fin des ralentissements estimée à 14h30.Motif : obstacle sur la voie à Breuillet Bruyères le Châtel.SNCF Transilien
Ligne U: Versailles Chantiers non desservi Axe concerné:Ensemble de la ligne. non desservi dans les deux sens.Arrêt à nouveau desservi à partir de 20h00. Pour se rendre dans les gares de Saint-Cloud à La Défense, nous invitons les clients qui le peuvent à se rendre en gare de Versailles Rive Droite qui est desservie par les trains de la ligne L (réseau Paris Saint-Lazare).Motif: bagage abandonné à Versailles Chantiers (application du plan vigipirate et gare évacuée).SNCF Transilien
Ligne N: Versailles Chantiers non desservi Axe concerné:Ensemble de la ligne. non desservi dans les deux sens.Arrêt à nouveau desservi à partir de 20h00. Nous invitons les clients à se rendre à Versailles Château Rive Gauche pour emprunter la ligne C du RER jusqu'à Viroflay Rive Gauche qui est desservie dans les deux sens par la ligne N.Motif: bagage abandonné à Versailles Chantiers (application du plan vigipirate et gare évacuée).SNCF Transilien
TRA - AULNAY sous BOIS - LIGNE 615 Suite à des travaux de voirie Chemin du Moulin de la Ville sur la communed'Aulnay sous Bois , la ligne sera déviée en direction de Bobigny de 8h00 à17h00.-Les arrêts Eugene Delacroix , Les Etangs et Camille Desmoulins serontsupprimés .-Vous pourrez vous reporter aux arrêts Eugene Delacroix de la ligne 609 etChemin de Roissy de la ligne 617.Veuillez nous excuser de la gêne occasionnée.
RER B: trafic perturbé. Axe concerné:Ensemble de la ligne.Trafic perturbé dans les deux sens.Motif: incident de portes sur un train à Drancy (incident terminé).SNCF Transilien
Ligne T4: Bondy-Aulnay du 02 au 06 mars Des travaux de maintenance sur les voies modifient la circulation des tramways sur la ligne T4, les soirées du lundi 02 au vendredi 06 mars 2015 à partir de 21h00.La circulation des tramways est interrompue à partir de 21h00. Mise en place de bus de remplacement.SNCF Transilien
RER C : Paris-Pontoise ralenti Axe concerné :Paris - Pontoise Prévoir 10 à 20 minutes supplémentaires de trajet pour les trains NORA (destination Pontoise), GATA (destination Montigny Beauchamp), ROMI (destination Pont de Rungis) et MONA (destination Massy Palaiseau).Fin des ralentissements estimée à 22h00.Motif : incident affectant la signalisation à Pontoise (incident terminé).SNCF Transilien
Trafic réduit ligne 405 En raison de vandalisme survenu cette nuit dans l'un des dépôts des bus, le trafic est réduit sur la ligne 405. Informations www.bus-tice.com ou 0810.401.402 (n° Azur, prix appel local)
Perturbation Ligne 01 Du 3 mars au 31 mars 2015, les arrêts MAIRIE et CIMETIERE sur la Poigny laForêt seront déplacés. Un arrêt provisoire sera mis en place. En raison destravaux sur le RD 108 une deviation sera mise en place.Merci de votre compréhension.
Métro 14: trafic perturbé (Saint-Lazare - Olympiades) : En raison de la présence d'un colis suspect, l'arrêt n'est pas marqué à la station Madeleine en direction de Saint-Lazare. 
Ligne H : Paris-Pontoise ralenti Axe concerné :Paris-Pontoise. Prévoir 15 minutes supplémentaires de trajet, dans les deux sens.Fin des ralentissements estimée à 22h00.Motif : incident affectant la signalisation à Pontoise (incident terminé).SNCF Transilien
Info trafic du 03/03/2015 Le trafic est normal sur l'ensemble des réseaux Sénart Bus et Sénart Express,ainsi que sur les ligne Tzen1 et Citalien.Bonne journée.
Métro Ligne 3bis : trafic ralenti En raison d'un incident d'exploitation, le trafic est ralenti sur la ligne.
