Ligne N: Paris-Plaisir-Dreux 01 au 14 sept Des travaux d'entretien des voies entre Saint-Cyr et Plaisir Grignon, modifient la circulation des trains sur la ligne N - axe Paris Montparnasse - Plaisir Grignon - Dreux - du lundi 1er septembre au au dimanche 14 septembre 2014.SNCF Transilien
RER B : Trafic interrompu Accident de personne à Aulnay sous Bois sur la ligne B du RER. Le trafic est interrompu entre Paris Nord et Mitry Claye et entre Paris Nord et aéroport CDG2 TGV dans les deux sens de circulation. Les voyageurs en provenance ou à destination des gares de La Courneuve Aubervilliers ou La Plaine Stade de France, sont invités à emprunter les lignes de métro 7, 12 ou 13. Nous invitons également les voyageurs à destination de la gare d'Aéroport Charles de Gaulle 2 TGV à emprunter les cars Air France: * La ligne AF2 au départ de Paris (Etoile, Porte Maillot). * La ligne AF4 au départ de la gare de Paris Montparnasse avec desserte de la gare de Paris Gare de Lyon. La reprise du trafic est prévue pour 10h00. 
PARIS BUS RATP: Feu d'artifice le 13/09   A partir de 18h00 jusqu'à 1h00, en raison du spectacle de feux d'artifice «Grand Feu du Parc de Saint-Cloud», la circulation sera interdite dans le parc de Saint-Cloud et sur le pont de Saint-Cloud. Lignes de bus perturbées dans ces secteurs : 52,72,126,160 et 467. 
Ligne J : desserte modiée Paris-Ermont/Cormeilles Des travaux de renouvellement des appareils de voie en gare de Bois Colombes modifient la circulation des trains sur les axes Paris Saint Lazare / Cormeilles en Parisis / Pontoise et Paris Saint Lazare / Ermont Eaubonne, le dimanche 14 septembre 2014, toute la journée.Les trains ne desservent plus les gares de Bois Colombes, Colombes, Le Stade, Sannois et Ermont Eaubonne. Un service de bus est mis en place entre Bécon Les Bruyères et Ermont Eaubonne, dans les deux sens de circulation, avec desserte des gares intermédiaires.SNCF Transilien
COMMEMORATION Nous informons notre aimable clientèle qu?en raison des commémorations du 100ième anniversaire  du début de la Grande Guerre, le dimanche 14 septembre 2014 de 09h30 à 12h45,les arrêts Place Saint Denis et Berthereau ne seront pas desservis.Report proposé à l?arrêt Gambetta. Des retards sont à prévoir sur votre ligne.Nous vous remercions de votre compréhension.
PARIS BUS RATP: Manifestation le 14/09 à 08h30 A partir de 8h30. en raison d'une course pédestre "La Parisienne" et l'interdiction de circulation Place de l'Alma, Pont de Bir Hakeim, Pont de l'Alma, avenue du Président Kennedy, Place de la Résistance, avenue de New York, avenue Bosquet, place de Varsovie, avenue Bosquet, avenue des Nations Unies, place de l'Ecole Militaire, boulevard Delessert, avenue Duquesne et la place du Costa Rica. Lignes de bus perturbées dans ces secteurs : 28,42, 63, 69, 72, 80, 82 et 92. 
Ligne P: Paris - Coulommiers jusqu'au 19 sept Des travaux de maintenance de la caténaire entre Tournan et Coulommiers modifient la circulation des trains sur la Ligne P, axe Paris Est - Coulommiers, les nuits du lundi 01 septembre au vendredi 19 septembre, sauf les nuits du samedi et du dimanche.Dans chaque sens de circulation, les deux derniers trains sont supprimés.Des bus de substitution routière avec desserte des gares intermédiaires sont mis en place.SNCF Transilien
Déviation sur la ligne 11 le 14/09 de 8h à 12h15 En raison du Running et du Marathon de Bois d?Arcy, la ligne 11 sera déviée entre les arrêts "Fritz Lang" et "Jean Jaurès" via la RN12 et la D129.Les arrêts "Jean Jaurès", "Centre Commercial", "Hôtel de Ville", "Le Puits", "P.V. Couturier", "Croix Blanche" et "Fritz lang" ne seront pas desservis le dimanche 14 septembre 2014 de 8h00 à 12h15.Merci de votre compréhension.
Ligne P : Paris-Meaux-LaFertéMilon 13/09 et 14/09 Des travaux de maintenance des appareils de voie modifient la circulation des trains sur la ligne P - axe Paris Est - Meaux - La Ferté Milon - les nuits du samedi 13 / dimanche 14 septembre à partir de 21h00 et du dimanche 14 / lundi 15 septembre 2014, à partir de 23h00.La circulation des trains est interrompue entre Chelles Gournay, Meaux et La Ferté Milon, dans les deux sens.Une substitution routière est mise en place. SNCF Transilien
Ligne P : Paris - Château Thierry 13/09 et 14/09 Des travaux de maintenance des appareils de voie entre Trilport et Château Thierry modifient la circulation des trains sur la ligne P - axe Paris Est - Château Thierry - les nuits du samedi 13 / dimanche 14 septembre et du dimanche 14 e / lundi 15 septembre 2014, à partir de 21h00.La circulation des trains est interrompue entre Chelles Gournay, Meaux et Château Thierry, dans les deux sens.Une substitution routière est mise en place. SNCF Transilien
