Ligne H :Paris-Pontoise-Persan 04 au 08 mai Des travaux de maintenance sur les voies modifient la circulation de certains trains de la ligne H, sur les axes Paris Nord - Persan Beaumont, Paris Nord - Pontoise et Persan Beaumont - Paris Nord, les soirées du lundi 04 au vendredi 08 mai, à partir de 22h30.Une substitution routière est mise en place .Pendant les travaux, covoiturez avec , Transilien vous rembourse.SNCF Transilien
Ligne J: Paris-Pontoise-Gisors ralenti. Axes concernés :Paris / Pontoise / Boissy l'Aillerie / Gisors.Prévoir 10 à 20 minutes supplémentaires de trajet dans les deux sens.Fin des ralentissements estimée à 22h30. Motif : incident affectant la voie au Stade (incident terminé).SNCF Transilien
Déplacement de l'arrêt Planche à Amillis A compter du lundi 4 mai 2015 l'arrêt Amillis Planche sera dépacé au niveau de l'intersection entre la D15 et la rue du petit BeaufourNous vous remercions de votre compréhension.
Mouvement social KEOLIS-CIF - ETAT du trafic ce JE Trafic fortement perturbé sur l'ensemble des lignes KEOLIS-CIF du dépôt de Tremblay pour une durée indéterminéeSite internet : keolis-cif.com et fileo.comLignes CIF Tremblay : 01 49 63 44 00 à partir de 5hLignes Fileo : 0810 24 24 77    24h/24h  et 7j/7IBUS : 01 48 62 38 33 à partir du 7h
Mouvement social CIF continue le 5 mai 2015 Trafic fortement perturbé sur les lignes CIF et fileo depuis le 4 mai pour une durée indéterminée et ce mardi 5 mai encorePour tout renseignement, contacter CIF Goussainville : 01 34 38 88 87 à partir de 5h IBUS : 01 48 62 38 33 à partir du 7hSite internet : keolis-cif.com et fileo.com
Mouvement social KEOLIS-CIF continue le 6 mai 2015 Trafic fortement perturbé sur l'ensemble des lignes KEOLIS-CIF du dépôt de Goussainville pour une durée indéterminée.Site internet: keolis-cif.com et fileo.comlignes KEOLIS-CIF Goussainville: 01 34 38 88 87(à partir de 5h)Lignes filéo: 0810 24 24 77 24h/24 et 7j/7IBUS: 01 48 62 38 33 à partir de 7h
RER E: Haussmann-Villiers/Tournan 04 au 08 mai Des travaux de modernisation du poste d'aiguillage de Gretz-Armainvilliers modifient la circulation des trains de la ligne E du RER - axe Haussmann Saint-Lazare / Villiers/Tournan - les soirées du lundi 04 mai au vendredi 08 mai 2015 à partir de 22h15.Pendant les travaux, covoiturez avec , Transilien vous rembourse.SNCF Transilien
Ligne J : Mantes/Paris via Conflans ralenti Axe(s) concerné(s) :Mantes la Jolie/Paris via Conflans Fin d'OisePrévoir 10 à 15 minutes supplémentaires de trajet, dans ce sens, entre Mantes la Jolie et Paris Saint-Lazare, via Conflans Fin d'Oise.Fin des ralentissements estimée à 10h00.Motif : incident affectant la voie à Mantes la Jolie.SNCF Transilien
Ligne L: Paris-Versailles-St-Nom ralenti. Axes concernés :Paris - St-Nom la Bretèche / Versailles Rive Droite.Prévoir 10 à 20 minutes supplémentaires de trajet, dans les deux sens.Fin des ralentissements estimée à 20h30.Motif : panne d'un train au Val d'Or (incident terminé).SNCF Transilien
Métro 4 (Porte de Clignancourt Mairie de Montrouge En raison d'une panne de matériel,le trafic est ralenti sur l'ensemble de la ligne. Trafic normal sur les autres lignes de Métro. 
Ligne P : Paris - Meaux du 04 au 08 mai Des travaux de maintenance d'appareils de voies modifient la circulation des trains sur la ligne P - axe Paris Est - Meaux - les soirées du lundi 04 au vendredi 08 mai, à partir de 22h30.Les gares de Chelles Gournay et Vaires Torcy ne sont pas desservies en direction de Meaux.Particularités pour la soirée du vendredi 8 mai :- Le dernier train à destination de Paris Est circule au départ de Meaux à 22h50.- Trois bus de remplacement à destination de Paris Est sont prévus au départ de Meaux à 23h30, 00h00 et 00h30 (en raison d'un mouvement social sur la ligne N141 du Noctilien, ce dernier trajet est assuré par un bus spécial, par conséquent tous les arrêts se font devant les gares).Pendant les travaux, covoiturez avec , Transilien vous rembourse.SNCF Transilien
Ligne 502 - Modifications des horaires Nous vous informons que les horaires sont modifiés à compter du 4 mai 2015.Merci de consulter la nouvelle fiche horaire (rubrique outil ).Nous vous remercions de votre compréhension.
RER C : Paris/Versailles Chât./St Quentin ralenti Axe(s) concerné(s) :Paris/Versailles Château Rive GaucheParis/Saint-Quentin en YvelinesPrévoir 15 à 20 minutes supplémentaires de trajet, entre Paris et Versailles Château Rive Gauche, et entre Paris et Saint-Quentin en Yvelines, dans ce sens.Fin des ralentissements estimée à 07h30.Motif : application de mesures de sécurité liées à une fin tardive de travaux dans le secteur de Juvisy.SNCF Transilien
LIGNE 4 - Fermeture rue Saint Exupéry - Châtenay-Malabry En raison de la prolongation des travaux rue Saint Exupéry, à Châtenay-Malabry, la ligne 4 du Paladin est déviée en direction de La Croix de Bernyjusqu'au 17 mai 2015Les arrêts ci-desous ne seront pas desservis pendant toute la durée de laperturbation:  * SAINT EXUPERY: report sur HENRI SELLIER  * MONTGOLFIER (en direction de la Croix de Berny RER): report sur FRANCIS DEPRESSENSE.Veuillez nous excuser pour la gêne occasionnée.
