Ligne L : Paris - Cergy le Haut  fortement ralenti Axe concerné :- Paris Saint-Lazare - Cergy le HautLe trafic est fortement perturbé sur l'axe Paris Saint-Lazare - Cergy le Haut, dans les deux sens .Un train sur trois en moyenne circule sur cet axe.Nous conseillons à nos clients de se reporter sur la ligne A du RER (station Auber proche de Paris Saint-Lazare).Motif : immobilisation de rames en atelier de maintenance et incident affectant la voie à La Garenne ColombesSNCF Transilien
Ligne K : Paris - Mitry Claye fortement perturbé Axe(s) concerné(s) :Paris/Crépy en ValoisLe trafic reprend progressivement entre Paris et Mitry Claye, dans les deux sens, avec un allongement du temps de trajet à prévoir jusqu'en fin de service .Motif : personnes sur les voies suite à la panne d'un train de la ligne B du RER à Aulnay sous Bois ( incident terminé )SNCF Transilien
T7 Trafic perturbé : (Villejuif Louis Aragon – Athis-Mons) : En raison d'un accident entre tiers sur la voie publique, le trafic est interrompu entre Belle-Epine et Robert-Schumann.  
RER B: Mouvement Social Mouvement social interprofessionnel national à l’appel du syndicat CGT – jeudi 25 juin 2015.Le trafic sera perturbé sur la ligne B du RER.Prévoir 4 trains sur 5 aux heures de pointe et 3 trains sur 4 aux heures creuses. 
Ligne I - Modification d'une course au 20/04/2015 A compter du 20 avril 2015, pour une meilleure correspondance avec le train de 9h13, la course de 8h50 au départ "CES La Guinette" à Villecresnes en direction de la Gare de Yerres est avancée de 4 mn soit 8h46.Bon voyage sur les lignes de la STRAV !
T3A: Trafic Ralenti Pont du Garigliano - Porte de Vincennes: En raison d'un embouteillage à porte d'Orléans, le trafic est ralenti sur la ligne. 
Métro 8: Trafic Interrompu Balard – Créteil - Pointe du Lac: En raison d'un incident technique, le trafic est interrompu entre les stations Porte de Charenton et Maisons-Alfort-Les Juilliottes. 
Ligne J :  suppression Gisors - Paris Axe(s) concerné(s) :Gisors - ParisTrain(s) supprimé(s) : - Gisors, départ 07h26ORLYBUS: TRAFIC INTERROMPU Paris-Denfert-Rochereau - Aéroport d'Orly: En raison d'une manifestation sur la voie publique, de trafic est interrompu sur l'ensemble de la ligne. 
RER D: Savigny le Temple non desservi Axes concernés :Paris-Melun.Savigny le Temple non desservi en direction de Melun.Arrêt à nouveau desservi à partir de 12h00.En direction de Melun: - les voyageurs désirant descendre à Savigny le temple, sont invités à prendre une correspondance à Cesson, avec un train en direction de Paris.- les voyageurs au départ de Savigny le Temple sont invités à prendre une correspondance à Lieusaint Moissy, avec un train en direction de Melun. Motif : accident de personne à Savigny le Temple.SNCF Transilien
RERC:Paris-Versailles/St-Quentin/Pontoise ralenti. Axes concernés:Paris - Versailles Château Rive Gauche / St-Quentin en Yvelines/Montigny Beauchamp/Pontoise.Prévoir 10 à 15 minutes supplémentaires de trajet dans ce sens.Fin des ralentissements estimée à 12h00.Motif : incident affectant la voie à Musée d'Orsay nécessitant des travaux.SNCF Transilien
Ligne R : TER Bourgogne perturbés le 25 juin Axes concernés : ensemble de la ligne.Trafic perturbé sur les TER Bourgogne le jeudi 25 juin 2015. La ligne R circule normalement. Les prévisions de circulation de gare à gare sont disponibles :? Sur le site internet abcdtrains.com? Sur l?application SNCF Transilien (Iphone et Android)? Sur la version mobile : www.transilien.mobi? Par téléphone au 0 805 700 805 (gratuit depuis un poste fixe)Motif : Mouvement social interprofessionnel le jeudi 25 juin 2015.SNCF Transilien
T1 Trafic perturbé : (Asnières-Gennevilliers – Les Courtilles – Noisy-le-Sec) : En raison d'une panne de matériel, le trafic est interrompu entre Bobigny-Pablo Picasso et Noisy-le-Sec RER. 
Ligne P :Meaux/La Ferté Milon interrompu Axe concerné :Meaux/La Ferté MilonLe trafic est interrompu entre Meaux et La Ferté Milon, dans les deux sens de circulation.Un service de bus de remplacement est mis en place entre Meaux et La Ferté Milon avec desserte des gares intermédiaires.ATTENTION, les trajets en bus suivants ne sont pas assurés:- au départ de Meaux: 16h32, 21h32. - au départ de La Ferté Milon: 19h11, 20h11. Les prévisions de circulation de gare à gare sont disponibles :? Sur le site internet abcdtrains.com? Sur l?application SNCF Transilien (Iphone et Android)? Sur la version mobile : www.transilien.mobi? Par téléphone au 0 805 700 805 (gratuit depuis un poste fixe)Motif : Mouvement social interprofessionnel le jeudi 25 juin 2015 sur la ligne P.SNCF Transilien
T4 : trafic interrompu Axe concerné :Bondy / Aulnay sous BoisLe trafic est interrompu entre Bondy et Aulnay sous Bois, dans les deux sens de circulation.Un service de bus de remplacement est mis en place entre Bondy et Aulnay sous Bois avec desserte des gares intermédiaires.Les prévisions de circulation de gare à gare sont disponibles :? Sur le site internet abcdtrains.com? Sur l?application SNCF Transilien (Iphone et Android)? Sur la version mobile : www.transilien.mobi? Par téléphone au 0 805 700 805 (gratuit depuis un poste fixe)Motif : Mouvement social interprofessionnel le jeudi 25 juin 2015 sur le T4.SNCF Transilien
Ligne L : Noisy le Roi-St GermainGC interrompu Axe concerné :Noisy le Roi/Saint Germain en Laye Grande CeintureDes bus de remplacement sont mis en place.Motif : opérations de maintenance spécifiques sur le matériel roulant SNCF Transilien
T5 Trafic perturbé : (Marché de Saint-Denis - Garges Sarcelles) : En raison d'un accident entre tiers sur la voie publique, le trafic est interrompu entre les arrêts BUTTE PINSON (PARC REGIONAL) et SUZANNE VALADON. 
Ligne L : St-Germain-Noisy le Roi interrompu Axe concerné :Saint-Germain en Laye Grande Ceinture / Noisy le Roi.Le trafic est interrompu entre Saint-Germain en Laye Grande Ceinture et Noisy le Roi, dans les deux sens de circulation.Un service de bus de remplacement est mis en place entre Saint-Germain en Laye Grande Ceinture et Noisy le Roiavec desserte des gares intermédiaires.Les prévisions de circulation de gare à gare sont disponibles :? Sur le site internet abcdtrains.com? Sur l?application SNCF Transilien (Iphone et Android)? Sur la version mobile : www.transilien.mobi? Par téléphone au 0 805 700 805 (gratuit depuis un poste fixe)Motif : Mouvement social interprofessionnel le jeudi 25 juin 2015 sur la ligne L.SNCF Transilien
Courses non effectuées ligne N Suite à une absence conducteur, les départs suivants ne pourront êtreeffectués aujourd'hui 25 juin :Ligne N : Curie Foch : 5h49Ligne N : Gare de Melun : 6h50Nous vous présentons nos excuses pour la gêne occasionnée.Bonne journée.
RER A: trafic ralenti. Axes concernés:Ensemble de la ligne.Prévoir 15 à 20 minutes supplémentaires de trajet, dans les deux sens.Fin des ralentissements estimée à 11h00.Motif : malaise voyageur à Nanterre Préfecture.SNCF Transilien
LIGNE 7 SCOLAIRE : TRAVAUX DE VOIRIE ROUTE DE SARTROUVILLE A MONTESSON DU 25 AU 26 JUIN 2015 DE 9H Nous informons notre aimable clientele qu'en raison de travaux de voirie routede Sartrouville à Montesson, la ligne 7 scolaire sera déviée en direction deCarrefour / Gare de Sartrouville le 25 et 26 juin 2015 de 9h à 18h.L'arrêt La Tour sera reporté à l'arrêt Cimetiere.
Métro 10 : trafic ralenti  (Boulogne Pont de Saint-Cloud - Gare d'Austerlitz) : En répercussion d'un accident grave de voyageur, le trafic est ralenti sur l'ensemble de la ligne . Trafic normal sur les autres lignes de Métro. 
Ligne P : trafic ralenti. Axes concernés : - Paris Est / Meaux / Château Thierry,- Paris Est / Provins,- Paris Est / Coulommiers.Prévoir 2 trains sur 3 en moyenne.ATTENTION, train supplémentaire mis en circulation entre Paris Est et Coulommiers :- Paris Est, départ 21h16 - Coulommiers, arrivée 22h17RER B: Aéroport Charles de Gaulle 2 non desservi Axe concerné :Paris - Aéroport Charles de Gaulle 2 TGV.Aéroport Charles de Gaulle 2 TGV non desservi, dans les deux sens.Arrêt à nouveau desservi à partir de 11h00.Les trains sont arrivée / départ à Aéroport Charles de Gaulle 1.Les voyageurs souhaitant se déplacer entre l'Aéroport Charles de Gaulle 1 et l'Aéroport Charles de Gaulle 2 TGV sont invités à emprunter le CDGVAL.Motif : bagage abandonné à Aéroport Charles de Gaulle 2 TGV .SNCF Transilien
RER D: Paris-Melun/Corbeil/Malesherbes ralenti Axes concernés:Paris-Melun/Corbeil Essonnes/Malesherbes .Prévoir 15 minutes supplémentaires de trajet, dans ce sens.Fin des ralentissements estimée à 08h00.Motif : incident affectant la signalisation à Paris Nord.SNCF Transilien
