Ligne L: Paris-Maisons Laffitte dimanche 14 juin Des travaux de remplacement de la passerelle piétons du marché de Maisons Laffitte modifient la circulation des trains de la ligne L, axe Paris St-Lazare / Maisons Laffitte dans les deux sens, le dimanche 14 juin, toute la journée.- Les trains sont terminus Sartrouville pour repartir ensuite en direction de Paris.Des bus de remplacement sont mis en place entre Sartrouville et Maisons Laffitte.Pendant les travaux, covoiturez avec , Transilien vous rembourse.SNCF Transilien
RER A: TRAVAUX En raison de travaux de remplacement de la passerelle piétons du marché de Maisons Laffitte, la circulation des trains du RER A est interrompu entre Nanterre Préfecture et Cergy le Haut et entre Nanterre Préfecture et Poissy, dans le deux sens. - Aucun RER A sur les branches Cergy le Haut et Poissy - Bus entre Sartrouville et Poissy. - Mise en place de trains entre Poissy et Cergy le Haut, dans les deux sens. 
Ligne L : Trafic ralenti Axe(s) concerné(s) :Ensemble de la lignePrévoir 20 à 30 minutes supplémentaires de trajet, dans les deux sensFin des ralentissements estimée à 18h30.Motif : acte de malveillance à Clichy - Levallois-Perret.SNCF Transilien
RER C : Pontoise/Paris ralenti Axe(s) concerné(s) :Pontoise/ParisPrévoir jusqu'à 20 minutes d'allongement de temps de parcours entre Pontoise et Paris, dans ce sensFin des perturbations estimée à 22h00.Motif : panne d?un train à Gennevilliers (incident terminé).SNCF Transilien
RER C:Invalides-St Martin/Dourdan 14 juin Des travaux de maintenance interrompent la circulation des trains de la ligne C du RER - axe Invalides - Saint-Martin d'Etampes / Dourdan - la nuit du dimanche 14 juin 2015, à partir de 23h00.Pendant les travaux, covoiturez avec , Transilien vous rembourse.SNCF Transilien
Ligne H : Paris/Persan via Valmondois ralenti Axe concerné :Paris/Persan Beaumont via ValmondoisPrévoir 10 à 15 minutes supplémentaires de trajet, dans les deux sensFin des ralentissements estimée à 18h30.Motif : dysfonctionnement d?un passage à niveau à Bessancourt.SNCF Transilien
Métro 9: Trafic ralenti (Pont de Sèvres - Mairie de Montreuil) : En répercussion d'un incident voyageur, le trafic est ralenti sur l'ensemble de la ligne. Trafic normal sur les autres lignes de Métro. 
RER A : Paris-Cergy/Poissy dimanche 14 juin Des travaux de remplacement de la passerelle piétons du marché de Maisons Laffitte interrompent la circulation des trains du RER A, entre Nanterre Préfecture et Cergy le Haut et entre Nanterre Préfecture et Poissy, dans les deux sens, le dimanche 14 juin, toute la journée.- Aucun RER A sur les branches Cergy le Haut et Poissy- Bus entre Sartrouville et Poissy. - Mise en place de trains entre Poissy et Cergy le Haut, dans les deux sens.Pendant les travaux, covoiturez avec , Transilien vous rembourse.SNCF Transilien
RER C: Viroflay/Pontoise-Paris-Choisy ralenti Axes concernés:Viroflay Rive Gauche/Pontoise-Paris-Choisy le Roi. Prévoir 10 à 20 minutes supplémentaires de trajet, dans les deux sens.Fin des ralentissements estimée à 13h00.Motif : individu sur les voies à Champ de Mars Tour Eiffel (incident terminé). SNCF Transilien
Ligne J : Trafic ralenti Axe(s) concerné(s) :Ensemble de la lignePrévoir 20 à 30 minutes supplémentaires de trajet, dans les deux sensFin des ralentissements estimée à 18h30.Motif : actes de malveillance à Clichy - Levallois.SNCF Transilien
Ligne J : Paris - Mantes le dimanche 14 juin Des travaux de remplacement de la passerelle piétons de Maisons Laffitte modifient la circulation des trains sur la ligne J, le dimanche 14 juin 2015 jusqu'à 12h00.Un service de bus de remplacement est mis en place entre Sartrouville et Poissy avec desserte des gares intermédiaires.Pendant les travaux, covoiturez avec , Transilien vous rembourse.SNCF Transilien
