RER E : Paris - Chelles ralenti Axes concernés :- Paris Haussmann Saint Lazare/Chelles GournayPrévoir un allongement du temps de parcours de 20 à 30 minutes, dans les deux sens Fin des perturbations estimée à 16h30.Motif : accident de personne entre  et Chelles Gournay ( incident terminé )SNCF Transilien
Ligne P : Paris - Meaux - Château Th ralenti Axes concernés :- Paris - Meaux - Château Thierry/La Ferté MilonPrévoir un allongement du temps de parcours de 20 à 30 minutes, dans les deux sens Fin des perturbations estimée à 16h30.Motif : accident de personne entre Le Chenay Gagny et  ( incident terminé )SNCF Transilien
Trafic ralenti La panne d'un train en gare de Bagneux perturbe le trafic sur la ligne B.Le trafic est fortement perturbé sur les axes - Paris - Aéroport Charles de Gaulle 2 TGV - Paris - Mitry Claye- Paris - Robinson- Paris - St Rémy les Chevreuse- RER-B Nord- RER-B Nord et SudSNCF Transilien
Ligne H : Paris/Persan via Montsoult ralenti Axe(s) concerné(s) :Paris/Persan Beaumont via Monsoult MaffliersParis/LuzarchesReprise progressive du trafic entre Paris Nord et Persan Beaumont via Montsoult Maffliers et entre Paris Nord et Luzarches dans les deux sens.Prévoir 20 à 30 minutes supplémentaires de trajet.Fin des ralentissements estimée à 12h30.Motif : malaise d'un voyageur à Epinay Villetaneuse .SNCF Transilien
Métro 7bis Trafic interrompu : (Louis Blanc - Pré Saint Gervais) : En raison d'un incident voyageur, le trafic est interrompu sur la ligne.
Ligne R : Melun/Montereau via Héricy interrompu Axe(s) concerné(s) :Melun / Montereau via HéricyTrafic interrompu entre Melun et Montereau, dans ce sensPas de reprise des circulations avant la fin de service.Des bus sont prévus vers 22h50 au départ de Melun et à destination de Montereau avec desserte des gares intermédiaires. De plus, le train suivant est supprimé :- Montereau, départ 22h28 - Melun, arrivée 23h06Ligne K :  suppression Crépy en Valois/Paris Axe concerné : Crépy en Valois/ParisTrain supprimé : Crépy en Valois, départ : 06h08Ligne P : Longueville - Paris ralenti Axe(s) concerné(s) :Provins/ParisReprise progressive du trafic entre Longueville et Paris Est, dans ce sensPrévoir jusqu'à 40 minutes supplémentaires de trajet.Fin des ralentissements estimée à 23h00.De plus, le train suivant est supprimé :- Paris Est, départ 21h46 - Provins, arrivée 23h10 Métro 13 : Panne de métériel En raison d'une panne de matériel, le trafic est fortement ralenti sur l'ensemble de la ligne.Trafic normal sur les autres lignes de Métro.
RER A : Paris/Cergy/Poissy ralenti Axe(s) concerné(s) :Paris/Cergy le HautParis/PoissyPrévoir 10 à 20 minutes supplémentaires de trajet, dans les deux sens.Fin des ralentissements estimée à 10h00.Motif : bagage abandonné à Nanterre Préfecture.SNCF Transilien
