Ligne 34: travaux En raison de travaux, le Cours du Danube à Serris sera fermé à la circulation du 16/02 au 27/02/2015.Une déviation sera mise en place dans les deux sens par le "Cours de la Tamise" RER E : axe Tournan ralenti Axe concerné :Paris Haussmann Saint-Lazare / TournanParis Haussmann Saint-Lazare / Villiers sur MarneLe trafic reprend progressivement entre Villiers sur Marne et Tournan, dans les deux sens .Prévoir un allongement du temps de trajet de 10 à 30 minutes, jusqu' à 10h30.Motif : Bris de barrière au passage à niveau de Roissy en Brie ( incident terminé )SNCF Transilien
MODIFICATION DES HORAIRES Bonjour, nous vous informons qu'à partir du lundi 02 mars 2015, deux horairesde la ligne 114, au départ de la Gare d'Epinay-Sur-Orge, changent. Les départsde 18h30 et 19h00 sont avancés à 18h26 et 18h57.
Ligne 50: travaux  En raison de travaux, le Cours du Danube à Serris sera fermé à la circulation du 16/02 au 27/02/2015.Une déviation sera mise en place dans les deux sens par le_ "Cours de la Tamise" Déviation ligne 36 SOL# SOL Scolaire En raison de travaux rue Rue Michel Mur à Savigny le Temple, l'arrêt "Sidonie Talabot" en direction de "Cesson Gare RER" ne sera pas desservi.Merci de vous reporter à l'arrêt provisoire mis en place à l'angle de la rue Puits Saint-Hillier/rue de Melun.Merci pour votre compréhension.
Ligne 114: MODIFICATION DES HORAIRES  Bonjour, nous vous informons qu'à partir du lundi 02 mars 2015, deux horaires de la ligne 114, au départ de la Gare d'Epinay-Sur-Orge, changent. Les départs de 18h30 et 19h00 sont avancés à 18h26 et 18h57.
Restitution tardive des travaux Des travaux d'entretien du réseau perturbent le trafic sur la ligne N.Les trains circulent avec des retards et des suppressions ou modifications de desserte sont possibles sur les axes : - Paris - Rambouillet- Paris - Chartres SNCF Transilien
Ligne L : Paris/VersaillesRD ralenti Axe concerné :Paris/Versailles Rive DroitePrévoir 10 à 15 minutes supplémentaires de trajet, dans les deux sens.Fin des ralentissements estimée à 09h30.Motif : panne d?un train à Chaville Rive Droite.SNCF Transilien
Ligne L : Maisons Laffitte Cergy interrompu Axe concerné :Paris - Cergy le Haut.Le trafic est interrompu entre Cergy Préfecture et Maisons Laffitte, dans les deux sens .Sur ce parcours, les clients peuvent emprunter un train de la ligne A du RER, et changer à Maisons Laffitte .Reprise des circulations normales vers 09h00.Motif : incident affectant la signalisation à Cergy Préfecture .SNCF Transilien
PERTURBATIONS  DU 16 FEVRIER AU 6 AVRIL 2015 Ligne 95-03 : Nous informons notre aimable clientèle qu'en raison de travaux rue de Paris sur la commune de Taverny, du 16 février au 6 avril 2015, l'arrêt "Les Gaudins" sera provisoirement déplacé, en direction de Bessancourt, à l'angle de la rue de Paris et de la 9ème Avenue. L'arrêt "Hôtel de Ville/Marché" ne sera pas desservi. Veuillez vous rendre à l'arrêt provisoire "Gare de Taverny", en commun avec la ligne 30-10.Merci de votre compréhension.
NOUVEAUX HORAIRES  A COMPTER DU 02 MARS 2015 Ligne 30-04 : Nous informons notre aimable clientèle qu'à compter du 02 mars 2015 de nouveaux horaires entrent en vigueur et un nouvel arrêt nommé "Frépillon" sera desservi par la ligne. Il se situe entre les arrêts "Sognolles" et "Balzac", de chaque côté de la RN184.   Merci de votre compréhension. 
PERTURBATIONS DU 16 FEVRIER AU 6 AVRIL 2015 Ligne 30-04 : Nous informons notre aimable clientèle qu'en raison de travaux d'assainissement rue de Paris sur la commune de Taverny, du 16 février au 6 avril 2015, l'arrêt "Les Gaudins" sera provisoirement déplacé à environ 200 mètres de l'arrêt initial, en direction de Bessancourt. L'arrêt "Hôtel de Ville/Marché" ne sera pas desservi. Veuillez vous rendre à l'arrêt provisoire "Gare de Taverny", en commun avec la ligne 30-10.    Merci de votre compréhension.
Ligne U: La Défense-Versailles interrompu. Axe concerné:La Verrière - La Défense.Trafic interrompu entre La Défense et Versailles Chantiers dans ce sens.Reprise des circulations estimée à 16h28.Les gares de La Défense, , ,  et  sont desservies uniquement par les trains de la ligne L (axe Versailles Rive Droite).Pour se déplacer entre La Défense et Versailles Chantiers dans ce sens, les voyageurs sont invités à emprunter la ligne C du RER à Versailles Chantiers, avec correspondance avec les tramways de la ligne  à la station Issy Val de Seine. Vous pouvez aussi emprunter les trains des lignes N ou C entre Versailles Chantiers et Paris, puis prendre la ligne 1 du métro, ou la ligne A du RER jusqu?à La Défense. Motif: incident affectant la voie à Sèvres Ville d'Avray nécessitant des travaux.SNCF Transilien
Travaux Ave Maréchal Joffre Travaux interdisant la circulationAvenue du Maréchal Joffre à Grisy-Suisnes. L?arrêt GRISY-SUISNES ? Maréchal Joffrene sera pas desservi durant les travaux. Merci de bien vouloir vous reporter aux arrêts provisoires situés sur la RD 319.
Ligne L: Paris-Versailles RD ralenti Axe concerné:Paris-Versailles Rive Droite.Prévoir 10 minutes supplémentaires de trajet, dans les deux sens.Fin des ralentissements estimée à 15h10.Motif: incident affectant la voie à Sèvres Ville d'Avray nécessitant des travaux.SNCF Transilien
Ligne P : axes provins Coulommiers ralentis Axes concernés :Paris - ProvinsParis - CoulommiersLe trafic a repris sur les axes Provins et Coulommiers, dans les deux sens .Prévoir un allongement du temps de trajet de 10 à 20 minutes jusqu' à 10h30.Motif : Bris de barrière au passage à niveau de Roissy en Brie ( incident terminé )SNCF Transilien
Ligne N : Rambouillet- La Verrière ralenti Axe concerné :Rambouillet - La VerrièrePrévoir 10 à 15 minutes supplémentaires de trajet, dans ce sensReprise estimée vers 10h00.Motif : incident affectant la signalisationSNCF Transilien
Ligne 116: MODIFICATION DES HORAIRES   Bonjour, nous vous informons qu'à partir du lundi 02 mars 2015, deux horaires de la ligne 116, au départ de la Gare d'Epinay-Sur-Orge, changent. Les départs de 18h15 et 18h45 deviennent 18h18 et 18h49.
SACLAY - L 16 La fermeture de la rue de La Martiniere à Saclay, entre la D 36 et la rueCharles Thomassin, nécessite la déviation de la ligne, du 11 février au 13février 2015.  * Ligne 16 en direction de Saclay Razel : La ligne est déviée par la D36 etroute d'Orsay (D446), pour rejoindre le terminus à l'arrêt 'Razel'. L'arrêt'Martiniere' est reporté à l'arrêt de la D36.  * Ligne 16 en direction d'Igny : La ligne est déviée par la route d'Orsay(D446) et la D36.  * L'arrêt 'Mairie de Saclay' est supprimé et reporté à l'arrêt 'Martiniere'.Nous vous prions de bien vouloir nous excuser pour la gêne occasionnée
Métro 8 trafic ralenti (Balard – Créteil - Pointe du Lac) : En répercussion d'un malaise voyageur, le trafic est ralenti sur l'ensemble de la ligne. Trafic normal sur les autres lignes de Métro .
RER A : trafic perturbé. Axe concerné :Ensemble de la ligne.Prévoir 10 à 15 minutes supplémentaires de trajet, dans les deux sens.Fin des ralentissements estimée à 17h30.Motif : défaut d?alimentation électrique entre Sartrouville et Maisons Laffitte.SNCF Transilien
Métro 2: trafic perturbé (Nation - Porte Dauphine) : En raison de la présence d'un colis suspect, les trains ne marquent pas l'arrêt à la station Anvers. 
Ligne N Mantes La Jolie Plaisir Grignon ralenti Axe concerné :Paris - Plaisir Grignon - Mantes La JolieLe trafic reprend progressivement entre Plaisir Grignon et Mantes la Jolie, dans les deux sens.Motif : panne d'un train à Epones MézièresSNCF Transilien
T2: trafic interrompu  (Pont de Bezons - Porte de Versailles) : En raison d'une panne de matériel à la station " Parc de Saint Cloud ", le trafic est interrompu sur l'ensemble de la ligne. trafic normal sur les autres lignes de TramwayAucune manifestation en cours de nature à perturbé le trafic. 
RER E :  Tournan non desservi Axe concerné :Paris Haussmann Saint Lazare/Tournan non desservi, dans les deux sens.Arrêt à nouveau desservi à partir de 13h30.Motif : incident affectant la voie à Tournan.SNCF Transilien
Ligne A  Poissy/Cergy .Restitution tardive Travaux Des travaux d'entretien du réseau perturbent le trafic sur la ligne A.Les trains circulent avec des retards de 10 à 20 minutes environ et des suppressions ou modifications de desserte sont possibles sur les axes : - Poissy- Cergy Le Haut SNCF Transilien
