Modifications Horaire Ligne 21 Scolaire Les horaires de la ligne 21 scolaire sont modifiées. En effet, certaines courses du RPI sont retardées de 10 minutes. RDV sur notre site pour connaitre les nouveaux horaires. http://marne-et-morin.groupe-espaces.com/Merci de votre compréhension
Ligne P : Paris Coulommiers du 3 au 7 novembre Des travaux de maintenance de voies entre Tournan et Coulommiers interrompent les circulations entre Tournan et Coulommiers en journée du lundi 3 novembre au vendredi 7 novembre 2014.Une substitution routière est mise en place.SNCF Transilien
RER C: perturbations jusqu'à 12h Application de mesures de sécurité pour un incident de signalisation à Juvisy sur la ligne C du RER. Un allongement du temps de parcours important est à prévoir, pour les trains:ELBA (St-Quentin en Yvelines / St-Martin d?Etampes)DEBO (St-Quentin en Yvelines / Dourdan la Forêt)VICK (Versailles Chantiers / Versailles Château Rive Gauche)LARA (Dourdan / Invalides) SARA (St-Martin d?Etampes / St-Quentin en Yvelines) CIME (Versailles Château Rive Gauche / Versailles Chantiers) jusqu?à 12 heures.SNCF Transilien
Ligne H: retards sur Pontoise-Creil Incident affectant la signalisation à Epluches sur la ligne H.Un allongement du temps de parcours de 10 à 20 minutes est à prévoir, dans les deux sens entre Pontoise et Creil, jusqu'à 10 heures.SNCF Transilien
Metro 2: Trafic interrompu Nation - Porte DauphineEn raison d'une panne de matériel roulant à Nation, le trafic est interrompu entre Nation et Père Lachaise.Reprise prévue vers 09 h 10 
Ligne P : Paris-Meaux du 3 au 7 novembre Des travaux de maintenance des voies modifient la circulation des trains sur la ligne P - axe Paris Est - Meaux les soirées du lundi 3 au vendredi 7 novembre de 22h30 à fin de service.Une substitution routière est mise en place. SNCF Transilien
Villeneuve-St-Georges - Travaux de nuits Texte : Nous vous informons qu'en raison des travaux Avenue Carnot à Villeneuve-St- Georges dans les nuits du Mercredi 5 au Jeudi 6 Novembre et du Jeudi 6 au Vendredi 7 Novembre 2014 de 22h00 à 6h00, une déviation est mise en place.L'arrêt :  * "H. Janin" est supprimé.Merci de votre compréhension.
Nouvelle offre à compter du Lundi 03 Novembre  A compter du Lundi 03 Novembre 2014 la ligne P renforce son offre : 1 TRAIN =1 BUS entre 6h00 et 22h30.Un bus toutes les 15 minutes en heures creuses.Consultez des à présent les nouveaux horaires sur www.strav.fr.Bon voyage sur les lignes de la STRAV !
TRA- Déviation ligne 613 A l'occasion de l'installation des illuminations des fêtes de fin d'année sur la commune de Montfermeil , la ligne sera déviée de minuit à 6h00 ._Les arrêts Gazelles et Paul Bert seront supprimés .Veuillez nous excuser de la gêne occasionnée.
METRO 10 : Trafic ralenti (Boulogne Pont de Saint-Cloud - Gare d'Austerlitz) : En raison d'un incident voyageur à Duroc, le trafic est ralenti sur l'ensemble de la ligne.
RER E : Haussmann - Chelles du 3 au 7 novembre Des travaux de maintenance des appareils de voies interrompent la circulation des trains sur la ligne E du RER, entre Le Raincy Villemomble et Chelles Gournay, du lundi 3 novembre au vendredi 7 novembre 2014, à partir de 22h30 jusqu'en fin de service.SNCF Transilien
Ligne H : trafic ralenti jusqu' à 20h00 Panne d'un train à Cernay, sur la ligne C du RER, impactant la ligne H, et accident de personne à Champagne sur Oise .Ces incidents sont terminés, mais des allongements de temps de parcours de 10 à 20 minutes restent à prévoir jusqu' à 20h00 environ .SNCF Transilien
TRA - Déviation ligne 601 A l'occasion de l'installation des illuminations des fêtes de fin d'année sur la commune de Montfermeil , la ligne sera déviée de minuit à 6h00._ Les arrêts Bargue , Bellevue , Château et Paul Bert seront supprimés ._ L'arrêt Victor Hugo sera reporté dans l'avenue Bargue .Veuillez nous excuser de la gêne occasionnée .
Ligne O2 - Nouveaux horaires à compter du 03/11/14 A compter du Lundi 03 Novembre 2014 la ligne O2 avancent ces horaires de 5mn au départ de Limeil-Brévannes arrêt E. Combes en direction de Créteil.Consultez des à présent les nouveaux horaires sur www.strav.fr.Bon voyage sur les lignes de la STRAV !
Ligne R: retards Paris-Montargis et Montereau Incident affectant la voie à Paris sur la ligne R.Un allongement du temps de parcours important est à prévoir entre Paris et Montargis et entre Paris et Montereau, dans ces sens de circulation jusqu'à 10h30. SNCF Transilien
Modifications Horaires Lignes 41 et 47 A compter du 3 Novembre 2014, quelques courses sur les lignes 41 et 47 sont modifiées : - Ligne 41 : Les courses de 8h30 au départ de « Chaton » et 8h40 au départ de « La Maladrerie » sont avancées de 6 minutes - Ligne 47 : La courses de 8h33 au départ du « Gué à Tresmes » est avancée de 5 minutes et la course de de 8h35 au départ de « Rue du Grand Voyeux » est avancée de 2 minutes . ATTENTION TOUS LES ARRÊTS SONT CONCERNES ! Les nouveaux horaires sont déjà disponibles sur notre site internet : marne-et-morin.groupe-espaces.com (Pays de l'Ourcq - Fiches Horaires - Ligne 41 ou Ligne 47 - Prochains)Merci de votre compréhension
Valenton - Travaux Rue Julien Duranton  Nous vous informons qu'en raison des travaux Rue Julien Duranton à Valenton le Mardi 04 Novembre 2014 de 8h30 à 17h00. Une déviation est mise en place en direction de Créteil. Les arrêts :  * "Graviers" de la ligne O est reporté à l'arrêt "Graviers" de la ligne J2.  * "Ferme de l'hôpital" est supprimé.Merci de votre compréhension.
METRO  : Trafic ralenti  (Saint-Denis Université - Asnières-Gennevilliers - Les Courtilles - Châtillon-Montrouge) :En raison d'une panne de signalisation, le trafic est ralenti sur l'ensemble de la ligne. 
RER D : trafic perturbé jusqu'en fin de soirée Accident de personne au Vert de Maisons sur la ligne D du RER .Cet incident est terminé.Cependant, un allongement du temps de parcours de 10 à 20 minutes et des modifications de desserte sont à prévoir jusqu'en fin de soirée sur l'ensemble de la ligne.SNCF Transilien
Travaux de rénovation à La Motte-Picquet Grenelle Du 3 novembre au 17 décembre 2014 inclus. Travaux de rénovation à La Motte-Picquet Grenelle le quai M 8 en direction de Balard sera fermé au public. Le quai en direction de Créteil et les correspondances avec les lignes M 6 et M 10 restent assurées. - Depuis La station La Motte-Picquet - Grenelle :Pour la direction de Balard, prendre M8 direction Créteil jusqu'à École Militaire puis changer de quai pour reprendre le train en sens inverse (direction Balard). - Depuis la ligne M8 direction Balard :Pour vous rendre à La Motte-Picquet - Grenelle, descendre à Commerce puis changer de quai pour reprendre le train en sens inverse (direction Créteil). 
Ligne U: perturbations jusqu'à 10h30 Mauvaise adhérence au rail sur la ligne U.Un allongement du temps de parcours de 15 à 20 minutes est à prévoir, dans les deux sens sur l?ensemble de la ligne, jusqu?à 10h30.SNCF Transilien
RER B: Aulnay-aéroport CDG jusqu'au 07/11. Travaux de maintenance entre Aulnay sous Bois et Aéroport Charles de Gaulle sur la ligne B du RER, à partir de 23h05 du 1er septembre au 7 novembre 2014 : SNCF Transilien
RER A: Trafic interrompu Saint-Germain-en-Laye - Poissy - Cergy Le Haut- Boissy-Saint-Léger - Marne-la-Vallée - Chessy En raison de la présence d'un colis suspect à Saint-Germain-en-Laye, le trafic est interrompu entre les gares Saint-Germain-en-Laye et Le Vesinet-Le Pecq. Reprise estimée vers 11h00. 
Ligne P: perturbations sur Meaux-La Ferté Milon. Incident affectant la voie à La Ferté Milon sur la ligne P.Le train suivant est origine Lizy sur Ourcq:La Ferté Milon 12h01 - Meaux 12h36, mission MOFO.Une substitution routière est mise en place entre Lizy sur Ourcq et La Ferté Milon à 12h40.SNCF Transilien
Départ avancé_Ligne 12  Le départ de 8h de la Gare des Mureaux est avancé à 7h55.Les horaires seront tres prochainement affichés aux arrêts. En attendant, vous pouvez les télécharger au format pdf dans la partie "OUTILS".Bon Voyage sur votre ligne !Le Service Client d'Ecquevilly
Desserte de Maison des Associations_Lignes 312 et  L'arrêt "Maison des Associations" aux Mureaux sera désormais desservi sur les départs suivants :- Ligne 312 : départ de 16h40 du lycée F. Villon- Ligne 313 : départ de 17h30 du lycée VaucansonVos nouveaux horaires seront affichés tres prochainement aux arrêts. En attendant, ils sont téléchargeables dans la partie "OUTILS".Bon voyage sur nos lignes !Le Service Client d'Ecquevilly
TRAMWAY : T3A trafic perturbé (Pont du Garigliano - Porte de Vincennes) : En raison d'un voyageur malade à Porte d'Italie, en direction de Porte de Vincennes, la ligne est pour le moment figée.
RER C : trafic ralenti jusqu' à 21h00 Un allongement de temps de parcours de 10 à 15 minutes et des modifications de desserte sont à prévoir sur l'ensemble de la ligne C du RER jusqu'à 21h00.Motif: Panne d'un train à Cernay et conditions climatiques dégradées.SNCF Transilien
Ligne L : trafic ralenti jusqu'à 19h00 Actes de malveillance sur un train à Neuville, sur la ligne L.Un allongement du temps de parcours de 10 à 20 minutes est à prévoir sur l'axe :- Paris - Cergy le Haut .Un retour à la normale est prévu vers 20h00 .SNCF Transilien
Métro 5: Trafic ralenti Bobigny - Pablo Picasso - Place d'ItalieEn raison d'une panne de signalisation à Gare du Nord, le trafic est ralenti sur l'ensemble de la ligne. 
Ligne H : Montsoult-Luzarches 27 oct au 07 nov Des travaux de maintenance des voies entre Montsoult Maffliers et Luzarches sur la ligne H, modifient la circulation du dernier train sur l'axe Paris Nord - Luzarches, les nuits du lundi 27 octobre au vendredi 07 novembre 2014, à partir de 23h35 sauf le week-end.Le train est supprimé entre Monsoult Maffliers et Luzarches et une substitution routière est mise en place .SNCF Transilien
DEFILE DU MARDI 11 NOVEMBRE 2014  Nous informons notre aimable clientele qu'un défilé organisé dans la commune du Vésinet nous oblige à dévier dans les 2 sens la ligne 7SG uniquement les bus allant ou venant de St Germain en Laye, toute la journée.Par conséquent les arrêts: Rond Point Royal et Hôtel de ville du Vésinet ne seront pas desservis.Nous vous rappelons que les horaires des lignes fonctionneront comme un dimanche car nous serons un jour férié.Merci de votre compréhension.
Horaires Ligne 29 Modification des horaires de la Ligne 29 en direction de RambouilletA compter du lundi 03 novembre 20104, modification des horaires.Voir le document des nouveaux horaires dans OUTILS et modifications horaires Ligne 29 à droite de l'écran.Merci de votre compréhension.
Ligne 3B : trafic interrompu En raison d'un incident technique, le trafic est interrompu sur l'ensemble de la ligne. 
Ligne N: perturbations jusqu'à 10h30 Mauvaise adhérence au rail sur la ligne N.Un allongement du temps de parcours de 15 à 20 minutes est à prévoir, dans les deux sens sur l?ensemble de la ligne, jusqu?à 10h30.SNCF Transilien
Desserte Place Rouget_Ligne 5 Bus O'Mureaux L'arrêt "Place Rouget" sera desservi en direction de la Gare ainsi qu'en direction de Descartes.Les nouveaux horaires sont disponibles en pdf dans la partie "OUTILS".Bon voyage sur nos lignes !Le Service Clients d'Ecquevilly
Ligne R : trafic perturbé jusqu' à 19h00 Accident de personne au Vert de Maisons, sur la ligne D du RER, impactant la ligne R .Cet incident est terminé, et le trafic a repris .Des allongements de temps de parcours importants sont à prévoir jusqu' à 19h00 LIgne J : trafic interrompu d'Argenteuil à  Ermont Défaut d'alimentation électrique sur l'axe Ermont Eaubonne, sur la ligne J.Le trafic est suspendu, dans les deux sens de circulation, entre  et  sur l'axe Paris Saint-Lazare / Ermont EaubonneLes gares de  et Ermont Eaubonne ne sont pas desservies.Les voyageurs souhaitant se déplacer entre Paris et Ermont Eaubonne, dans un sens ou dans l'autre, sont invités à emprunter les trains de la ligne H (gare du Nord) ou les trains de la ligne C du RER.Une substitution routière est mise en place .Une reprise des circulations est prévue vers 18h00.SNCF Transilien
