Travaux Ligne 04 Du lundi 25 mai 2015 au vendredi 10 juillet 2015 inclus, des travaux devoirie sont entrepris sur la VC n° 3 entre Longchêne et Pequeuse. La routesera fermée à la circulation. Une déviation est mise en place pour les coursesempruntant ce trajet. De légers retards sont à prévoir. Voir plan de déviationà droite dans OUTILS.
Ligne R : Paris-Monterau via Moret 25 au 29 mai Des travaux de maintenance des installations modifient la circulation des trains sur la ligne R, sur l'axe Paris Gare de Lyon - Montereau via Moret Veneux les Sablons, dans les deux sens, les nuits du lundi 25 au vendredi 29 mai 2015, à partir de 22h49.Un service de bus de substitution est mis en place entre Melun et Montereau, et entre Montereau et Paris Gare de Lyon.Pendant les travaux, covoiturez avec , Transilien vous rembourse.SNCF Transilien
Ligne P : Paris - Provins du 04 au 29 mai Des travaux de maintenance des appareils de voies entre Nogent le Perreux et Gretz-Armainvilliers modifient la circulation des trains sur la ligne P - axe Paris Est - Provins - les soirées du lundi 04 au vendredi 29 mai, à partir de 20h45 sauf les samedis et dimanches.Pendant les travaux, covoiturez avec , Transilien vous rembourse.SNCF Transilien
Ligne P :  Paris Meaux interrompu Axe(s) concerné(s) :Paris - Chelles Gournay - MeauxLe trafic reprend progressivement entre Paris et Chelles Gournay / Meaux, dans les deux sens, puis prévoir un allongement du temps de trajet de 10 à 20 minutes jusqu' à 14h00.Motif : actes de malveillance à Le Chenay Gagny ( incident terminé )SNCF Transilien
Ligne N : Plaisir Grignon / Dreux  interrompu Axe(s) concerné(s) :Paris/Dreux Trafic interrompu entre Plaisir - Grignon et Dreux, dans les deux sensReprise des circulations estimée à 19h00.Motif : incident affectant la signalisation à Dreux.SNCF Transilien
Ligne N: Dreux Plaisir ralenti Axe concerné:Dreux / Plaisir Grignon - Paris.Le trafic reprend dans les deux sens entre Dreux et Plaisir Grignon .P¨révoir un allongement du temps de parcours jusqu'à 10h00.Motif : défaut d'alimentation électrique à Tacoignières ( incident terminé ).SNCF Transilien
RER E :  Paris Chelles ralenti Axe(s) concerné(s) :Paris Haussmann Saint Lazare/Chelles GournayLe trafic reprend progressivement entre Paris et Chelles Gournay, dans les deux sens, puis prévoir un allongement du temps de trajet de 10 à 15 minutes jusqu' à 14h00.Motif : actes de malveillance à Le Chenay Gagny ( incident terminé )SNCF Transilien
LIGNE 3 : BROCANTE DES FAMILLES LE LUNDI 25 MAI 2015 Nous informons notre aimable clientele qu'en raison de la Brocante desFamilles à Chatou le lundi 25 Mai 2015, l'arrêt CES RENOIR direction LesPortiques/Gare de Chatou-Croissy sera reporté à l'arrêt Jean Jaures de début àfin de service.Attention durant cette journée, les horaires seront Dimanche seront appliqués!Merci d'en prendre bonne note.
T3A Trafic interrompu : (Pont du Garigliano - Porte de Vincennes) : En raison d'un malaise voyageur, le trafic est interrompu sur l"ensemble de la ligne. Trafic normal sur les autres lignes de Tramway.
RER D : Paris/Melun via Combs la V. ralenti Axe(s) concerné(s) :Paris/Melun via Combs la VillePrévoir des retards pouvant atteindre 20 minutes supplémentaires de trajet, dans les deux sensFin des ralentissements estimée à 23h00.Motif : panne d?un train de marchandises à Montgeron (incident terminé).SNCF Transilien
Lundi de Pentecôte Mesdames, Messieurs, nous tenons à vous rappeler que le lundi 25 mai, noslignes circuleront en horaires de dimanches et jours fériés (lundi dePentecôte)Nous vous souhaitons un agréable trajet sur nos lignes.
RER C : Invalides - Pontoise 18 au 29 mai Des travaux modifient la circulation des trains de la ligne C du RER - axe Invalides / Juvisy - les nuits du lundi 25 / mardi 26 mai au vendredi 29 / samedi 30 mai, à partir de 23h20.Pendant les travaux, covoiturez avec , Transilien vous rembourse.SNCF Transilien
RER A : Paris-Cergy/Poissy 25 mai au 05 juin Des travaux sur les voies entre Paris Saint-Lazare et Cergy le Haut interrompent la circulation des trains du RER A, entre Nanterre Préfecture et Cergy le Haut et entre Nanterre Préfecture et Poissy, dans les deux sens, tous les soirs à partir de 21h30, du lundi 25 mai jusqu'au vendredi 5 juin sauf le samedi 30 mai et le dimanche 31 mai.- Aucun RER A sur les branches Cergy le Haut et Poissy. - Mise en place d'une substitution routière entre Sartrouville et Cergy le Haut et entre Bécon les Bruyères et Sartrouville, dans les deux sens.Pendant les travaux, covoiturez avec , Transilien vous rembourse.SNCF Transilien
RER E: Haussmann-Villiers/Tournan 11 au 29 mai Des travaux de modernisation du poste d'aiguillage de Gretz-Armainvilliers modifient la circulation des trains de la ligne E du RER - axe Haussmann Saint-Lazare / Villiers/Tournan - les soirées du lundi 11 mai au vendredi 29 mai 2015 à partir de 22h15 sauf les samedis et dimanches.Pendant les travaux, covoiturez avec , Transilien vous rembourse.SNCF Transilien
Ligne R : Paris-Montargis du 18 mai au 5 juin Des travaux de maintenance des installations modifient la circulation des trains sur la ligne R entre Melun et Montargis les nuits du lundi 18 / mardi 19 mai jusqu'au vendredi 05 / samedi 06 juin 2015(sauf samedis, dimanches et fêtes) à partir de 22h00.- Les trains GAMO et GAMU de 21h19 et 22h19 au départ de Paris Gare de Lyon sont terminus Moret Veneux les Sablons (nouveau code mission YAMO).Un service de bus de substitution est mis en place entre Moret Veneux les Sablons et Montargis.Pendant les travaux, covoiturez avec , Transilien vous rembourse.SNCF Transilien
Ligne P : Paris - Coulommiers du 04 au 29 mai Des travaux de maintenance des appareils de voies entre Nogent le Perreux et Gretz-Armainvilliers modifient la circulation des trains sur la ligne P - axe Paris Est - Coulommiers - les soirées du lundi 04 au vendredi 29 mai, à partir de 22h25 sauf les samedis et dimanches.Pendant les travaux, covoiturez avec , Transilien vous rembourse.SNCF Transilien
Ligne N : Paris - Plaisir 25 au 30 mai Des travaux de renouvellement d'appareils de voies à Saint-Cyr modifient la circulation des trains de l'axe Paris Montparnasse - Plaisir Grignon, les nuits du lundi 25 / mardi 26 au vendredi 29 / samedi 30 mai 2015, à partir de 22h20. Pendant les travaux, covoiturez avec , Transilien vous rembourse.SNCF Transilien
RER C : trafic perturbé. Axe concerné :Ensemble de la ligne.Prévoir 10 à 20 minutes supplémentaires de trajet dans les deux sens.Fin des ralentissements estimée à 16h00.Motif : panne d?un train à Viroflay Rive Gauche et applications de mesures de sécurité (personnes sur les voies). (incidents terminés).SNCF Transilien
