RER C : Massy-Choisy via Pt-Rungis interrompu Axe concerné :Massy Palaiseau/Choisy le Roi via Pont de Rungis Aéroport d'Orly .Trafic interrompu entre Massy Palaiseau et Choisy le Roi via Pont de Rungis, dans ce sens Métro 6 : trafic ralenti  (Charles de Gaulle Etoile - Nation) :En répercussion d'un accident grave de voyageur, le trafic est ralenti sur l'ensemble de la ligne. 
Manifestation ce jour dans Paris : A partir de 18h30, rassemblement Place du Canada puis défilé par cours Albert 1er, avenue de New York, avenue du Président Kennedy jusqu'à la place de Bolivie aux abords de l'ambassade de Turquie, 16 avenue de Lamballe. Lignes de Bus déviées dans ce secteur. 28, 42, 63, 72, 80, 82, 83, 92 et 93. 
Métro 3B : Trafic ralenti  En raison d'un incident d'exploitation, le trafic est ralenti sur l'ensemble de la ligne. 
Déviation avec suppression d'arrêts Lundi 27 avril 2015 de 9h à 17h, la rue de Montreuil à Versailles sera fermée pour travaux.Les arrêts suivant ne pourront plus être desservis uniquement en direction de Versailles rive gauche :Alexandre 1er (ligne C) = report arrêt le plus proche Alexandre 1er (ligne F)Montreuil : report arrêt le plus proche République Lesseps (ligne D)Saint-Symphorien : report arrêt le plus proche République Lesseps (ligne D)République-Lesseps (ligne C) : report arrêt le plus proche République Lesseps (ligne D)
Ligne N : Paris / Dreux Mantes nuit du 24 au 25/04 Des travaux de maintenance des voies à Saint-Cyr modifient la circulation des trains des axes Paris Montparnasse - Plaisir Grignon - Mantes La Jolie / Dreux, la nuit du vendredi 24 / samedi 25 avril 2015 à partir de 20h50. Pendant les travaux, covoiturez avec , Transilien vous rembourse.SNCF Transilien
Fermeture accès Mignot Samedi 25, dimanche 26 et lundi 27 avril 2015, toute la journée, l'accès à l'hôpital André Mignot ne sera plus possible.Les bus A déposeront les voyageurs à l'extérieur de l'hôpital (arrêt H) et les reprendront à l'extérieur à l'arrêt Hôpital Mignot situé devant le laboratoire d'analyse (arrêt H)
Metro 11 (Châtelet - Mairie des Lilas) : Malaise v En raison d'un malaise voyageur à Jourdain, l'arrêt n'est pas marqué à la station Jourdain dans les deux directions. 
Ligne P: Esbly-Crécy ralenti Axe concerné:Esbly-Crécy la Chapelle.Les trains suivants sont remplacés par des bus:Crécy la Chapelle 05h10 - Esbly 05h21, mission EICE.Crécy la Chapelle 05h55 - Esbly 06h06, mission EICE.Esbly 05h30 - Crécy la Chapelle 05h41, mission RICE.Motif: avarie de matériel sur un train à EsblySNCF Transilien
LigneP:Verneuil-Longueville interrompu Axe concerné :Paris/ProvinsLe vendredi 24 avril : trafic interrompu dans les deux sens entre Verneuil L'Etang et Longueville.Une substitution routière est en place sur ce parcours.A l'arrivée et au départ de Nangis, la substitution routière se fait devant le CFA AFOBAT, situé 3 bis avenue Charles de Gaulle. Une navette routière est mise en place par la mairie de Nangis entre la gare de Nangis et le lieu de passage de la substitution routière SNCF.Des trains circulent entre Paris Est et Verneuil L'Etang, ainsi qu'entre Longueville et Provins.Prévoir un allongement du temps de trajet pour ces relations.Motif : accident routier au passage à niveau de Nangis.SNCF Transilien
Metro 6 (Charles de Gaulle Etoile - Nation) :  En raison d'une panne de signalisation, le trafic est ralenti sur l'ensemble de la ligne. 
