Ligne J: perturbations axe Ermont. Restitution tardive de travaux à Asnières sur Seine sur la ligne J.Des modifications de desserte sont à prévoir, dans les deux sens sur l?axe :- Paris Saint-Lazare / Ermont Eaubonne.Le train suivant est supprimé:Ermont Eaubonne 8h43 - Paris Saint-Lazare 9h13, mission PAPE.Ces perturbations sont à prévoir jusqu?à 9h10. SNCF Transilien
T1: trafic interrompu  En raison de la présence d'un colis suspect, le trafic est interrompu entre les arrêts BOBIGNY - PABLO PICASSO et NOISY-LE-SEC RER sur la ligne. 
Ligne J : trafic perturbé Pannes de trains sur la ligne J.Les trains suivants sont supprimés :Paris Saint-Lazare, départ 19h50, Cormeilles en Parisis, arrivée 20h10, mission : KAZACormeilles en Parisis, départ 19h19, Paris Saint-Lazare, arrivée 19h40, mission : PIZASNCF Transilien
Ligne H: interruption Sarcelles-Epinay. Présence d'obstacles sur la voie à Sarcelles Saint-Brice sur la ligne H.Le trafic est interrompu dans les deux sens entre  et .Les voyageurs désirant se déplacer entre Paris Nord et Persan Beaumont, dans un sens ou dans l?autre, sont invités à emprunter un train de l?axe : Paris Nord / Valmondois / Persan Beaumont. Les voyageurs désirant se déplacer entre Paris Nord et Saint-Denis, dans un sens ou dans l?autre, sont invités à emprunter un train de la ligne D du RER.  Les voyageurs désirant se déplacer entre Paris et, Montmagny ou Sarcelles dans un sens ou dans l?autre, sont invités à emprunter la ligne D du RER entre Paris Nord et Garges Sarcelles, et la ligne de tramway T5 (station Marché de Saint-Denis).Une reprise du trafic est prévue pour 11 heures.SNCF Transilien
ORGEVAL-MORAINVILIERS Travaux imprévus En raison de travaux imprévus entre Orgeval-Montamets et Morainvilliers-Croix Paquet, des retards sont à prévoir ce matin sur les lignes 20 et 21. 
Déviation sur L. 5 au Tremblay-s/M du17/09 a 19/09 En raison de travaux de voirie au Tremblay-sur-Mauldre sur la D13 , nous vous informons que les arrêts "Le Tremblay Eglise", "Bazoches Eglise", "Bois de Mareil" et "Vert Buisson" ne seront pas desservis du mercredi 17 septembre au vendredi 19 septembre 2014 de 9h00 à 16h00.Pour l?arrêt "Vert Buisson", merci de vous reporter à l?arrêt "AFT-IFTIM".Merci de votre compréhension.
APOLO7 - Déviation ligne C  En raison d'une fuite de gaz, la ligne C est déviée et empruntera le trajet de la ligne F entre Vaires Square SNCF & Base Olympique pour la journée.Les arrêts Parc de L'Aulnay, College Goscinny, Cité EDF & Base Olympique (arrêt de la C ne seront pas desservis).Vous pouvez vous reporter à l'arrêt République de la ligne F
APPLICATION DES HEURES DU 11/11/2014 Nous informons notre aimable clientèle que pendant le jour férié du mardi 11 novembre les horaires du dimanche seront appliquées.Merci d'en prendre note.
Ligne H : Paris - Valmondois, légers retards Présence d'une voiture près des voies à proximité de la gare de Frépillon sur la ligne H.Cet incident est terminéToutefois, des retards de 5 à 10 minutes sont à prévoir sur l?axe :- Paris - Valmondois - Persan BeaumontLe retour à la normale est prévu à 15h20SNCF Transilien
perturbation sur J4 et J6 Des travaux d'entretien du réseau perturbent le trafic sur la ligne J.Le trafic est interrompu sur les axes : - Paris - Mantes la Jolie via Conflans- Paris - Pontoise - Gisors- Paris - Ermont Eaubonne SNCF Transilien
Ligne H : Paris Ermont Pontoise 17 au 19 septembre Des travaux de maintenance des installations électriques entre Ermont Eaubonne et Pontoise modifient la circulation des trains sur la ligne H - axe Paris Nord / Montigny Beauchamp / Ermont Eaubonne / Pontoise - les soirs du mercredi 17 au vendredi 19 septembre 2014 à partir de 22h40. SNCF Transilien
T4 Trafic ralenti Aulnay-sous-Bois - BondyAvarie technique sur un tramway de la ligne T4.La fréquence de passage des tramways peut atteindre 12 minutes, dans les deux sens, entre Aulnay sous Bois et Bondy.Cette perturbation est à prévoir jusqu'à 10 heures. 
APOLO7 - Déviation ligne F - Travaux à Grande Prai En raison des travaux d'extension du réseau de géothermie, la ligne F est fortement perturbée au niveau de l'arrêt Grande Prairie.Une déviation est donc mise en place afin de maintenir le trafic sur la ligne et les arrêts 'Grande Prairie' & 'Martyrs' en direction de la gare de Chelles ne sont plus desservis.Veuillez nous excuser pour la gene occasionnée.
RER D : Corbeil - Melun perturbé jusqu'à 14h00 Dysfonctionnement d'un passage à niveau à Saint-Fargeau sur la ligne D du RER.Cet incident est terminé.Des retards de 20 à 40 minutes sont à prévoir jusqu'à 14h00 sur l'axe :-Corbeil Essonnes - Melun.SNCF Transilien
T4: fréquence de 6 à 12 minutes jusqu'à 22h00 Avarie technique sur un tramway de la ligne T4.La fréquence de passage des tramways peut atteindre 12 minutes, dans les deux sens, entre Aulnay sous Bois et Bondy.Cette perturbation est à prévoir jusqu?à 22 heures. SNCF Transilien
Ligne N : Dreux/Mantes - Paris perturbé Panne d'un train arrêté entre les gares de Villiers Neauphle le Château et Plaisir Grignon sur la ligne N.Cet incident est terminé.Le trafic reprend progressivement.Des retards de 10 à 15 minutes sont à prévoir, dans les deux sens de circulation, sur les axes  - Paris Montparnasse - Dreux - Paris Montparnasse - Mantes la JolieUn retour à la normale est prévu vers 19h30.SNCF Transilien
