Bus RATP Manifestation le 9 avril : A noter Jeudi 9 avril 2015, manifestation sur la voie publique. Rassemblement place d'Italie puis défilé par l'avenue des Gobelins, les boulevards du Port Royal, du Montparnasse et des Invalides jusqu'à l'Esplanade des Invalides où aura lieu la dislocation du cortège aux environs de 18:00. Lignes de bus impactées: 21, 27, 28, 38, 39, 47, 58, 63, 64, 67, 68, 69, 70, 73, 82, 83, 87, 88, 89, 91, 92, 93, 94, 95 et 96. 
Mouvement social reconductible. Mouvement social sur vos lignesA compter du jeudi 9 avril 2015, un mouvement social reconductible affecte la circulation de vos lignes.Des perturbations sont à prévoir sur vos lignes, un service minimum sera néanmoins assuré.Nous vous recommandons de prendre en compte les prévisions de trafic pour organiser vos déplacements.Les horaires sont consultables sur le site internet [www.transdev-idf.com][1] et un numéro d'information est mis à votre disposition (01.39.98.26.17).Avec nos sinceres excuses pour le désagrément occasionné.
T2 Trafic perturbé : (Pont de Bezons - Porte de Versailles) : Arrêts Parc Pierre Lagravere, en raison d'un accident entre tiers sur la voie publique, le trafic est interrompu entre Pont der Bezons et Parc Pierre Lagravere.
Ligne L: axes Versailles RD-St nom la B /Paris Des travaux d'entretien du réseau perturbent le trafic sur la ligne L.Les trains circulent avec des retards de 20 à 30 minutes environ et des suppressions ou modifications de desserte sont possibles sur les axes : - Paris - Versailles Rive Droite- Paris - St Nom la Bretèche- Paris - St Cloud SNCF Transilien
METRO 3 : Trafic ralenti  (Pont de Levallois Bécon - Gallieni) : En raison d'une panne de signalisation, le trafic est ralenti sur l'ensemble de la ligne. 
RER C :  Ivry, Vitry, Les Ardoines non desservis Axe(s) concerné(s) : Paris Austerlitz - Choisy le RoiIvry sur Seine, Vitry sur Seine, Les Ardoines non desservis, dans ce sens.Pour rejoindre ces gares, aller jusqu'à Choisy le Roi et prendre un train en direction de ParisArrêts à nouveau desservis à partir de 09h20.Motif : incident affectant la voie à Bibliothèque François Mitterrand.SNCF Transilien
Ligne H: mouvement social le jeudi 09 avril Axes concernés :Ensemble de la ligne.La prévision de trafic est de 3 trains sur 4 en moyenne en heures de pointe.Motif : mouvement social le jeudi 09 avril 2015SNCF Transilien
Ligne J: suppressions Paris - Cormeilles Axe concerné:Paris - Cormeilles en Parisis.Trains supprimés:Paris 17h30 - Cormeilles en Parisis 17h50, mission KAZA.Paris 18h30 - Cormeilles en Parisis 18h50, mission KAZA.Cormeilles en Parisis 17h59 - Paris 18h20, mission PIZA.Cormeilles en Parisis 18h59 - Paris 19h20, mission PIZAMotif: avarie de matériel.SNCF Transilien
Ligne T4 : Trafic ralenti le 09 avril Axe(s) concerné(s) :Ensemble de la ligne.Prévoir jusqu'à 15 minutes entre chaque tramway, dans les deux sens, jusqu'à 22h00.Un service de bus est mis en place à partir de 22h00.Motif : mouvement social le jeudi 09 avril.SNCF Transilien
RER C : Brétigny/Dourdan ralenti Axe concerné :- Brétigny - DourdanPrévoir 10 à 15 minutes supplémentaires de trajet, dans ce sens.Fin des ralentissements estimée à 19h00.Motif : incident affectant la signalisation entre Saint-Chéron et Sermaise .SNCF Transilien
Ligne P : trafic très ralenti Axes concernés :Paris/Château ThierryParis/CoulommiersParis/ProvinsParis/MeauxTrafic très ralenti sur ces axes, dans les deux sensFin des ralentissements estimée à 13h00.Motif : accident de personne à Pantin.SNCF Transilien
RER B : Reprise très progressive du trafic  (Aéroport Charles de Gaulle - Mitry-Claye - Robinson - Saint-Rémy-lès-Chevreuse) : Reprise très progressive du trafic entre Aulnay-sous-Bois et Mitry-Claye, dans les deux sensLa gare de Villeparisis Mitry le Neuf n'est pas desservie.Arrêt à nouveau desservi à partir de 11h00Un service de substitution routière est en cours.Motif : accident de personne à Villeparisis.
