Ligne K : suppression Paris / Crépy en Valois Axe concerné :Paris / Crépy en ValoisTrain supprimé : - Paris Nord, départ 12h12 - Crépy en Valois, arrivée 13h07, code mission PAVAMotif : avarie sur le matérielSNCF Transilien
Fin grève Athis Cars Reprise progressive de la circulation des bus sur nos lignes. La situation reviendra à la normale dans le courant de la journée du jeudi 12 mars 2015.
RER C: Paris-Pontoise perturbé. Axe concerné:Paris-Pontoise.Prévoir 10 à 20 minutes supplémentaires de trajet, dans les deux sens.Fin des ralentissements estimée à 15h30.Trains impactés:MONA (Pontoise-Massy Palaiseau).NORA (Massy Palaiseau-Pontoise).GOTA (Pont de Rungis-Montigny Beauchamp).ROMI (Montigny Beauchamp-Pont de Rungis).Motif: incident affectant la signalisation à Pontoise.SNCF Transilien
Ligne K: suppression Paris- Crepy en Valois. Axe concerné:Paris Nord ? Crépy en Valois. Train supprimé:Paris Nord 17h30 ? Crépy en Valois 18h17, mission PACY.Train suivant à circuler:Paris Nord 18h00 ? Crépy en Valois 18h56, mission PAVA.Motif: avarie de matériel.SNCF Transilien
RER C: Brétigny-Dourdan ralenti Axe concerné:Brétigny - Dourdan.Reprise progressive du trafic entre Brétigny et Dourdan dans les deux sens.Prévoir 10 à 20 minutes supplémentaires de trajet.Fin des ralentissements estimée à 19h00.Motif: dysfonctionnement d'un passage à niveau Breuillet Village.SNCF Transilien
RER D :  Créteil Pompadour non desservi Axe(s) concerné(s) :Paris/Melun via Combs la VilleParis/Melun via Corbeil EssonnesParis/MalesherbesCréteil Pompadour non desservi, dans ce sens.Arrêt à nouveau desservi à partir de 20h15.Depuis Paris, pour rejoindre Créteil Pompadour, veuillez descendre en gare de Villeneuve Saint Georges afin d'emprunter un train dans l'autre sens.Depuis Créteil Pompadour, pour aller en direction du Sud de la ligne, veuillez emprunter un train jusqu'à Maisons Alfort Alfortville et emprunter ensuite un train dans l'autre sens.Motif : Panne d'un train à Créteil Pompadour.SNCF Transilien
Ligne H: Paris-Pontoise perturbé. Axe concerné:Paris-Pontoise.Prévoir 20 à 30 minutes supplémentaires de trajet, dans les deux sens.Fin des ralentissements estimée à 15h30.Motif: incident affectant la signalisation à Pontoise.SNCF Transilien
LIGNE 19: TRAVAUX RUE FELICIEN LESAGE A MONTESSON DU 12 AU 13 MARS 2015 DE 9H A 17H Nous informons notre aimable clientele qu'en raison de travaux rue FélicienLesage à Montesson du 12 au 13 mars 2015, uniquement en direction de gare duVésinet Le Pecq, les arrêts Le Montoir (côté Doumer), Champs Roger, Poste,Aristide Briand, Eglise, Général Leclerc, Victor Hugo ne seront pas desservis.Veuillez vous reporter aux arrêts Le Montoir (côté Général de Gaulle), LaTour.
Ligne J : suppression Paris-Ermont. Axe concerné:Paris St-Lazare ? Ermont Eaubonne Train supprimé:Paris St-Lazare 19h57 ? Ermont Eaubonne 20h20, mission EAPE.Motif: avarie de matériel.SNCF Transilien
LIGNE 107 - ACCIDENT DE CIRCULATION Accident route de Corbeil à STE GENEVIEVE DES BOIS. Les arrêts "Stalingrad" et"Lafayette", direction MASSY RER, ne sont plus desservis. Une déviation estactuellement mise en place par les forces de l'ordre. Retard à prévoir sur lesarrêts suivants. Nous vous présentons toutes nos excuses pour le désagrémentsubi.
