Metro 4 (Porte de Clignancourt – Mairie de Montrou En raison d'un incident technique, le trafic est ralenti sur l'ensemble de la ligne.
METRO 13 : Trafic ralenti  (Saint-Denis Université - Asnières-Gennevilliers - Les Courtilles - Châtillon-Montrouge) : En raison d'un incident technique, le trafic est ralenti sur l'ensemble de la ligne. 
Travaux ave de Rebais à Coulommiers Travaux ave de Rebais à CoulommiersDu mercredi 29 avril au samedi 16 mai 2015 inclusNous informons notre aimable clientèle qu'en raison de travaux de voirie, l'arrêt Coulommiers Cimetière ne sera pas desservi dans le sens Rebais - Melun.Report proposé à l'arrêt Coulommiers GambettaNous vous remercions de votre compréhension.
Ligne H: Paris-Montsoult ralenti. Axe concerné :Paris-Montsoult Maffliers - Persan Beaumont / Luzarches.Prévoir 10 à 15 minutes supplémentaires de trajet, dans les deux sens.Fin des ralentissements estimée à 10h00.Motif : dysfonctionnement de passage à niveau à Deuil Montmagny.SNCF Transilien
RER D: Paris-Melun ralenti. Axe concerné :Paris-Melun.Prévoir 10 à 20 minutes supplémentaires de trajet, dans les deux sens.Fin des ralentissements estimée à 9h00.Motif : avarie matérielle sur un train de marchandises à Montgeron Crosne (incident terminé).SNCF Transilien
Métro 8 (Balard Créteil - Pointe du Lac) :  En raison d'une panne de signalisation, le trafic est ralenti de Concorde vers Pointe du Lac. 
Travaux ave de Rebais Travaux avenue de RebaisDu mercredi 29 avril au samedi 16 mai 2015 inclusSuppression de l'arrêt cimetière uniquement dans le sens Theil Lavoir - Rue de Pontmoulin n 46 et Pontmoulin - Avenue de Rebais / Rue VerteReport proposé à l'arrêt Rue de Pontmoulin n 46Nous vous remercions de votre compréhension.
Pas de service les jours fériés Chers Clients,Nous vous informons que l'Express A14 "Mantes - La Défense" ne fonctionnera pas les jours fériés suivants :- Vendredi 1er Mai- Vendredi 8 Mai- Jeudi 14 Mai (Ascension)- Lundi 25 Mai (Pentecôte)Nous vous remercions pour votre compréhension.Le Service Commercial
RER C: Versailles-Massy ralenti. Axe concerné :Versailles Chantiers - Massy Palaiseau.Prévoir 20 minutes supplémentaires de trajet, dans les deux sens.Fin des ralentissements estimée à 12h00.Motif : dysfonctionnement d'un passage à niveau à Jouy en Josas.SNCF Transilien
RER C : axe Versailles/St Quentin 18 mai au 29 mai Des travaux modifient la circulation de certains trains de la ligne C du RER - axe Invalides - Versailles Château Rive Gauche / Saint-Martin d'Etampes - les soirées du lundi 18 mai au vendredi 29 mai 2015, sauf le samedi 23 mai, le dimanche 24 mai et le lundi 25 mai.Pendant les travaux, covoiturez avec , Transilien vous rembourse.SNCF Transilien
