Ligne U : La Défense - La Verrière 30 mars-01 mai Des travaux sur les voies entre Saint-Cyr et La Verrière modifient la circulation des trains sur la ligne La Défense - La Verrière, les nuits du lundi/mardi au jeudi/vendredi du 27 avril au 01 mai 2015 à partir de 00h38. Un bus de remplacement est mis en place pour le dernier train entre La Défense et La VerrièrePendant les travaux, covoiturez avec , Transilien vous rembourse.SNCF Transilien
Ligne K : Paris -St-Denis interrompu Axe(s) concerné(s) :ensemble de la ligne Trafic interrompu entre La Plaine Saint-Denis et Paris Nord, dans les deux sensReprise des circulations estimée à 21h40.Motif : personnes sur les voies entr PAris et Saint-DenisSNCF Transilien
RER C: Choisy-Pont de Rungis interrompu Axe concerné:Montigny Beauchamp-Pont de Rungis.A partir de 23h30, trafic interrompu entre  et Pont de Rungis dans ce sens, jusqu'en fin de service.Une substitution routière est mise en place entre Choisy le Roi et Pont de Rungis. Le dernier bus est prolongé jusqu'à l'aérogare sud et ouest d'Orly. Les voyageurs souhaitant se déplacer entre Paris et Pont de Rungis Aéroport d'Orly, sont également invités à emprunter la ligne B du RER entre Paris Nord et Antony, puis la navette Orlyval.Motif : Travaux à Choisy le Roi. SNCF Transilien
St-NOM-la-BRETECHE - Ligne 43 déviée En raison des travaux en partie basse de l'avenue des platanes la course de8h33 ne desservira pas les arrêts TENNIS et GRANDS CHAMPS. Merci de vous reporter aux arrêts CENTRE COMMERCIAL et OREE DE ST NOM.Merci de votre compréhension.
Déviation ligne F le 29 avril de 8h30 à 17h30 En raison de travaux, le 29 avril de 8h30 à 17h30, les arrêts suivants ne seront pas desservis :FENEZ, VERCORS, MONTAGNE DU MEE, 18 JUINVeuillez vous reporter aux arrêts suivants :CROIX BLANCHE, LIBERATION, SORBIERSNous vous présentons nos excuses pour la gêne occasionnée.
Ligne 1 : trafic interrompu  (Château de Vincennes - La Défense) :En raison d'un incident technique, le trafic est interrompu entre Charles de Gaulle Etoile et la Défense. Reprise estimée vers 6h20.Trafic normal sur les autres lignes de métro. 
PERTURBATIONS SUR LA LIGNE 30-05 LE 03 MAI 2015 Ligne 30-05 : Nous informons notre aimable clientèle qu'en raison d'une brocante sur la commune de Montigny-lès-Cormeilles le dimanche 03 mai 2015, les arrêts "Centre Commercial" et "Victor Hugo" ne seront pas desservis. Veuillez vous rendre aux arrêts "Les Bruyères" et "Charles de Gaulle / RD14". Merci de votre compréhension.  
Ligne T4 : Aulnay sous Bois/Gargan interrompu Axe concerné :Bondy/Aulnay sous BoisTrafic interrompu entre Gargan et Aulnay sous Bois, dans les deux sensReprise des circulations estimée à 11h00.Pour se déplacer entre Aulnay sous Bois et Gargan, Les Pavillons sous Bois, Allée de la Tour Rendez-Vous, Les Coquetiers, Remise à Jorelle et Bondy, les voyageurs sont invités à emprunter le RER B jusqu'à la gare du Nord puis le RER E (direction Chelles) à Magenta et, le cas échéant, le T4 à Bondy, ou inversement.Motif : incident affectant la voie à Aulnay sous Bois/Bondy.SNCF Transilien
Ligne L : Paris-Nanterre U ralenti. Axes concernés:Paris/Nanterre Université.Prévoir 10 minutes supplémentaires de trajet dans les deux sens. Fin des ralentissements estimée à 14h00.1 train sur 2 Paris-Nanterre Université supprimé dans les deux sens. Motif : incident affectant la voie à Asnières sur Seine (incident terminé).SNCF Transilien
RER A : Poissy/Sartrouville interrompu Axe concerné :Poissy/ParisTrafic interrompu entre Poissy et Sartrouville, dans ce sensReprise des circulations estimée à 11h00.Motif : incident affectant la voie à Poissy.SNCF Transilien
ST-NOM-la-BRETECHE - Ligne 42 perturbée En raison des travaux dans la partie basse de l'avenue des platanes à St-Nom, les courses de 8h20, 8h30, 8h42, et 8h51 le matin, les courses de 16h18, 16h35, 16h49 et 16h59 l?après-midi ne seront pas assurées (dans les 2 sens).Merci de votre compréhension.
Ligne J : Poissy/Paris interrompu Axe concerné :Mantes La Jolie / Paris Saint-Lazare via PoissyTrafic interrompu entre Poissy et Paris, dans ce sensReprise des circulations estimée à 11h00.Motif : incident affectant la voie à Poissy.SNCF Transilien
Perturbation ligne E les 29/04 et 13/05 En raison de travaux, le 29 avril et le 13 mai, de 7h45 à 18h30, l'arrêt 8 Mai1945 ne sera pas desservi.Veuillez vous reporter à l'arrêt Henri Wallon ou Résistance.Nous vous présentons nos excuses pour la gêne occasionnée.
St-NOM-la-BRETECHE - ligne 23 déviée En raison des travaux en partie basse de l'avenue des platanes, les courses suivantes seront déviées :- courses de 8h20 et 17h10 en direction de St-Germain en Laye,- courses de 8h10 et 16h45 en direction des Clayes sous bois.les arrêts CLOS SALIBERT, TENNIS, MAISON DES ASSOCIATIONS, GUITEL LECOQ ne seront pas desservis, veuillez de vous reporter aux 2 arrêts provisoires situés en haut du RD98.Merci de votre compréhension.
CRETEIL - Ligne 12 - Déviation : En raison de travaux à Créteil le mardi 28 avril 2015, une déviation est mise en place sur la ligne 12 de 9h à 13h :Dans le sens Créteil -> Santeny, l'arrêt _METRO PREFECTURE_ n'est pas desservi et est reporté à l'arrêt _CENTRE COMMERCIAL_ de la ligne 23.Nous vous prions de bien vouloir nous excuser pour la gêne occasionnée.Merci de votre compréhension.
Ligne P : suppressions Esbly/Crécy la Chapelle Axe concerné :Esbly/Crécy la ChapelleTrains supprimés : Esbly, départ : 10h10