Metro ligne 6: trafic ralenti (Charles de Gaulle Etoile - Nation) : En répercussion de la présence d'un colis suspect, le trafic est ralenti sur l'ensemble de la ligne. 
METRO 8 : Arrêt non desservi  (Balard – Créteil - Pointe du Lac) : En raison d'un accident grave de voyageur à La Motte Piquet Grenelle ligne 10, l'arrêt n'est pas marqué à la station La Motte-Picquet-Grenelle en direction de Pointe du Lac. 
Ligne G - déviation Jeudi 26 février 2015, les arrêts Jean Houdon et Général Mangin en direction de Versailles-Chantiers ne pourront plus être desservis.Du 27 janvier au vendredi 27 février 2015, les arrêts Jean Houdon et Général Mangin en direction de Pershing ne peuvent pas être desservis.
RER C : Versailles Ch - Paris trafic ralenti Axe(s) concerné(s) :Versailles Chantiers - Paris via Massy PalaiseauPrévoir jusqu'à 20 minutes supplémentaires de trajet pour les trains CIME/CITY Versailles Château Rive Gauche - Versailles Chantiers) et VICK (Versailles Chantiers - Versailles Château Rive Gauche)Fin des ralentissements estimée à 19h00.Motif : panne d?un train à Bièvres (incident terminé).SNCF Transilien
RER D : Paris-Villeneuve StG 05 au 30 janvier Des travaux modifient la circulation des trains entre Paris Gare de Lyon et Villeneuve Saint-Georges, sur la ligne D du RER, les nuits du lundi 05 / mardi 06 janvier au vendredi 30 / samedi 31 janvier 2015, de 22h24 jusqu'en fin de service, sauf les weekends.A partir de 23h00, les départs des trains se font de Paris Lyon Grandes Lignes.Certains arrêts ne sont pas desservis.Une substitution routière est mise en place. Pendant les travaux, covoiturez avec , Transilien vous rembourse.SNCF Transilien
Ligne K : Crépy - Mitry interrompu dans ce sens Axe concerné:Crépy en Valois - Paris.Le trafic est interrompu entre Crépy en Valois et Mitry Claye, dans ce sens.Reprise de la circulation envisagée à 07h15.Motif: panne d'un train à Nanteuil Le haudouinSNCF Transilien
RER C : train 22h14 Versailles Paris du 26 au 30/1 Des travaux de maintenance sur les voies à Choisy le Roi modifient la circulation d'un train VICK en soirée, du lundi 26 au vendredi 30 janvier 2015, départ à 22h14 de Versailles Chantiers .  Pendant les travaux, covoiturez avec , Transilien vous rembourse.SNCF Transilien
Ligne H : Persan Valmondois/Montsoult ralenti Axes concernés :Paris Nord - Persan Beaumont via Montsoult MaffliersParis Nord - Persan Beaumont via ValmondoisTrafic ralenti entre Persan - Beaumont-sur-Oise et Montsoult - Maffliers et Valmondois, dans les deux sensFin des ralentissements estimée à 21h00.Motif : bagage abandonné à Persan Beaumont (application du plan vigipirate).SNCF Transilien
Métro 12: trafic perturbé (Front Populaire - Mairie d'Issy) : En raison d'un incident technique, les trains ne marquent pas l'arrêt à Trinité dans les deux sens de circulation.
Ligne H : travaux 12 au 30 janvier sauf week-ends Travaux relatifs à la première phase de la rénovation du pont de Fort de la Briche, entre St-Denis et Epinay Villetaneuse, les soirs du lundi 12 au vendredi 30 janvier 2015, sauf week-ends.Certains trains sont supprimés à partir de 22h00 .Une substitution routière est mise en place. Pendant les travaux, covoiturez avec , Transilien vous rembourse.SNCF Transilien
Métro 11: Trafic Ralenti Châtelet - Mairie des Lilas: En répercussion d'une intervention des équipes techniques, le trafic est ralenti sur l'ensemble de la lignes. 
METRO 10 : Interruption de trafic (Boulogne Pont de Saint-Cloud - Gare d'Austerlitz) : En raison d'un accident grave de voyageur à La Motte Piquet Grenelle, le trafic est interrompu entre Duroc et Porte d'Auteuil.Reprise prévue vers 21h00. 
Ligne P : Meaux - Paris 19 au 30 janvier Des travaux d'aménagement des quais en gare d'Esbly modifient la circulation des trains sur la ligne P - axe Meaux - Paris Est - les soirées du lundi 19 janvier au vendredi 23 janvier 2015 et les soirées du lundi 26 janvier au vendredi 30 janvier 2015, à partir de 23h40.Une substitution routière est mise en place. Pendant les travaux, covoiturez avec , Transilien vous rembourse.SNCF Transilien
Métro 6: trafic perturbé (Charles de Gaulle Etoile - Nation) : En raison d'un incident technique, les trains ne marquent pas l'arrêt dans les deux sens de circulation. 
