METRO 8 : Incident technique  (Balard – Créteil - Pointe du Lac) : En raison d'un incident technique, le trafic est ralenti sur l'ensemble de la ligne. 
RER A : Nation / Fontenay Interrompu Axe(s) concerné(s) :Boissy Saint-Léger/ParisMarne la Vallée Chessy Parcs Disneyland/ParisTrafic interrompu entre Nation et Val de Fontenay, et entre Nation et Fontenay sous Bois, dans les deux sensMotif : bagage abandonné à Vincennes.SNCF Transilien
Ligne U : La Défense - La Verrière 04 au 15 mai Des travaux sur les voies entre Saint-Cloud et La Défense modifient la circulation des trains sur la ligne La Défense - La Verrière, les soirées du lundi 04 au vendredi 15 mai, à partir du 21h40, sauf la soirée du dimanche 10 mai.Une substitution routière est mise en place entre La Verrière et La Défense, dans les deux sens.Pendant les travaux, covoiturez avec , Transilien vous rembourse.SNCF Transilien
Tramway T3B : Trafic perturbé (Porte de Vincennes - Porte de la Chapelle) : En raison d'un stationnement gênant, le trafic est interrompu entre les arrêts PORTE DE MONTREUIL et PORTE DE VINCENNES.
Ligne U : La Verrière - La Défense 18 au 29 mai Des travaux sur les voies entre La Défense et Saint Cloud interrompent la circulation des trains entre La Verrière et La Défense, les nuits du lundi 18 / mardi 19 mai au vendredi 22 / samedi 23 mai et du mardi 26 / mercredi 27 mai au vendredi 29 / samedi 30 mai, à partir de 22h00 .Un service de bus de remplacement est mis en place .Pendant les travaux, covoiturez avec , Transilien vous rembourse.SNCF Transilien
Ligne N : Paris - Dreux 28 avril - 13 mai Des travaux de renouvellement des voies modifient la circulation des trains de l'axe Paris Montparnasse - Dreux, du lundi 11 / mardi 12 au mercredi 13 / jeudi 14 mai, à partir de 20h50. Pendant les travaux, covoiturez avec , Transilien vous rembourse.SNCF Transilien
Ligne U : La Verrière/La Défense interrompu Axe concerné :La Défense Grande Arche/La VerrièreTrafic interrompu entre La Verrière et La Défense Grande Arche, dans les deux sensReprise des circulations estimée à 07h00."Les gares de Versailles Chantiers, de Saint-Cyr et de Saint-Quentin en Yvelines sont accessibles par les trains des lignes N (réseau Paris Montparnasse) et C du RER.Pour se rendre à La Défense :* emprunter la ligne C du RER, puis la ligne  à partir d?Issy Val de Seine.* emprunter la ligne N ou C du RER jusqu'à Paris, avec les métros , ,  et  en correspondance .Pour rejoindre ou quitter les gares de :* ,* , * ,* , * , cliquer sur le lien concerné.Motif : panne d?un train de travaux à Saint-Cloud.SNCF Transilien
Lignes Génovébus 2 et 3 et lignes 107 et 108 En raison de travaux de voirie à Sainte-Genevieve-des-Bois,_Mardi 12 mai de 8h à 14h__les arrêts Eglise, Commissariat, Mare au Chanvre, Léo Lagrange, CimetiereRusse et Piscine (rue léo lagrange)_ne seront pas desservis pendant toute la durée des travaux.Consultez nos schémas de lignes pour trouver l'arrêt de desserte  leplusproche sur votre ligne.Bon voyage sur nos lignes !
Ligne U: La Defense-La Verrière les 11,12,15 mai Des travaux sur les voies entre Saint-Cloud et Versailles Rive droite modifient la circulation des trains sur l' axe La Défense - La verrière, les lundi 11 et mardi 12 mai, ainsi que le vendredi 15 mai 2015, à partir de 22h00 jusqu'en fin de service .Un service de bus de remplacement est mis en place.Pendant les travaux, covoiturez avec , Transilien vous rembourse.SNCF Transilien
Ligne L : Paris - Cergy trés perturbé Axes concernés :ensemble de la ligne Le trafic a repris dans les deux sens sur l'axe Paris Saint-Lazare - Cergy le Haut .Prévoir un allongement du temps de trajet de10 à 30 minutes sur l'axe Paris Saint-Lazare - Cergy le Haut, dans les deux sens .et de 10 à 15 minutes sur les axes versailles Rive Droite/St-Nom la Bretèche .Ralentissements à prévoir jusqu'en fin de soirée .Motif : défaut d'alimentation électrique à La Garenne Colombes, puis personnes dans les voies ( incidents terminés ) .SNCF Transilien
RER C : Paris/St Quentin en Yv. ralenti Axe concerné :Paris/Saint Quentin en YvelinesPrévoir 10 à 15 minutes supplémentaires de trajet, dans les deux sensFin des ralentissements estimée à 12h00.Motif : incident affectant la voie à Saint-Cyr.SNCF Transilien
METRO 3 : Incident technique  (Pont de Levallois Bécon - Gallieni) : En raison d'un incident technique, le trafic est ralenti sur l'ensemble de la ligne. 
RER E : Haussmann / Villiers / Tournan ralenti Axes concernés :Paris Haussmann Saint Lazare / TournanParis Haussmann Saint Lazare / Villiers sur MarnePrévoir jusqu'à 30 minutes supplémentaires de trajet, dans les deux sensFin des ralentissements estimée à 06h45.Motif : incident affectant la signalisation à Noisy-le-Sec.SNCF Transilien
Ligne J : horaire modifié train MOGA départ 01h03 Axe(s) concerné(s) :Paris Saint-Lazare / Mantes la Jolie via PoissyLe train MOGA à destination de Mantes la Jolie via Poissy prévu à 01h03 au départ de Saint Lazare a son horaire avancé de 5 minutes.Motif : travaux d'entretetien des voiesSNCF Transilien
RER E : Haussmann-Chelles 17 mai Des travaux de maintenance à Pantin, modifient la circulation des trains de la ligne E du RER - axe Haussmann Saint-Lazare / Chelles Gournay - le dimanche 17 mai jusqu'à 15h00.La gare de Pantin n'est pas desservie en direction de Chelles Gournay.SNCF Transilien
Tramway T8 : Trafic interrompu (Saint-Denis-Porte de Paris Epinay-Orgemont/Villetaneuse-Université) : En raison d'une panne de matériel, le trafic est interrompu sur la ligne.
METRO 12 : Panne de signalisation (Front Populaire - Mairie d'Issy) : En raison d'une panne de signalisation, le trafic est ralenti sur l'ensemble de la ligne. 
SUCY EN BRIE - LIGNE 2 - DEVIATION En raison de travaux réalisés sur la commune de Sucy-en-Brie, rue Albert Dru,une déviation est mise en place sur la ligne 2 dans la nuit du mardi 12 aumercredi 13 mai :Les courses de 21h58 et 22h28 au départ de la gare de Sucy-Bonneuil et lescourses de 21h35, 22h09 et 22h40 au départ de la gare de Pontault nedesserviront pas les arrêts ci-dessous dans les deux sens :- Clos de Ville (reportez-vous à l'arrêt Albert Dru)- Avenue du Piple- Rond point du Piple- Pierre BrossoletteMerci de votre compréhension.
METRO 5 : Accident d'exploitation  (Bobigny - Pablo Picasso - Place d'Italie) : En raison d'un incident d'exploitation, le trafic est ralenti sur l'ensemble de la ligne. 
Ligne N : Paris-Plaisir Grignon 27 avril-13 mai Des travaux de renouvellement des voies à Saint-Cyr modifient la circulation des trains de l'axe Paris Montparnasse - Plaisir Grignon, les nuits du lundi 11 / mardi 12 au mercredi 13 / jeudi 14 mai, à partir de 00h10. Pendant les travaux, covoiturez avec , Transilien vous rembourse.SNCF Transilien
RER A: Trafic Ralenti  Saint-Germain-en-Laye - Poissy - Cergy Le Haut- Boissy-Saint-Léger - Marne-la-Vallée - Chessy: En répercussion d'un colis suspect à Vincennes, le trafic est ralenti sur l'ensemble de la ligne. 
Ligne N : Trafic ralenti Axes concernés : Paris/Mantes la JolieParis/Dreux Prévoir jusqu'à 30 minutes supplémentaires de trajet, dans les deux sensFin des ralentissements estimée à 12h00.Motif : incident affectant la voie à Saint-Cyr.SNCF Transilien
METRO 9 : Incident Incident  (Pont de Sèvres - Mairie de Montreuil) : En raison d'un incident technique à la station Voltaire, les trains ne marquent pas l'arrêt dans les deux sens de circulation. 
