Métro 6: trafic interrompu  (Charles de Gaulle Etoile - Nation) : En répercussion d'un accident grave de voyageur à St Jacques, le trafic est ralenti sur l'ensemble de la ligne. Trafic normal sur les autres lignes de Métro. 
Villecresnes - Procession Nocturne Nous vous informons qu'en raison de la Procession Nocturne à Villecresnes cemercredi 20 mai 2015 de 19h00 à 20h30, une déviation est mise en place. Lesarrêts :  * "CES et Mairie" sont reportés à l'arrêt "Salle Polyvalente". Les terminuset les départs s'effectueront "Salle Polyvalente".Merci de votre compréhension.
Orgeval - Travaux - ligne 21 déviée En raison de travaux rue de la gare à Orgeval, le départ de la ligne 21 de7h53 à l'arrêt "Les Poiriers" (logo esquimau) est reporté à l'arrêt "Aubergesans nom".Tous les autres passages à cet arrêt sont maintenus aux horaires habituels.Merci de votre compréhension.
TRA- DRANCY - LIGNE 620 Suite à des travaux de voirie rue de la Jumelle sur la commune de Drancy laligne sera déviée en direction de Notre Dame uniquement .- L'arrêt Jean Jaures sera reporté à l'arrêt provisoire de la RATP .- L'arrêt Concorde ne sera plus desservi .Veuillez nous excuser de la gêne occasionnée .
T8 Trafic perturbé : (Saint-Denis-Porte de Paris Epinay-Orgemont/Villetaneuse-Université) : En raison d'un stationnement gênant T6: Trafic Ralenti Robert Wagner / Châtillon-Montrouge: En répercussion d'un incident technique, le trafic est ralenti sur l'ensemble de la ligne.
Noctilien N141 et N143 : aucun bus ne circule nuit Suite à un mouvement social chez KEOLIS-CIF, les lignes N141 et N143 ne sont pas assurées pour une durée indéterminée.- N141 ( Paris Est / Meaux)- N143 (Paris Est / Aéroport CDG)Pour plus de précisions, les numéros de téléphone à contacter :Lignes CIF Tremblay : 01 49 63 44 00 à partir de 5hLignes CIF Dammartin : 01 60 54 54 53/54 à partir de 5hIBUS : 01 48 62 38 33 à partir du 7h
Ligne H : suppressions Creil / Pontoise Axe concerné :- Pontoise / CreilTrain(s) supprimé(s) : - Persan Beaumont, départ 11h43 - Creil, arrivée 12h06RER B : La Plaine / Paris interrompu Axe(s) concerné(s) :La Plaine Stade de France / Saint Rémy lès ChevreuseLa Plaine Stade de France / RobinsonTrafic interrompu entre La Plaine Stade de France et Châtelet les Halles, dans ce sensReprise des circulations estimée à 12h15.Pour rejoindre ou quitter la gare de *, cliquer sur le lien concerné.Motif : bagage abandonné à La Plaine Stade de France.SNCF Transilien
Ligne L: Paris-Cergy ralenti Axe concerné :Paris-Cergy le Haut.Prévoir 10 à 15 minutes supplémentaires de trajet, dans les deux sens.Fin des ralentissements estimée à 18h00.Motif : panne de train à Cergy Préfecture.SNCF Transilien
T1: trafic perturbé  (Asnières-Gennevilliers – Les Courtilles – Noisy-le-Sec) : En raison d'une panne de matériel, le trafic est interrompu entre les arrêts GARE DE GENNEVILLIERS et MAIRIE DE VILLENEUVE-LA GARENNE. Trafic normal sur les autres lignes de Tramway.Aucune manifestation en cours de nature à perturber le trafic 
Créteil - Travaux de nuit Carrefour Pompadour (Direction de Yerres) Nous vous informons que des retards sont à prévoir en raison des travauxCarrefour Pompadour à Créteil (en direction de Yerres) dans les nuits dumercredi 20 au jeudi 21 mai et du jeudi 21 au vendredi 22 mai de 22h00 à 4h30.Merci de votre compréhension.
Fermeture rue Mortillet En raison de la fermeture pour travaux de la rue Gabriel de Mortillet, laligne R3 Nord est déviée par le circuit de la R2 Sud via Debussy. Les arrêtsLes Ecuyers, Thiers, Centre Administratif, Ourches Hôpital, Galliéni et Jauresne seront pas desservis. L'arrêt Place Ste Catherine est reporté à l'arrêtPlace Ste Catherine lignes R1 et R2 Sud.Nous vous remercions de votre compréhension.
Ligne L : Paris/St-Nom - Versailles ralenti Axe(s) concerné(s) :Paris/Saint-Nom la Bretèche Forêt de MarlyParis/Versailles Rive DroitePrévoir 10 à 15 minutes supplémentaires de trajet, dans les deux sensFin des ralentissements estimée à 14h00.Motif : acte de malveillance à Bécon les Bruyères (jets de pierres).SNCF Transilien
Mandres-les-Roses - Travaux Rue René Thibault Nous vous informons qu'en raison des travaux Rue René Thibault à Mandres-les-Roses, ce jeudi 21 mai 2015 de 8h00 à 17h00, une déviation est mise en place.L'arrêt :  * "Rue Thibault" est reporté à l'arrêt "Route de Dreux".Merci de votre compréhension.
BEZONS - Ligne 3 - Travaux Rue des Pointus En raison de travaux  au niveau  de la rue des pointus sur la commune deBezons, une déviation est mise en place. De ce fait, les arrêts Parmentier etBrigadieres ne sont pas desservis dans les 2 sens.La deviation est prévue pour toute la journée.
Noctilien N141 et N143, aucun bus ne circule cette nuit Suite à un mouvement social chez KEOLIS-CIF, les lignes N141 et N143 ne sont pas assurées pour une durée indéterminée.- N141 ( Paris Est / Meaux)- N143 (Paris Est / Aéroport CDG)Pour plus de précisions, les numéros de téléphones à contacter :Lignes CIF Tremblay : 01 49 63 44 00 à partir de 5hLignes CIF Dammartin : 01 60 54 54 53/54 à partir de 5hIBUS : 01 48 62 38 33 à partir du 7h
