Quincy-Sous-Sénart - Travaux Route de Boussy (RD 33) Ligne S Nous vous informons qu'en raison des travaux Route de Boussy St Antoine (RD33) à Quincy-sous-Sénart à partir de 19h00 le jeudi 05 mars 2015 jusqu'à lafin de service, une déviation est mise en place dans les 2 sens. Les arrêts :  * "Bizet et Gare" sont supprimés. L'arrêt le plus proche est "CentreCommercial".Merci de votre compréhension.
NOISY - ST NOM LA B. - Travaux RD307 En raison de l'avancement des travaux sur le RD307 à St Nom la Breteche,l'arrêt TUILERIE BIGNON ne peut pas être desservi en direction de Noisy etBailly. Merci de vous reporter vers l'arrêt TUILERIE à Noisy-le-Roi. Cetteinformation ne concerne que le circuit '27 bateau' au départ du Lycéeinternational. Merci de votre compréhension.
Ligne P : suppression Provins/Paris Axe concerné : Provins/ParisTrain(s) supprimé(s) : Provins, départ 11h46, Paris Est, arrivée : 13h12, MISSION : PIBUUn bus de substitution est mis en place au départ de Provins à 11h46 et dessert toutes les gares jusqu'à Gretz Armainvilliers pour le RER E en direction de Magenta (quelques minutes à pied de Paris Est).Motif : panne d?un train à Provins.SNCF Transilien
Ligne J: suppression Gisors-Paris Axe concerné:Gisors-Paris.Train supprimé:Gisors 07h26 - Paris 08h38, mission PENU.Train suivant:Gisors 07h41 - Paris 08h57, mission PETO.Motif: avarie de matériel.SNCF Transilien
Ligne H: Montsoult-Persan interrompu. Axe concerné:Paris-Montsoult Maffliers-Persan Beaumont.Trafic interrompu dans les deux sens entre  et .Reprise des circulations estimée à 12h45.Une substitution routière en aller-retours est mise en place entre Montsoult Maffliers et Persan Beaumont.Pour rejoindre ou quitter la gare de , vous pouvez aussi cliquer sur le lien concerné.Les voyageurs désirant se déplacer entre Paris Nord et Persan Beaumont, dans un sens ou l?autre, sont également invités à emprunter un train de l?axe: Paris Nord / Valmondois / Persan Beaumont.  Motif: incident affectant la voie à Montsoult Maffliers (travaux de réparation).SNCF Transilien
RER C: Paris Chaville Versailles Château  ralenti Axes concernés :Versailles Château Rive Gauche - Paris Prévoir 10 à 30 minutes supplémentaires de trajet, dans les deux sens.Fin des ralentissements estimée à 22h30.Motif: incident de signalisation à Versailles Château Rive GaucheSNCF Transilien
Quincy-Sous-Sénart - Travaux Route de Boussy (RD 33) Ligne C1 et C2 Nous vous informons qu'en raison des travaux Route de Boussy St Antoine (RD33) à Quincy-sous-Sénart, les travaux ayant commencés plus tôt la déviationest effective depuis _9h00 jusqu'à 12h00_ et  de 19h00 jusquà la fin deservice ce jeudi 05 mars 2015, les arrêts :  * "Bizet et Gare" sont supprimés. L'arrêt le plus proche est "CentreCommercial".Merci de votre compréhension.
RER A Trafic fortement ralenti : En répercussion d'un incident technique à Châtelet, le trafic est ralenti sur l'ensemble de la ligne.  
Carnaval de Lisses Samedi 21 mars 2015 de 9h30 à 11h00, les arrêts "Complexe Sportif", "Mairie", "Maison de l'Enfance" et "l'Eglantier" ne seront pas desservis. Arrêt de report : "Ferme de Place" situé sur la ligne 416.
Ligne N: Mantes-Paris ralenti Axe concerné :Mantes la Jolie-Paris.Prévoir 15 à 20 minutes supplémentaires de trajet, dans ce sens.Pas de fin des ralentissements prévue avant la fin de service .Motif : incident affectant la voie à Epône Mézières.SNCF Transilien
Info trafic du 05/03/2015 Le trafic est normal sur l'ensemble des réseaux Sénart Bus et Sénart Express,ainsi que sur les ligne Tzen1 et Citalien.Bonne journée.
