Ligne P :suppression Paris/Provins 20h46 Axe concerné :Paris/ProvinsTrain supprimé : Paris Est 20h46 - Provins 22h10, mission XIBURetrouvez l?horaire de votre prochain train en temps réel sur les sites internet ou votre application. SNCF Transilien
Bus RATP: Manifestation sur la voie publique De 14h00 à 18h00 environ, une grande parade aura lieu sur les Champs Elysées entre la Place de la Concorde et la rue de Washington. Un périmètre d’interdiction de circulation sera mis en place à partir de 11h00. La partie Ouest de la Place de la Concorde sera interdite à la circulation. Il s'étendra ensuite au fur et à mesure de la progression de la Parade, à la Place de la Concorde (Chaussée Centrale), le Cour de la Reine, la Place du Canada, la rue François 1er, l'avenue Georges V, les rues de Washington, d'Artois, de Bern, de Ponthieu et l'avenue Gabriel.
Ligne L : Nanterre U / Maisons Laffitte interrompu Axe concerné :Paris Saint-Lazare - Maisons Laffitte Trafic interrompu entre  et , dans les deux sens, car tous les trains FOPE (Paris - Maisons Laffitte) et POPU (Maisons Laffitte - Paris) sont supprimés.Entre Paris et les gares de ,  et Maisons Laffitte, les clients sont invités à emprunter la ligne A du RER.Reprise des circulations estimée à 16h30.Motif : Incident d'alimentation électrique entre Maisons Laffitte et Achères Ville nécessitant la réalisation de travaux.Utilisez la fonction "Contourner" des sites et de l'application.SNCF Transilien
RER E : trafic perturbé le 01 janvier 2015 Axes concernés : Haussmann Saint-Lazare - Chelles GournayHaussmann Saint-Lazare - Villiers sur MarneCertains trains sont supprimés :Motif : Mouvement social local le jeudi 01 janvier 2015 sur la ligne E du RER.SNCF Transilien.
Ligne P : Lagny/Château Thierry interrompu Axe(s) concerné(s) :Paris Est / Château ThierryTrafic interrompu entre Lagny sur Marne et Château Thierry, dans les deux sensReprise des circulations estimée à 08h00.Motif : incident affectant la voie à Lagny sur Marne (panne sur un aiguillage).Utilisez la fonction "Contourner" des sites et de l'application.SNCF Transilien
Ligne P : Meaux - La Ferté Milon perturbé le 01/01 Axe concerné : Paris Est - Meaux - La Ferté MilonTous les trains sont remplacés par des bus sur cette relation .Motif : Mouvement social local le jeudi 01 janvier 2015 sur la ligne P.SNCF Transilien.
METRO 2 : Trafic ralenti  (Nation - Porte Dauphine) : En raison d'un voyageur malade, le trafic est ralenti sur l'ensemble de la ligne. 
Ligne L : Paris/Maisons Laffitte ralenti Axe concerné :Paris - Maisons Laffitte.Reprise progressive du trafic entre Nanterre Université et Maisons Laffitte. Prévoir 10 à 15 minutes supplémentaires de trajet, dans les deux sens.Fin des ralentissements estimée à 17h30.Motif : Incident d'alimentation électrique entre Maisons Laffitte et Achères Ville nécessitant la réalisation de travaux.Retrouvez l?horaire de votre prochain train en temps réel sur les sites internet ou votre application. SNCF Transilien
