RER C : Versailles Chantiers - Massy ralenti Axes concernés :Paris/Versailles Chantiers via Massy PalaiseauParis/Saint Quentin en YvelinesReprise progressive du trafic entre Versailles Chantiers et Massy - Palaiseau, dans les deux sensFin des ralentissements estimée à 16h00.Motif : acte de malveillance à un passage à niveau à Jouy-en-Josas.SNCF Transilien
Ligne J : Paris-Ermont-Pontoise du 13 au 17 avril Des travaux de maintenance sur les voies entre Paris Saint-Lazare et Le Stade, ainsi qu'entre Argenteuil et Conflans Sainte-Honorine modifient la circulation des trains sur la ligne J, les soirées du lundi 13 / mardi 14 au vendredi 17 / samedi 18 avril, à partir de 22h00.Un service de bus de remplacement est mis en place entre Asnières et Ermont Eaubonne / Pontoise avec desserte des gares intermédiaires.Pendant les travaux, covoiturez avec , Transilien vous rembourse.SNCF Transilien
Ligne N : Paris - Dreux 30 mars - 17 avril Des travaux de maintenance des voies modifient la circulation des trains de l'axe Paris Montparnasse - Dreux, les nuits du lundi 13 / mardi 14 au vendredi 17 / samedi 18 avril 2015, à partir de 22h55. SNCF Transilien
METRO 2 : Trafic perburbé (Nation - Porte Dauphine) : En raison d'un voyageur sur la voie, le trafic est interrompu entre Pére Lachaise et Anvers Reprise prévue : 19h30. 
RER D : Paris-Villeneuve-Melun 30 mars au 16 avril Des travaux de renouvellement des appareils de voies à Melun modifient la circulation des trains entre Villeneuve Saint-Georges et Melun sur la ligne D du RER, les nuits du dimanche 12 / lundi 13 au jeudi 16 / vendredi 17 avril à partir de 00h20. Une substitution routière est mise en place entre Villeneuve Saint-Georges et Melun.Pendant les travaux, covoiturez avec , Transilien vous rembourse.SNCF Transilien
Navette ORLYVAL : Trafic ralenti (Antony - Orly-Sud) : En raison d'une panne électrique, le trafic est ralenti sur l'ensemble de la ligne. Un service de bus est mis en place. 
Ligne J : Ermont/Pontoise/Mantes- Paris ralenti Axe(s) concerné(s) :- Ermont Eaubonne/Paris- Gisors/Pontoise/Paris- Mantes la Jolie/Paris via Conflans Fin d'OisePrévoir 10 à 15 minutes supplémentaires de trajet, dans ce sensFin des ralentissements estimée à 12h00.Motif : incident affectant la voie à Bois Colombes (incident terminé). SNCF Transilien
Ligne R :Paris-Melun-Montereau 13 au 17 avril Des travaux de maintenance des installations modifient la circulation des trains sur la ligne R, sur l'axe Paris Lyon - Melun - Montereau, les nuits du lundi 13 au vendredi 17 avril 2015, à partir de 22h49. Un service de bus de substitution est mis en place.Pendant les travaux, covoiturez avec , Transilien vous rembourse.SNCF Transilien
METRO 1 : Trafic perturbé (Château de Vincennes - La Défense) : En raison d'un incident technique, le trafic est interrompu entre Grand Arche de la Défense et Porte Maillot. Reprise Prévue : 20h30. 
RER D : Corbeil - Viry via Ris ralenti Axe concerné :Corbeil Essonnes - Viry Châtillon via Ris OrangisLe trafic est ralenti dans les deux sens entre Corbeil Essonnes et Viry Châtillon .Fin des ralentissements estimée à 19h00.Motif : dysfonctionnement d'un passage à niveau SNCF Transilien
RER C : trafic perturbé Lundi 13 avril, le trafic est perturbé sur l'ensemble de la ligne C du RER.Motif : jet de projectile survenu à Choisy le Roi sur un train Intercités dans la soirée du dimanche 12 avril (présomption de tir isolé à la carabine).  SNCF Transilien
Ligne P : Meaux - La Ferté Milon 30 mars-17 avril Des travaux de maintenance des appareils de voies entre Meaux et Trilport modifient la circulation des trains sur la ligne P - axe Meaux / La Ferté Milon - du lundi 13 avril au vendredi 17 avril 2015.Le dernier train au départ de La Ferté Milon (22h01) est supprimé et remplacé par un bus.Pendant les travaux, covoiturez avec , Transilien vous rembourse.SNCF Transilien
Metro ligne 9 (Pont de Sèvres - Mairie de Montreui En répercussion d'un malaise voyageur, le trafic est ralenti sur l'ensemble de la ligne. Trafic normal sur les autres lignes de Métro. 
