Ligne P: Paris Est - Provins - Coulommiers ralenti Axes concernés :- Paris Est - Provins,- Paris Est - Coulommiers.Comptez 15 à 20 minutes supplémentaires de trajet, dans les deux sens.Fin des ralentissements estimée à 16h00.Motif : incident affectant la voie entre Gretz Armainvilliers et Ozoir la Ferrière.Cet incident affecte également la ligne E, axe Haussmann Saint-Lazare - Tournan.SNCF TRANSILIENTrouvez votre prochain train en temps réel sur la rubrique Prochains Départs des sites et de l'application.
Ligne P : bus sur Esbly Crécy jusqu'à 15h00 Axe concerné :Esbly - Crécy la ChapelleLes trains sont remplacés par une substitution routière, avec départ des bus aux mêmes horaires .Fin de la substitution vers 15h00.Premier train prévu à circuler normalement : Esbly 15h10 - Crécy la Chapelle 15h22 - mission RICE.Motif : panne d'un train.SNCF Transilien
RER A : trafic ralenti jusqu' à 21h00 Axes concernés :Paris - Cergy le HautParis - PoissyComptez 10 à 20 minutes supplémentaires de trajetFin des ralentissements estimée à 21h00.Motif : bagage abandonné à Noisy le GrandSNCF Transilien
PERTURBATIONS DU 27 NOVEMBRE AU 1ER DECEMBRE 2014 Ligne 30-23 : Nous informons notre aimable clientèle qu'en raison de travaux de canalisations sur la commune de Saint-Leu-la-Forêt du 27 novembre au 1er décembre 2014, l'arrêt "Les Tilleuls" ne sera pas desservi. Veuillez vous rendre à l'arrêt de la gare. Merci de votre compréhension. 
Metro ligne 7: trafic ralenti (La Courneuve 8 Mai 1945 - Villejuif Louis Aragon - Mairie d'Ivry) : En raison d'un incident technique, le trafic est ralenti sur l'ensemble de la ligne. 
RER D : Paris-Villeneuve StG 24 nov au 28 nov Des travaux modifient la circulation des trains entre Paris Gare de Lyon et Villeneuve Saint-Georges, sur la ligne D du RER, les nuits du lundi 24 / mardi 25 novembre au vendredi 28 / samedi 29 novembre 2014, de 22h56 jusqu'en fin de service.Dans le sens Paris - Villeneuve Saint-Georges, les trains ne marquent pas l'arrêt dans les gares de Maisons Alfort, Le Vert de Maisons et Créteil Pompadour.Une substitution routière est mise en place. SNCF Transilien
Ligne L : trafic ralenti jusqu' à 20h00 Axes concernés :Paris - Cergy le HautParis - PoissyComptez 5 à 15 minutes supplémentaires de trajetFin des ralentissements estimée à 20h00.Motif : bagage abandonné à Noisy le Grand, sur la ligne A du RER, impactant la ligne L.SNCF Transilien
Ligne N : trafic ralenti jusqu' à 23h00 Axe concerné :Paris - RambouilletReprise du trafic entre St Cyr et Rambouillet, dans les deux sens .Un allongement du temps de parcours reste à prevoir jusqu'à 23h00 environ.Motif : panne d?un train à St-Cyr.Trouvez votre prochain train en temps réel sur la rubrique Prochains Départs des sites et de l'application.SNCF Transilien
Ligne K : 6h07 Crépy supprimé Axe(s) concerné(s) :Paris Nord - Crépy en Valois Train(s) supprimé(s) : Crépy en Valois, départ 06h07PERTURBATIONS DU 27 NOVEMBRE AU 1ER DECEMBRE 2014  Ligne 30-14 : Nous informons notre aimable clientèle qu'en raison de travaux de canalisations sur la commune de Saint-Leu-la-Forêt du 27 novembre au 1er décembre 2014, l'arrêt "Les Tilleuls" ne sera pas desservi. Veuillez vous rendre à l'arrêt de la gare. Merci de votre compréhension. 
RER C : reprise du trafic St-Quentin Versailles Axe concerné :St-Quentin en Yvelines - Versailles - ParisReprise du trafic entre St -Quentin en Yvelines et Versailles Chantiers, dans les deux sens .Un allongement du temps de parcours pour les trains SARA et ELBA restent à prévoir jusqu'à 21h00 environ.Motif : panne d?un train à St-Cyr.Trouvez votre prochain train en temps réel sur la rubrique Prochains Départs des sites et de l'application.SNCF Transilien
Ligne U : reprise axe Défense Versailles Axes concernés :La Verrière - La DéfenseReprise des circulations à 20h10.Motif : panne d?un train à St-Cyr.Trouvez votre prochain train en temps réel sur la rubrique Prochains Départs des sites et de l'application.SNCF Transilien
RER C : axe Dourdan/Brétigny ralenti Axe(s) concerné(s) :Dourdan la Forêt / Paris / Chaville VélizyMissions concernées :KUMA		Dourdan / Chaville Vélizy 			GATA		Dourdan / Montigny Beauchamp 		GATA		Brétigny / Montigny Beauchamp 		Comptez 10 à 15 minutes supplémentaires de trajetFin des ralentissements estimée à 9h00.Motif : conditions climatiques dégradées.SNCF Transilien
RER E : Haussmann St-Lazare - Tournan ralenti Axe concerné :Haussmann Saint-Lazare - Tournan.Comptez 15 à 20 minutes supplémentaires de trajet, dans les deux sens.Fin des ralentissements estimée à 16h00.Motif : incident affectant la voie entre Gretz Armainvilliers et Ozoir la Ferrière.Cet incident affecte également la ligne P, axes Paris Est - Coulommiers, et Paris Est - Provins.SNCF TRANSILIENTrouvez votre prochain train en temps réel sur la rubrique Prochains Départs des sites et de l'application.
Déviation ligne A Rubelles : En raison de travaux, sur la ligne A Rubelles, les arrêts René Cassin, Rue des Mezereaux et Centre Commercial des Mezereaux ne sont actuellement pas desservis en direction de la gare uniquement. Merci de vous reporter aux arrêts U.R.S.S.A.F. ou Lavoisier.
Limeil-Brévannes - Travaux Avenue G. Clémenceau Nous vous informons qu'en raison des travaux Avenue Georges Clémenceau à Limeil-Brévannes du mardi 25 novembre au jeudi 27 novembre 2014, une déviation est mise en place. L'arrêt :  * "Pasteur" est reporté 50 metres apres la zone de travaux.Merci de votre compréhension.
RER C : trafic fluide axe Massy savigny Axe concerné :Massy Palaiseau - Juvisy via Longjumeau Reprise du trafic entre Massy Palaiseau et Savigny Sur Orge, dans les deux sens.Le trafic est à nouveau normal, avec quelques retards résiduels .Motif : personne aux abords des voiesSNCF TRANSILIEN
Déviation ligne 51 : En raison de travaux rue du Noyer Perrot à Moissy Cramayel, l'arrêt "Noyer Perrot" n'est pas desservi de 8h00 à 13h00.Veuillez vous reporter à l'arrêt "Place de la Fontaine" des lignes FA et RE Moissy (voir la fiche pour plan de circulation).
Ligne R : Paris - Montargis du 17 au 28 novembre Des travaux de maintenance des voies entre Moret Veneux les Sablons et Montargis, modifient la circulation des trains sur la ligne R, axe Paris Gare de Lyon - Melun - Montargis, les nuits du lundi 17 novembre au vendredi 28 novembre 2014, à partir de 23h04, sauf les nuits des samedi 22 et dimanche 23 novembre.Des modifications de desserte sont à prévoir. Un service de bus de remplacement est mis en place.SNCF Transilien
Ligne K :  2 trains supprimés Axe concerné :Paris Nord - Crépy en Valois Trains supprimés : Paris Nord, départ 16h45, Crépy en Valois, arrivée : 17h39.Paris Nord, départ 17h31, Crépy en Valois, arrivée : 18h16.Motif : trains immobilisés en atelier de maintenance.SNCF Transilien
