Info Trafic du 02/03/2015 Le trafic est normal sur l'ensemble des réseaux Sénart bus, Sénart express etsur ligne Tzen1. Bonne journée.
Déplacement arrêt Gare Combs la Ville En raison des travaux sur la mise en accessibilité de la gare SNCF de Combs laVille, le quai de la ligne SOL est condamné.Voir la fiche pour le positionnement du nouvel arrêt.
ARGENTEUIL - Ligne 4 - Travaux bd Gal Leclerc En raison de l'intervention d'une grue sur le Boulevard du Général Leclerc àArgenteuil,Le lundi 02 mars 2015de 10h00 à 15h00L'arrêt Square Aquitaine ne sera pas desservi en direction de la gare deHouilles.Nous vous remercions de votre compréhension.
LIGNE 7 - 19 : TRAVAUX DE VOIRIE A MONTESSON RUE DU GENERAL LECLERC DU 2 AU 3 MARS 2015 DE 9H A 17 LIGNE 7 : DIRECTION GARE DE SARTROUVILLE et LYCEE GALOISLIGNE 19 : DIRECTION GARE DU VESINET LE PECQEn raison de travaux de voirie sur la rue du Général Leclerc à Montesson, lesarrêts Aristide Briand, Eglise, Général Leclerc et Victor Hugo ne seront pasdesservis.Veuillez vous reporter aux arrêts Champs Roger, Poste ou la Tour.
Travaux ave Maréchal Joffre Travaux interdisant la circulationAvenue du Maréchal Joffre à Grisy-Suisnes. L'arrêt GRISY-SUISNES  Maréchal Joffrene sera pas desservi durant les travaux. Merci de bien vouloir vous reporter aux arrêts provisoires situés sur la RD 319.
Lignes CARS ORSAY non disponibles sur vianavigo Attention, suite à un problème technique, les lignes exploitées par LES CARS D ORSAY ne sont plus disponibles à partir du lundi 2 mars sur vianavigo.Le problème concerne la recherche d'itinéraire ainsi que la rubrique Horaires et Plans de lignes. Il sera résolu dans les meilleurs délais.Nous vous prions de nous excuser pour la gêne occasionnée.L'équipe vianavigo
Travaux Monthérand Travaux Monthérand Rue de Gravin Commune de GuérardNous informons notre aimable clientèle que des travaux entraîneront la fermeture partielle de la rue de GravinDu lundi 02 mars au vendredi 27 mars 2015 inclusla desserte des arrêts Guérard Monthérand et le Grand Lud sera supprimée et reportée à l'arrêt provisoire situé rue de GravinNous vous remercions de votre compréhension
Fermeture rue au Pain En raison de la fermeture pour travaux de la rue Au Pain une déviation est misen place. En direction de la Gare RER les arrêts Joffre et rue de la Salle neseront pas desservis.Nous vous remercions de votre compréhension
GARE ROUTIERE DE PONTOISE CANROBERT Mesdames, Messieurs,La SNCF réalise des travaux pour l'implantation d'abri bus et de bancs.Pendant cette période, la gare routiere restera ouverte.Le quai F (lignes 95-22 et 95-23) restera partiellement accessible au public.Nous vous demandons la plus grande vigilance.
ARGENTEUIL - Ligne PAVA devient ligne 17 A partir du 2 mars 2015, votre ligne PAVA devient ligne 17.Les horaires et l'itinéraire ne sont pas modifiés.Nous vous souhaitons de bons voyages sur votre ligne.
Lignes de bus BBM non disponibles sur vianavigo Attention, suite à un problème technique, les lignes exploitées par BIEVRES BUS MOBILITES ne sont plus disponibles à partir du lundi 2 mars sur Vianavigo.Le problème concerne la recherche d'itinéraire ainsi que la rubrique Horaires et Plans de lignes. Il sera corrigé dans les meilleurs délais.Nous vous prions de nous excuser pour la gêne occasionnée.L'équipe vianavigo
RER A : Paris - Cergy le Haut trafic ralenti Axe concerné :Paris - Cergy le Haut Prévoir 10 à 20 minutes supplémentaires de trajet, dans les deux sens.Fin des ralentissements estimée à 20h00.Motif : incident affectant la voie dans le secteur de Cergy Saint-Christophe (travaux terminés).SNCF Transilien
TRAVAUX POISSY Mesdames, Messieurs,En raison des travaux à Poissy, l'arrêt Champ Gaillard ne pourra pas êtredesservi sur l'aller (en direction de la Gare de Poissy).Veuillez utiliser l'arrêt provisoire rue du Champ Gaillard.
Métro 6: Trafic Interrompu Charles de Gaulle Etoile - Nation: En raison d'une fin tardive de chantier, le trafic est interrompu entre les stations La Motte-Picquet-Grenelle et Charles de Gaulle-Etoile. 
RER C :  B.FM non desservi Axes concernés :Paris/Dourdan la ForêtParis/St Martin d'EtampesParis/Versailles Chantiers via Massy PalaiseauBibliothèque François Mitterrand non desservi, dans ce sens.Arrêt à nouveau desservi à partir de 10h30.Pour se rendre à Bibliothèque François Mitterrand, prendre un train jusqu'à Choisy le Roi ou Juvisy et utiliser un train en direction de Paris.Pour quitter Bibliothèque François Mitterrand, prendre un train jusqu'à gare d'Austerlitz, puis un train la direction souhaitée.Motif : bagage abandonné à Bibliothèque François Mitterrand.SNCF Transilien
ARGENTEUIL - Ligne 34 Travaux Bd Gal Leclerc En raison de l'intervention d'une grue sur le Boulevard du Général Leclerc àArgenteuil,Le lundi 02 mars 2015de 10h00 à 15h00L'arrêt Square Aquitaine ne sera pas desservi en direction de la gare deHouilles.Nous vous remercions de votre compréhension.
Nouvel arrêt Porte St Antoine A partir du lundi 2 mars 2015, l'arrêt Porte St Antoine est deplacédéfinitivement 250 metres en amont de l'arrêt provisoire.Nous vous remercions de votre compréhension.
TRA- BONDY - LIGNE 616 Suite à des travaux de voirie Avenue Pasteur la ligne sera déviée sur lacommune de Bondy.-Les arrêts Place Carnot et Gallieni en direction de Parinor ou Blaise Pascalne seront pas desservis  _entre 9h00 et 16h00._-Vous pourrez vous reporter à l'arrêt Eglise de la RATP (ligne 105 et 303).Veuillez nous excuser de la gêne occasionnée.
PREAVIS DE GREVE LIGNES ORGEBUS A COMPTER DU LUNDI 2 MARS En raison d'un préavis de greve de la société Keolis Athis Cars, il y  a unRISQUE DE FORTE PERTURBATION des lignes 227-01, 227-02 et 227-03 (227-06service normal). La durée est indéterminéeLe scénario dégradé maximum pourrait être :Ligne 227-01 : 50% des servicesLigne 227-02 Breches aux Loups :pas de services jusqu'à 9h/ entre 11h et 13het à partir de 17h30227-02 Bois de Vétille : pas de services entre 11h et 13h227-03 : pas de services entre 13h et 17h30 et 50% des services à partir de17h30Pour plus d'information en temps réel, n'hésitez pas à contacter des lundi2/03 matin le : 0 825 00 38 36
Ligne P : Paris - Meaux du 2 au 6 mars Des travaux de maintenance des voies entre Vaires Torcy et Lagny Thorigny modifient la circulation des trains sur la ligne P - axe Meaux - Paris Est - les soirées du lundi 2 mars au vendredi 6 mars 2015, à partir de 23h00.Les derniers trains sont supprimés et une substitution routière est mise en place. Pendant les travaux, covoiturez avec , Transilien vous rembourse.SNCF Transilien
Métro 8: trafic ralenti  (Balard – Créteil - Pointe du Lac) : En raison d'un malaise voyageur, le trafic est ralenti en direction de Pointe du Lac. Trafic normal sur les autres lignes de Métro. 
Ligne L  : Paris / Cergy le Haut ralenti Axe concerné :Paris Saint-Lazare / Cergy le HautPrévoir 10 à 20 minutes supplémentaires de trajet, dans les deux sens, entre Paris et Cergy le Haut.Fin des ralentissements estimée à 20h00.Motif : incident affectant la voie dans le secteur de Cergy Saint-Christophe (travaux terminés).SNCF Transilien
Ligne 3 : votre ligne se développe A partir du 2 mars 2015, votre ligne 3 se développe :  * Une liaision directe entre le Tramway T2 et les gares de Cormeilles et dela Frette Montigny  * Une desserte toute la journée de 5h20 à 21h48  * Un bus toutes les 15 minutes en heure dê pointeSon itinéraire sera modifié. Elle ne desservira plus les arrêts Lilas, F.dePressensé, Victor Hugo et Jaures Branchard. Merci de bien vouloir vousreporter aux arrêts de la ligne 34.Vous trouverez la fiche horaire avec le nouvel itinéraire de la ligne 3 surnotre site internet des aujourd'hui.Nous vous souhaitons de _bons voyages _sur votre ligne.
