Manifestation publique le 1/01 Lundi 01 décembre 2014, manifestation dans Paris. De 09h00 à 12h00, rassemblement rue et boulevard de Bercy jusqu'aux abords du ministère des finances et des comptes publics. Lignes de Bus perturbées dans ce secteur :20, 24, 29, 57, 61, 63, 65, 87 et 91. 
Ligne H : axe Montsoult 29 et 30 novembre Des travaux de mise en accessibilité des gares de Domont, Sarcelles Saint-Brice, et Montsoult Maffliers nécessitent une interruption du trafic entre Epinay Villetaneuse et Luzarches / Persan Beaumont via Montsoult Maffliers dans les deux sens, le week-end du samedi 29 et dimanche 30 novembre 2014.Une substitution routière est mise en place. SNCF Transilien
Métro 4: reprise du trafic (Porte de Clignancourt – Mairie de Montrouge) : En raison d'un voyageur sur la voie, le trafic reprend progressivement sur la ligne. Trafic normal sur les autres lignes de Métro. 
RER D : Paris-Creil 29 et 30 novembre Des travaux modifient la circulation des trains sur la ligne D du RER, axe Paris Nord / Creil dans les deux sens, le week-end complet du samedi 29 / dimanche 30 novembre 2014.La gare de Pierrefitte Stains n'est pas desservie par train. Une substitution routière est mise en place.SNCF Transilien
Ligne J : Paris-Pontoise-Gisors 29 et 30 novembre Des travaux de renouvellement des voies et d'un aiguillage à Argenteuil, interrompent la circulation des trains entre Argenteuil et Conflans Sainte-Honorine dans les deux sens, sur l'axe Paris Saint Lazare / Gisors via Pontoise, le week-end entier du samedi 29 et dimanche 30 novembre 2014.Un service de bus de substitution est mis en place. SNCF Transilien
RER A : Torcy - Marne la Vallée interrompu Axe(s) concerné(s) :Paris - Marne la ValléeCirculation interrompue entre Torcy et Marne la Vallée, dans les deux sens.Motif : bagage abandonné à Marne la Vallée.SNCF Transilien
RER C: perturbations jusqu'à 13h30. Axes concernés :Ensemble de la ligne. Comptez 10 minutes supplémentaires de trajet dans les deux sens.Fin des ralentissements estimée à 13H30.Motif : malaise voyageur à Champ de Mars Tour Eiffel. SNCF Transilien
Ligne K : Paris 18h21 - Crépy 19h16 supprimé Axe concerné :Paris Nord - Crépy en Valois Train supprimé : - Paris Nord, départ 18h21 - Crépy en Valois, arrivée 19h16Ligne J : Argenteuil 4h52 - Paris 5h09 suppr 29/11 Des travaux de renouvellement des voies, du ballast et d'un aiguillage à Argenteuil nous obligent à supprimer le premier train de 04h52 au départ d'Argenteuil le samedi 29 novembre 2014.Une substitution routière est mise en place à 4h24 au départ de la gare d 'Argenteuil.SNCF Transilien
