TRAMWAY T3A : Trafic interrompu (Pont du Garigliano - Porte de Vincennes) : En raison du Semi Marathon de Paris, le trafic est interrompu entre les arrêts PORTE D'IVRY et PORTE DE VINCENNES 
RER B: Mouvement social –mardi 10 mars 2015  (Aéroport Charles de Gaulle - Mitry-Claye - Robinson - Saint-Rémy-lès-Chevreuse) : Mouvement social – mardi 10 mars 2015 Le trafic sera légèrement perturbé sur la ligne B du RER Prévoir 4 trains sur 5 aux heures de pointe et 3 trains sur 4 aux heures creuses 
RER B : Paris/Aéroport CDG2 TGV ralenti Axe(s) concerné(s) :Paris / Aéroport Charles de Gaulle 2 TGV (Terminal 2)Trafic légèrement perturbé entre Aulnay-sous-Bois et Aéroport Charles de Gaulle 2 TGV, dans les deux sens.Motif : malaise voyageur dans un train à Villepinte (incident terminé).SNCF Transilien
RER D : Paris -Melun via Combs la V trafic ralenti Axe(s) concerné(s) :Paris / Melun via Combs la VilleReprise progressive du trafic entre Villeneuve-Saint-Georges et Melun, dans les deux sensPrévoir 15 à 20 minutes supplémentaires de trajet.Fin des ralentissements estimée à 21h30. Motif : application des mesures de sécurité suite à un choc anormal sur un train grandes lignes à Cesson (incident terminé) SNCF Transilien
T3b: trafic interrompu (Porte de Vincennes - Porte de la Chapelle) : En raison d'un incident voyageur, le trafic est interrompu sur la ligne. Trafic normal sur les autres lignes de tramway. 
Ligne 16 - Hôtel de ville de saint gratien En raison d'une course cycliste à Saint Gratien l'arrêt « Hôtel de ville de StGratien » en direction d'Argenteuil ne sera pas desservi.
