Fermeture de l'avenue CEP à Poissy Bonjour à toutes et à tous,En raison d'une brocante place de la république, l'avenue CEP sera fermée à la circulation le samedi 27 septembre 2014 de 5h00 à 21h00.Par conséquent, une déviation sera mise en place par le boulevard Gambetta et le boulevard de Pirmasens dans les 2 sens de la circulation.Aussi, les arrêts CEP et Commissariat ne seront pas desservis.Nous vous prions de nous excuser pour la gêne occasionnée et nous vous remercions de votre compréhension.
Ligne N :Retards Mantes-Plaisir-Paris Montparnasse Dysfonctionnement d'un passage à niveau entre Maule et Mareil sur Mauldre, et incident de signalisation à Beynes sur la ligne N.Le trafic est perturbé et des retards de 15 à 30 minutes et des modifications de desserte sont à prévoir, dans les deux sens, sur l'axe :- Mantes la Jolie - Plaisir Grignon - Paris Montparnasse.Un retour à la normale est prévu pour 10h00.SNCF Transilien
Prolongation des travaux La prolongation de travaux perturbe le trafic sur la ligne E.Les trains circulent avec des retards de 10 à 20 minutes environ et des suppressions ou modifications de desserte sont possibles sur les axes - Haussmann - Chelles Gournay- Haussmann - TournanSNCF Transilien
Ligne P: bus Paris-Château Thierry dès 23h04 Des travaux de maintenance des appareils de voies entre Trilport et Château Thierry modifient la circulation des trains sur la Ligne P, axe Paris Est - Château Thierry, les soirées du lundi 22 septembre au vendredi 03 octobre à partir de 23h00, sauf les nuits du samedi et du dimanche.SNCF Transilien
ligne 4 : trafic interrompu En raison de la présence d'un colis suspect, le trafic est interrompu entre les stations Barbès-Rochechouart et Réaumur-Sebastopol. 
RER C : Dourdan la Forêt non desservie Un incident affectant la voie à Dourdan la Forêt sur la ligne C du RER.La gare de Dourdan la Forêt n'est pas desservie.Les trains DEBO/DEBA ont pour terminus Dourdan.Les trains LARA circulent au départ de Dourdan.Un retour à la normale est prévu pour 12h00.SNCF Transilien
Ligne P:Paris Coulommiers soirées du 22 au 26 sept Des travaux de modernisation du poste d'aiguillage de Gretz Armainvilliers entraînent la suppression du train CITU de 23h16 au départ de Paris Est et à destination de Coulommiers, sur la ligne P, les soirées du lundi 22 au vendredi 26 septembre.SNCF Transilien
Ligne P : Esbly/Crécy soirées du 22 au 26 sept Des travaux de maintenance modifient la circulation des trains sur la ligne P, entre Esbly et Crécy la Chapelle, les soirées du lundi 22 au vendredi 26 septembre, à partir de 22h10.Une substitution routière est mise en place, dans les deux sens de circulation, avec desserte des gares intermédiairesSNCF Transilien
PERTURBATIONS LES 24 ET 25 SEPTEMBRE 2014 Ligne 95-03 : Nous informons notre aimable clientèle qu'en raison de travaux d'assainissement rue de Paris sur la commune de Taverny les 24 et 25 septembre 2014, les arrêts "Hôtel de Ville/Marché" et "Les Gaudins" ne seront pas desservis en direction de Cergy uniquement. Veuillez vous rendre à l'arrêt "Taverny Gare" de la ligne 30-10 pour l'arrêt "Hôtel de Ville/Marché" et à l'arrêt provisoire après le feu en direction de Bessancourt pour l'arrêt "Les Gaudins". Merci de votre compréhension. 
Ligne J : dessertes modifiées Ermont/LesMureaux Des incidents techniques sur des trains perturbent le trafic sur la ligne J.Le train suivant est supprimé: - Paris Saint-Lazare, départ : 18h54 - Les Mureaux, arrivée 19h30RER A : trafic perturbé jusqu'à 16h00 Incident affectant la voie à la station La Défense Grande Arche sur la ligne A du RER.Des perturbations sont à prévoir sur les axes :- Nanterre Préfecture - Cergy le Haut,- Nanterre Préfecture - Poissy.Un retour à la normale est prévu pour 16h00.SNCF Transilien
DEVIATION/PERTURBATION LIGNE 38.02-FONTAINE RENEE  DU LUNDI 22 SEPTEMBRE 2014 AU 12 DECEMBRE 2014La rue de la Fontaine Renée à Montmorency est barrée, une déviation est mise en place.L'arrêt FONTAINE RENEE est déplacé rue de JAIGNY face à l'arrêt en direction d'Attainville.Merci pour votre compréhension.
Ligne N : perturbations Mantes - Plaisir - Paris La panne d'un train à Villepreux les Clayes et un incident affectant la signalisation à Beynes perturbent le trafic sur la ligne N.Le trafic est perturbé sur l'axe : - Mantes la Jolie - Plaisir Grignon - Paris.Les trains suivants sont supprimés :- Plaisir Grignon 06h11 - Paris Montparnasse 06h52 - mission PEGU,- Plaisir Grignon 06h41 - Paris Montparnasse 07h22 - mission PEGU,- Mantes la Jolie 06h25 - Paris Montparnasse 07h37 - Mission PEMU.Des retards et modifications de desserte restent à prévoir jusqu'à 10h00.SNCF Transilien
Ligne H: Paris-Ermont-Luzarches- Persan 22-26 sept Des travaux de maintenance des voies entre Ermont Eaubonne et Persan Beaumont et entre Epinay Villetaneuse et Persan Beaumont modifient la circulation des trains sur la ligne H, les soirées du lundi 22 au vendredi 26 septembre 2014, à partir de 22h35, sur les axes :- Paris Nord - Ermont Eaubonne - Persan Beaumont,- Paris Nord - Montsoult Maffliers - Luzarches - Persan Beaumont.Un service de bus de substitution est mis en place.SNCF Transilien
Crosne - Travaux de nuit Avenue Maréchal Foch (Ron Nous vous informons qu'en raison des travaux  Avenue du Maréchal Foch à Crosne dans la nuit du Lundi 22 Septembre au Mardi 23 Septembre de 21h00 à 06h00 du matin, une déviation est mise en place.  * Les tours de 21h00 et 21h30 sont supprimés.  * Les arrêts : "Gare, Peupliers, Boileau et 8 Mai 1945" sont supprimés.Merci de votre compréhension.
RER B : Mouvement social mardi 23 septembre  (Aéroport Charles de Gaulle - Mitry-Claye - Robinson - Saint-Rémy-lès-Chevreuse) Prévoir 4 trains sur 5 en heure de pointe et 3 trains sur 4 aux heures creuses. Pour obtenir des renseignements sur la circulation, www.abcdtrains.com pour les prévisions de gare à gare. 
TRAVAUX SUR LA RD 402 A MAUPERTHUIS  DU 22 SEPTEMBRE AU MERCREDI 31 DECEMBRE 2014 INCLUSDes travaux de voirie sur la rd 402 au niveau de la commune de mauperthuis engendrent des retards d'environ 10 minutes sur l'ensemble des navettes de la ligne 01.Nous recommandons a notre clientèle en correspondance avec d'autre services d'adapter l'horaire de leur voyage sur la ligne 01Merci de votre comprehension
 PERTURBATIONS LES 24 ET 25 SEPTEMBRE 2014 Ligne 30-04 : Nous informons notre aimable clientèle qu'en raison de travaux d'assainissement rue de Paris sur la commune de Taverny les 24 et 25 septembre 2014, les arrêts "Hôtel de Ville/Marché" et "Les Gaudins" ne seront pas desservis. Veuillez vous rendre à l'arrêt "Taverny Gare" en commun avec la ligne 95-03 sur la rue de la Gare. Merci de votre compréhension.  
RER C : perturbations jusqu'en fin de service. Application du plan vigipirate pour un bagage abandonné entre les gares de Saint-Michel Notre Dame et Paris Austerlitz sur la ligne C du RER.Des retards et des modifications de desserte sont à prévoir sur l'ensemble de la ligne C du RER, jusqu'en fin de service.SNCF Transilien
Villeneuve St Georges - Travaux Rue de Crosne  Nous vous informons qu'en raison des travaux Rue de Crosne à Villeneuve St Georges du Lundi 22 septembre au Vendredi 26 septembre 2014, une déviation est mise en place. L'arrêt : "Polyclinique" est reporté à l'arrêt provisoire 50 metres avant.Merci de votre compréhension.
Modification des horaires 19-3 et 19-4  Renforcement de l'offre sur les Lignes 19-3  et 19-4A compter du lundi 22 septembre 2014Nous vous informons que l'offre de desserte sera élargie sur les lignes 19-3 et 19-4.Voir le document "Dépliant horaires" dans OUTILS pour les Lignes concernées à droite de l'écran.Merci de votre compréhension.Le service Clientele.
Travaux  Lignes 5 et 22  Travaux Lignes 5 et 22: du lundi 22  septembre au mercredi 10 décembre 2014En raison des travaux de voirie dans la rue de Berthélemy sur la commune du Paray Douaville, la route sera barrée à la circulation.L'arrêt PARAY DOUAVILLE sera déplacé à l'entrée du village.Voir le document de la déviation et des horaires dans OUTILS et Travaux Ligne 5 et 22 à droite de l'écran.Merci de votre compréhension.Le service Clientele.
