Metro 13 : trafic ralenti (Saint-Denis Université - Asnières-Gennevilliers - Les Courtilles - Châtillon-Montrouge) : En raison d'une panne de signalisation, le trafic est ralenti sur l'ensemble de la ligne. 
Metro 9 : trafic ralenti  (Pont de Sèvres - Mairie de Montreuil) : En répercussion d'un malaise voyageur dans une rame, le trafic est ralenti en direction de Pont de Sèvres. 
RER A : Vincennes - Joinville le Pont interrompu Axe(s) concerné(s) :Ensemble de la ligne A du RERPour les clients en correspondance à Val de Fontenay :trafic interrompu entre Vincennes et Joinville le Pont, dans les deux sens.Reprise des circulations estimée à 18h00.Prévoir 10 à 20 minutes supplémentaires de trajet, dans les deux sens.Fin des ralentissements estimée à 20h00.Motif : bagage abandonné à Fontenay sous Bois (application du plan vigipirate) et avarie de matériel à Poissy. SNCF Transilien
RER D : Corbeil/Juvisy via Ris Orangis ralenti Axe(s) concerné(s) :- Corbeil/Juvisy via Ris OrangisReprise du trafic entre Corbeil Essonnes et Juvisy, via Ris Orangis dans les deux sens.Motif : chute d'un arbre sur les voies à Corbeil (incident terminé).SNCF Transilien
METRO 4 : Trafic ralenti (Porte de Clignancourt – Mairie de Montrouge) : En répercussion d'une panne de signalisation, le trafic est ralenti sur l'ensemble de la ligne. 
CRETEIL - Travaux Grand Paris à l'Echat Nous vous informons qu'en raison des travaux du Grand Paris à Créteil à partirdu 12 juin 2015, la Gare Routiere sera fermée. Les arrêts de bus des lignes B/ O1 / O2 sont déplacés.  * Le terminus des lignes s'effectuera quelques metres avant la GareRoutiere.  * Le départ des lignes s'effectuera apres l'entrée piétonne de l'HôpitalHenri Mondor.Pour plus de précisions vous pouuvez consulter l'affiche jointe.Merci de votre compréhension.
RER D : trafic fortement perturbé Axe(s) concerné(s) :- ensemble de la lignePrévoir un allongement important du temps de trajet.Pas de fin des ralentissements prévue avant la fin de service.Motif : dérangement du système informatique du poste de gestion des circulations de la ligne à Melun (incident terminé).SNCF Transilien
Fête de la Musique  Pour vous faire profiter pleinement de la fête de la Musique, certaines lignes de Métros, Bus, RER et Trains fonctionnent toute la nuit du 21 juin 2015 et un forfait spécial à 3,50 euros vous est proposé.Cette opération, financée par le STIF, permet aux Franciliens de profiter pleinement de l'événement en se déplaçant facilement, partout en Île-de-France.La RATP, soucieuse du confort de ses voyageurs, vous informe du dispositif mis en place pour la nuit du dimanche 21 Juin.Nouveauté : La recherche d'itinéraires RATP est adaptée avec l'offre spécifique Métro et Noctilien Fête de la Musique 2015!. 
Ligne P : Paris - Château Thierry 12 au 14 juin Des travaux d'accessibilité en gare d'Esbly modifient la circulation des trains sur la ligne P - axe Paris Est / Château Thierry - les soirées du du vendredi 12 au dimanche 14 juin 2015 à partir de 22h00.Une substitution routière est mise en place.Pendant les travaux, covoiturez avec , Transilien vous rembourse.SNCF Transilien
Dimanche 14 juin: 10 Kms de l'Équipe - BUS RATP PERTURBES De 5h00 à 13h30, course pédestre empruntant le Bd de Sébastopol, la rue de Rivoli à contresens, la rue St Antoine, la place de la Bastille, la rue de Lyon, les avenues Daumesnil, du Général Michel Bizot, du Docteur Arnold Netter, le cours de Vincennes, la place de la Nation, l’avenue Philippe Auguste, le boulevard de Ménilmontant, l’avenue de la République jusqu’à la Place de la République. Lignes de Bus déviées dans ce secteur: 20, 21, 24, 26, 29, 38, 39, 46, 47, 56, 57, 58, 61, 63, 64, 65, 67, 69, 70, 72, 75, 76, 81, 85, 86, 87, 91, 96 et 351. 
Ligne J: Paris/Mantes via Poissy ralenti Axe(s) concerné(s) :- Paris / Mantes la Jolie, via Poissy,Prévoir 15 à 20 minutes supplémentaires de trajet, dans les deux sens.Fin des ralentissements estimée à 11h00.Motif : incident affectant la voie à Sartrouville.SNCF Transilien
Ligne L: Paris-St-Nom la Bretèche ralenti Axe concerné:Paris St-Lazare - St-Nom la BretècheA partir de 17h30, les trains suivants sont:Paris St-Lazare 17h35 - Marly le Roi 18h12, mission RUBE,  terminus St-Cloud 17h54.Paris St-Lazare 17h50 - Marly le Roi 18h27, mission RUBE,  terminus Garches Marnes la Coquette 18h13. Paris St-Lazare 18h05 - Marly le Roi 18h42, mission RUBE,  supprimé. Paris St-Lazare 18h20 - Marly le Roi 18h57, mission RUBE,  supprimé.Paris St-Lazare 19h35 - St-Cloud 19h57, mission DEBO, supprimé.Paris St-Lazare 20h05 - St-Cloud 20h27, mission DEBO, supprimé.St-Cloud 20h04 - Paris St-Lazare 20h26, mission POBE, supprimé.Trains suivants à circuler:Paris St-Lazare 18h12 - Marly le Roi 18h48, mission SUBE. Paris St-Lazare 18h27 - Marly le Roi 19h04, mission SUBE.Paris St-Lazare 19h44 - St-Cloud 19h58, mission VALE.Paris St-Lazare 20h15 - St-Cloud 20h29, mission VALE.St-Cloud
T2: Station Issy Val de Seine non desservie  (Pont de Bezons - Porte de Versailles) : L'arrêt n'est pas marqué à la station Issy Val de Seine en raison de la présence d'un colis suspect. 
Ligne R : trafic fortement perturbé Axe(s) concerné(s) :- Paris / Montargis- Paris / Montereau - Melun / Montereau via HéricyPrévoir un allongement important du temps de trajet.Pas de fin des ralentissements prévue avant la fin de service.Motif : dérangement du système informatique du poste de gestion des circulations de la ligne à Melun (incident terminé).SNCF Transilien
Ligne L : Paris/Cergy le Haut ralenti Axe(s) concerné(s) :- Paris / Cergy le Haut,Prévoir 15 à 20 minutes supplémentaires de trajet, dans les deux sens.Fin des ralentissements estimée à 11h00.Motif : incident affectant la voie à Sartrouville.SNCF Transilien
Ligne K :  suppression Paris / Crépy en Valois Axe concerné :- Paris - Crépy en ValoisTrain supprimé : - Paris Nord, départ 22h50 - Crépy en Valois, arrivée 23h49RER B : trafic fortement perturbé Axe(s) concerné(s) :Paris / Aéroport Charles de Gaulle 2 TGV (Terminal 2)Reprise progressive du trafic entre Aulnay-sous-Bois et Aéroport Charles de Gaulle 2 TGV, dans les deux sens.Cependant, le trafic restera très fortement perturbé sur l'ensemble de la ligne jusqu'en fin de service.Motifs : incident affectant la signalisation à Aulnay sous Bois et bagage abandonné dans un train à Gare du Nord (incidents terminés).SNCF Transilien
Ligne N : Paris / Dreux Mantes nuit du 12 au 13/06 Des travaux de maintenance des appareils de voies à Saint-Cyr modifient la circulation des trains des axes Paris Montparnasse - Plaisir Grignon - Mantes La Jolie / Dreux, la nuit du vendredi 12 / samedi 13 juin 2015 à partir de 22h00. Pendant les travaux, covoiturez avec , Transilien vous rembourse.SNCF Transilien
Info Trafic du 12/06/2015 Nous vous informons que les départs suivants ne seront pas assurés ce jour: les lignes  combe la ville :à partir de 18h36Nous vous présentons nos excuses pour la gene occasionnée. bonne journée.
RER A : Paris - Cergy/Poissy ralenti Axe(s) concerné(s) :- Paris / Cergy le Haut,- Paris / PoissyPrévoir 15 à 20 minutes supplémentaires de trajet, dans les deux sens.Fin des ralentissements estimée à 11h00.Motif : incident affectant la voie à Sartrouville.SNCF Transilien
Ligne J: suppressions Paris-Ermont/Cormeilles. Axes concernés:Paris St-Lazare / Poissy / Les Mureaux.Paris St-Lazare / Cormeilles en Parisis.Paris St-Lazare / Ermont Eaubonne.Trains supprimés:Paris St-Lazare 17h37 - Ermont Eaubonne 19h02, mission EAPEParis St-Lazare 19h57 - Ermont Eaubonne 20h20, mission EAPEErmont Eaubonne 17h58 - Paris St-Lazare 18h28, mission PAPEErmont Eaubonne 19h18 - Paris St-Lazare 19h48, mission PAPEParis St-Lazare 18h34 - Les Mureaux 19h10, mission LOLACormeilles en Parisis 18h19 - Paris St-Lazare 18h40, mission PIZATrains suivants à circuler:Paris St-Lazare 17h47 - Ermont Eaubonne 19h12, mission EAPEParis St-Lazare 20h07 - Ermont Eaubonne 20h30, mission EAPEErmont Eaubonne 18h08 - Paris St-Lazare 18h38, mission PAPEErmont Eaubonne 19h28 - Paris St-Lazare 19h58, mission PAPEParis St-Lazare 18h41 - Les Mureaux 19h17, mission LOLAParis St-Lazare 18h03 - Cormeilles en Parisis 18h
