Préavis de Grève TAM en Yvelines  En raison d un préavis de grève déposé par deux organisations syndicales, le trafic des bus TAM en Yvelines risque d être perturbé. A partir du mardi 10 mars 2015 à 4h et pour une durée indéterminée.Pour plus de précisions, veuillez-vous rendre sur le site : www.bus-tam.fr ou contactez notre service clientèle au 01 30 94 77 77 
RER C : trafic très perturbé Axe concerné :Ensemble de la ligneReprise progressive du trafic.Prévoir jusqu'à 50 minutes supplémentaires de trajet.Fin des ralentissements estimée à fin de service.Motif : incident affectant la signalisation à Musée d'Orsay.SNCF Transilien
Metro 7: Trafic Interrompu La Courneuve 8 Mai 1945 - Villejuif Louis Aragon - Mairie d'Ivry: En raison d'un incident voyageur, le trafic est interrompu entre les stations Mairie d'Ivry et Porte d'Ivry. 
Ligne R: Paris-Montargis ralenti. Axe concerné:Paris-Montargis.Prévoir 20 minutes supplémentaires de trajet dans ce sens.Fin des ralentissements estimée à 16h00.Motif: application de mesures de sécurité à Moret Veneux les Sablons.SNCF Transilien
Ligne J: suppression Paris - Gisors. Axe concernéParis - GisorsTrain supprimé:Paris Saint-Lazare 17h59, Gisors 19h07, Mission GECATrain suivant:Paris Saint-Lazare 18h20 - Gisors 19h36, mission GETO.Motif: avarie de matériel.SNCF Transilien
Ligne N: Paris-Rambouillet ralenti. Axe concerné:Paris-Rambouillet.Reprise du trafic entre La Verrière et Rambouillet dans ce sens.Prévoir 10 minutes supplémentaires de trajet.Fin des ralentissements estimée à 09h00.Motif: défaut d'alimentation électrique à Coignères.SNCF Transilien
Ligne J: suppression Gisors-Paris. Axe concerné:Gisors-Paris.Train supprimé:Gisors 07h41 - Paris 08h57, mission PETO.Train suivant:Gisors 08h11 - Paris 09h17, mission PACY.Motif: avarie de matériel.SNCF Transilien
RER B :  St-Michel ND non desservi Axes concernés :Robinson/ParisSaint Rémy lès Chevreuse/ParisSt-Michel ND non desservi, dans ce sens.Arrêt à nouveau desservi à partir de 13h40.Motif : bagage abandonné à St-Michel ND.SNCF Transilien
TRA- MONTFERMEIL - LIGNE 645 Suite à des travaux de voirie rue de la Haute Futaie sur la commune deMontfermeil la ligne sera déviée de 8h00 à 17h00 en direction de l'hôpital .-L'arrêt Hôtel de Ville ne sera plus desservi .Vous pourrez vous reporter à l'arrêt Haut Futaie de la ligne 100 situé sur leboulevard Bargue .Veuillez nous excuser de la gêne occasionnée.
Ligne R : Melun Montereau via Héricy interrompu Axe concerné :Melun/Montereau via HéricyTrafic interrompu entre Melun et Montereau, dans ce sens .Reprise des circulations estimée à 16h41.Une substitution routière est mise en place .Motif : incident affectant la signalisation à Vernou-la-Celle-sur-Seine.SNCF Transilien
RER C : Versailles RG/Invalides matinée du 6 mars La matinée du jeudi 5 mars, des travaux de rénovation des voies modifient la circulation du train suivant sur la ligne C du RER :- Le train CIME (destination Versailles Chantiers) initialement prévu à 05h40 au départ de Versailles Château Rive Gauche circule au départ de Chaville Vélizy à 05h48.A Versailles Château Rive Gauche, Porchefontaine et Viroflay Rive Gauche, les voyageurs sont invités à emprunter le train précédent ou le train suivant.Pendant les travaux, covoiturez avec , Transilien vous rembourse.SNCF Transilien
Ligne H :  Trafic ralenti Axes concernés :Paris/LuzarchesParis/Persan Beaumont via Montsoult MaffliersReprise progressive du trafic entre Épinay-sur-Seine - Villetaneuse et Sarcelles - Saint-Brice-sous-Forêt, dans les deux sensPrévoir 20 à 30 minutes supplémentaires de trajet.Fin des ralentissements estimée à 16h00.Motif : acte de malveillance (jets de pierres) à Groslay.SNCF Transilien
RER D: trafic perturbé. Axe concerné:Ensemble de la ligne.Prévoir 10 à 20 minutes supplémentaires de trajet, dans les deux sens.Motif: panne d'un train de marchandises à Villeneuve Saint-Georges.SNCF Transilien
La 23ème édition du Semi-Marathon de Paris. Départ à 10h et arrivée sur l'esplanade du Château de Vincennes. 
