Ligne N :  Sèvres RG non desservi Axe(s) concerné(s) :Ensemble de la ligne non desservi, dans les deux sens.Arrêt à nouveau desservi à partir de 11h00.Motif : bagage abandonné à Sèvres RG.SNCF Transilien
LIGNE 2,3,4: REOUVERTURE DE LA GARE DE CHATOU-CROISSY LE VENDREDI 13 MARS 2015 Nous informons notre aimable clientele que la réouverture de la gare deChatou-Croissy aura lieu le vendredi 13 mars 2015. Les bus des lignes 2,3,4pourront de nouveau desservir la gare routiere de Chatou-Croissy (côté ruePaul Flament).L'itinéraire sera de nouveau normal sur ces lignes.
Ligne N : Epône Mantes la Jolie ralenti Axe concerné :Mantes la Jolie - ParisPrévoir un allongement du temps de trajet de 10 à 20 minutes, dans les deux sens .Fin des ralentissements prévue vers 09h30.Motif : panne d'un train de marchandises à Mantes Station ( incident terminé ) SNCF Transilien
RER B : Aéroport CDG1 non desservi Axe concerné :Paris / Aéroport Charles de Gaulle 2 TGV Aéroport Charles de Gaulle 1 non desservi, dans les deux sens.Arrêt à nouveau desservi à partir de 16h10.Motif : Mesures de sécurité pour un bagage abandonné à Aéroport Charles de Gaulle 1.SNCF Transilien
Métro 8 : trafic interrompu (Balard – Créteil - Pointe du Lac) :En raison de la présence d'un colis suspect, le trafic est interrompu entre les stations Créteil-Prefecture (Hotel de Ville) et Pointe du Lac. Reprise prévue vers 17h00. 
METRO 9 : Trafic interrompu (Pont de Sèvres - Mairie de Montreuil) : En raison de la présence d'un colis suspect, le trafic est interrompu entre les stations Havre-Caumartin et Oberkampf Reprise estimée à 17h30 
RER  B: TRAFIC INTERROMPU  Aéroport Charles de Gaulle - Mitry-Claye - Robinson - Saint-Rémy-lès-Chevreuse: En raison de la présence d'un colis suspect à Aeroport Charles de Gaulle 2 TGV, le trafic est interrompu entre les gares Aeroport Charles de Gaulle 1 et Aeroport Charles de Gaulle 2 TGV. Les voyageurs souhaitant se déplacer entre Aéroport Charles de Gaulle 1 et l'Aéroport Charles de Gaulle 2 TGV sont invités à emprunter le CDGval. Reprise du trafic estimée vers 10h30.
Ligne J : Mantes la Jolie Paris ralenti Axe concerné :Mantes la Jolie - ParisPrévoir un allongement de temps de trajet de 10 à 30 minutes, dans les deux sens .Fin des ralentissements estimée à 09h00. Motif : panne d'un train de marchandises à Mantes Station ( incident terminé ) SNCF Transilien
Ligne J: suppressions Paris-Cormeilles. Axe concerné:Paris Saint-Lazare - Cormeilles en Parisis.Les trains Paris-Cormeilles en Parisis sont supprimés dans les deux sens, jusqu'à 20h00.Motif : incident affectant la signalisation au Stade.SNCF Transilien
