DEVIATION LIGNE 20 SME  En raison des festivités du centenaire de la Guerre de 1914-18, organisées à Claye-Souilly, la ligne SME n°20 sera déviée le 11 novembre 2014, de 7h à 13h.Dans les 2 directions, les arrêts "Claye Eglise", "Claye Mairie" et " Les Tilleuls" ne seront pas desservis.Merci de vous reporter aux arrêts "Zone Industrielle" et "La Rosée".
Ligne U : trafic perturbé jusqu'à 20h00 Présence d'une personne dans les voies à proximité de la gare de Versailles Chantiers sur la ligne N qui impacte la ligne U.L'intervention des forces de l'ordre est terminée et le trafic reprend progressivement.Prévoir un allongement du temps de parcours de 10 à 15 minutes et des modifications ponctuelles de desserte sur l'ensemble de la ligne.Un retour à la normale est estimé vers 20h00.SNCF Transilien
Cérémonie de la commémoration du 11 novembre 1918 A partir de 9 heures : Dépôt de gerbe en présence de nombreuses personnalités angle de la place Charles de Gaulle et de l'avenue des Champs-Elysées. Lignes de Bus déviées dans ce secteur : 22, 28, 30, 31, 42, 52, 72, 80, 83 et 92. 
DEVIATION LIGNE 18 En raison des festivités du centenaire de la Guerre de 1914-18, organisées à Claye-Souilly, la ligne 18 sera déviée le 11 novembre 2014, de 7h à 13h.En direction de "Claye Cimetiere", les arrêts "Les Petits Bois", "Les Fortes Terres", "La Gabrielle", "Mairie" et " Cimetiere" ne seront pas desservis. Le terminus se fera à l'arrêt "Pasteur" des lignes 8 et 9, situé avenue Pasteur.En direction de "Gare de Mitry Claye", les arrêts "Cimetiere" et "Eglise" ne seront pas desservis. Le départ se fera à l'arrêt "La Gabrielle".Veuillez accepter nos excuses pour la gêne occasionnée.
A noter Commémoration du 11 novembre 1918 : En raison de la commémoration du 11 novembre 1918, la station Champs-Elysées Clemenceau est fermée au public mais les correspondances restent assurées. 
RER D : trafic perturbé jusqu'à 15h30 Acte de malveillance ayant nécessité l'application de mesures de sécurité en gare de Stade de France Saint-Denis et panne d'un train en gare de Maisons Alfort sur la ligne D du RER.Prévoir un allongement du temps de parcours de 10 à 15 minutes et des modifications ponctuelles de desserte sur les axes :- Goussainville - Melun via Combs la Ville- Orry la Ville / Villiers le Bel - Corbeil Essonnes / Malesherbes Un retour à la normale est prévu pour 15h30.SNCF Transilien
RER C : trafic perturbé SARA/ELBA/CIME/VICK/JILL Présence d'une personne dans les voies à proximité de la gare de Versailles Chantiers sur la ligne N qui impacte la ligne C du RER.L'intervention des forces de l'ordre est terminée et le trafic a repris.Prévoir un allongement du temps de parcours de 10 à 30 minutes et des modifications ponctuelles de desserte pour les trains SARA (destination Saint-Quentin en Yvelines), CIME (destination Versailles Chantiers), ELBA (destination Etampes), JILL (destination Juvisy) et VICK (destination Versailles Château Rive Gauche).Un retour à la normale est estimé vers 19h00.SNCF Transilien
INFO.TRAFIC LES JOURS FERIES SUR LE RESEAU VALBUS Chers clients,Les lignes du réseau VALBUS, 38.01,38.02,38.03,38.04 ne circulent pas les jours fériés.Par conséquent,  il n'y aura pas de bus en circulation mardi 11 novembre 2014 sur l'ensemble du réseau VALBUS.Merci de votre compréhension.
Ligne N : trafic perturbé jusqu'à 20h00 Présence d'une personne dans les voies à proximité de la gare de Versailles Chantiers sur la ligne N.L'intervention des forces de l'ordre est terminée et le trafic a repris.Cependant, un allongement du temps de parcours de 10 à 30 minutes et des modifications ponctuelles de desserte sont à prévoir sur l'ensemble de la ligne.Un retour à la normale est estimé vers 20h00.SNCF Transilien
Déviation à Bois d'Arcy sur L. 11 le 11/11/14 En raison de la cérémonie commémorative du 11 novembre, la ligne 11 sera déviée.Les arrêts "Hôtel de Ville", "Le Puits", "P.V. Couturier", "Croix Blanche" et "Fritz Lang" ne seront pas desservis le mardi 11 novembre 2014 de 8h00 à 11h00.Pour l?arrêt "Hôtel de Ville" merci de vous reporter à l?arrêt "Chemin Vert" de la ligne 415 SQYBUS.
Ligne P : Paris - Meaux du 10 au 14 novembre Des travaux de construction d'un mur antibruit entre les gares de Chelles - Gournay et Vaires - Torcy modifient la circulation des trains sur la ligne P - axe Paris Est - Meaux - les soirées du lundi 10 au vendredi 14 novembre de 22h30 à la fin de service.Certains trains sont supprimés et,au départ de Paris Est, les trains MICI ne marquent pas l'arrêt en gare de Vaires - Torcy.Une substitution routière est mise en place. SNCF Transilien
Métro 2 trafic perturbé : En répercussion d'une panne de matériel, le trafic reprend progressivement sur l'ensemble de la ligne. 
