Orlyval: trafic interrompu  (Antony - Orly-Sud) : En raison d'un incident technique, le trafic est interrompu sur la ligne 
Ligne J :  suppressions Axes concernés :Mantes La Jolie - Conflans - Paris Saint-LazareTrains supprimés : Ermont Eaubonne, départ 07h03, Paris Saint-lazare, arrivée 07h31, MISSION : PAPECormeilles en Parisis, départ : 06h38, Paris Saint-Lazare, arrivée : 06h57, MISSION : PIZACormeilles en Parisis, départ : 06h58, Paris Saint-Lazare, arrivée : 07h17, MISSION : PIZACormeilles en Parisis, départ : 07h25, Paris Saint-Lazare, arrivée : 07h45, MISSION : PIZACormeilles en Parisis, départ : 07h45, Paris Saint-Lazare, arrivée : 08h05, MISSION : PIZACormeilles en Parisis, départ : 08h05, Paris Saint-Lazare, arrivée : 08h25, MISSION : PIZACormeilles en Parisis, départ : 08h30, Paris Saint-Lazare, arrivée : 08h48, MISSION : PIZACormeilles en Parisis, départ : 08h50, Paris Saint-Lazare, arrivée :
RER A : Paris/Poissy/CergyleH du 09 au 27 fév Des travaux d'entretien des voies entre Nanterre et Cergy le Haut interrompent la circulation sur la ligne A - axes Nanterre Préfecture / Cergy et Poissy - les soirées du lundi au vendredi du 09 février au 27 février 2015 à partir de 21h55, sauf les samedis et dimanches.Pendant les travaux, covoiturez avec , Transilien vous rembourse.SNCF Transilien
Métro 5 station Gare du Nord non desservie : En raison de la présence d'un colis suspect, l'arrêt n'est pas marqué à la station Gare du Nord dans les deux sens de circulation. 
Ligne N : Paris - Rambouillet du 23 au 28 février Des travaux de renouvellement des voies en gare de La Verrière modifient la circulation des trains de la ligne N - axe Paris Montparnasse - Rambouillet - les nuits du lundi 23 / mardi 24 au vendredi 27 / samedi 28 février 2015, à partir de 20h25 jusqu'en début de matinée.Certains trains sont supprimés et un service de bus de remplacement est mis en place.Pendant les travaux, covoiturez avec , Transilien vous rembourse.SNCF Transilien
Ligne J : Paris/Pontoise/Gisors/Mantes ralenti Axe(s) concerné(s) :Paris / Pontoise / GisorsParis / Mantes la Jolie via Conflans Fin d'OisePrévoir 5 à 15 minutes supplémentaires de trajet, dans les deux sens.Fin des ralentissements estimée à 19H30.Motif : incident affectant la voie à Paris Saint Lazare (incident terminé). SNCF Transilien
Ligne J : Paris-Pontoise nuits 16 au 27 févr Des travaux d'entretien des voies entre Paris Saint-Lazare et Pontoise, interrompent la circulation des trains entre Argenteuil et Pontoise dans les deux sens, sur la ligne J - axes Paris Saint-Lazare - Conflans Sainte-Honorine - Pontoise, les nuits du lundi 16 au vendredi 27 février 2015, à partir de 22h00, sauf le samedi et le dimanche.Une substitution routière est mise en place.Pendant les travaux, covoiturez avec , Transilien vous rembourse.SNCF Transilien
RER E : Haussmann- Tournan ralenti Axes concernés :Paris Haussmann Saint Lazare/TournanTrafic ralenti entre Paris Haussmann Saint Lazare et Tournan.Prévoir 20 à 30 minutes supplémentaires de trajet dans les deux sens.Fin des ralentissements estimée à 22h00.Motif : présence de personnes sur les voies à Roissy en Brie.SNCF Transilien
Ligne N :  Paris - Plaisir du 23 au 26 février Des travaux de maintenance des voies entre Saint-Cyr et Plaisir Grignon modifient la circulation des trains de l'axe Paris Montparnasse - Plaisir Grignon, les soirées du lundi 23 / mardi 24 au jeudi 26 / vendredi 27 février, à partir de 22h20. Pendant les travaux, covoiturez avec , Transilien vous rembourse.SNCF Transilien
Ligne P : Paris/Provins/Coulommiers ralenti Axes concernés :Paris / Coulommiers,Paris / Provins.Trafic ralenti Paris et Coulommiers et entre Paris et Provins.Prévoir 20 à 30 minutes supplémentaires de trajet dans les deux sens.Fin des ralentissements estimée à 22h00. Motif : présence de personnes sur les voies à Roissy en Brie.SNCF Transilien
T3b: trafic interrompu  (Porte de Vincennes - Porte de la Chapelle) : En raison de la présence d'un colis suspect, le trafic est interrompu entre les arrêts PORTE DE VINCENNES et PORTE DE BAGNOLET . Trafic normal sur les autres lignes de Tramway. 
Ligne P : Paris-Château Thierry 02 au 27 février Des travaux de maintenance des appareils de voie entre Trilport et Château Thierry modifient la circulation des trains sur la ligne P - axe Paris Est / Château Thierry - les soirées du lundi 2 février au vendredi 27 février 2015 à partir de 23h00, sauf les samedis et dimanches.Dans chaque sens de circulation, les derniers trains sont supprimés et une substitution routière est mise en place. Pendant les travaux, covoiturez avec , Transilien vous rembourse.SNCF Transilien
Ligne U : La Verrière-La Défense 09 au 28 février Des travaux de renouvellement des voies en gare de La Verrière modifient la circulation des trains les nuits du lundi / mardi au vendredi / samedi du 09 février au vendredi 27 février 2015, à partir de 22h25 sur l'axe:- La Verrière - La Défense.La circulation des trains est interrompue dans les deux sens entre La Verrière et La Défense . Un service de bus de remplacement est mis en place.Pendant les travaux, covoiturez avec , Transilien vous rembourse.SNCF Transilien
Ligne N : Paris - Dreux du 23 au 26 février Des travaux de maintenance des voies modifient la circulation des trains de l'axe Paris Montparnasse - Dreux, les soirées du lundi 23 / mardi 24 au jeudi 26 / vendredi 27 février à partir de 22h55. Pendant les travaux, covoiturez avec , Transilien vous rembourse.SNCF Transilien
RER E: Haussmann-Tournan 23 au 27 février Des travaux de modernisation du poste d'aiguillage de Gretz Armainvilliers, en soirée, modifient la circulation des trains de la ligne E du RER - axe Haussmann Saint-Lazare / Villiers sur Marne / Tournan - du lundi 23 février au vendredi 27 février 2015 à partir de 23h56.Pendant les travaux, covoiturez avec , Transilien vous rembourse.SNCF Transilien
Ligne J : Paris-Conflans-Mantes du 02 au 27 fév Des opérations de maintenance sur les voies, entraînent la suppression du dernier train au départ de Conflans Sainte-Honorine pour Mantes la Jolie, sur la ligne J, les nuits du lundi 02 / mardi 03 février au vendredi 27 / samedi 28 février 2015, sauf les week-ends.Un service de bus de substitution est mis en place .Pendant les travaux, covoiturez avec , Transilien vous rembourse.SNCF Transilien
RER D : Paris-Villeneuve StG 22 au 26 février Des travaux modifient la circulation des trains entre Paris Gare de Lyon et Villeneuve Saint-Georges, sur la ligne D du RER, les nuits du dimanche 22 / lundi 23 février au jeudi 26 / vendredi 27 février 2015, de 22h56 jusqu'en fin de service, ainsi que les matinées du mardi 24 au vendredi 27 février.Certains arrêts ne sont pas desservis.Une substitution routière est mise en place au départ de Paris Lyon Grandes Lignes . Pendant les travaux, covoiturez avec , Transilien vous rembourse.SNCF Transilien
Fin travaux Ligne 15 Reprise normale de la ligne 15 et desserte des arrêts "LE MESLE et LA COLONIE"à compter du lundi 02 mars 2015, les travaux de réfection de chaussée sontterminés.
Ligne J: Paris/Gisors/Mantes via Conflans ralenti Axe(s) concerné(s) :Paris/Pontoise/GisorsParis/Mantes la Jolie via Conflans Fin d'OisePrévoir 10 à 15 minutes supplémentaires de trajet, dans ce sens.Fin des ralentissements estimée à 17h00.Motif : malaise d'un voyageur à Cormeilles en Parisis.SNCF Transilien
Info Trafic du 24/02/2015 Nous vous informons que les départs suivants ne seront pas assurés ce jour :Ligne DO Lieusaint : 5h17 en direction Les Gres                                      5h55 en direction Les Gres                                      6h56 en direction Les GresLigne DO Moissy :  5h26 en direction de Porte de Paris                                   6h25 en direction de Porte de Paris                                   7h25 en direction de Moissy GareNous vous présentons vos excuces pour la gêne occasionnée. Bonne journée.
